smartctl 6.6 2016-05-31 r4324 [x86_64-linux-5.3.0-40-generic] (local build)
Copyright (C) 2002-16, Bruce Allen, Christian Franke, www.smartmontools.org

=== START OF INFORMATION SECTION ===
Model Family:     SAMSUNG SpinPoint T166
Device Model:     SAMSUNG HD501LJ
Serial Number:    S1K4J1NQ405160
LU WWN Device Id: 5 0000f0 01b405160
Firmware Version: CR100-10
User Capacity:    500.107.862.016 bytes [500 GB]
Sector Size:      512 bytes logical/physical
Device is:        In smartctl database [for details use: -P show]
ATA Version is:   ATA8-ACS T13/1699-D revision 3b
SATA Version is:  SATA 2.5, 3.0 Gb/s
Local Time is:    Sat Feb 29 23:22:03 2020 CET
SMART support is: Available - device has SMART capability.
SMART support is: Enabled
AAM level is:     128 (quiet), recommended: 254
APM feature is:   Unavailable
Rd look-ahead is: Enabled
Write cache is:   Enabled
ATA Security is:  Disabled, NOT FROZEN [SEC1]
Wt Cache Reorder: Enabled

=== START OF READ SMART DATA SECTION ===
SMART overall-health self-assessment test result: PASSED

General SMART Values:
Offline data collection status:  (0x00)	Offline data collection activity
					was never started.
					Auto Offline Data Collection: Disabled.
Self-test execution status:      (   0)	The previous self-test routine completed
					without error or no self-test has ever 
					been run.
Total time to complete Offline 
data collection: 		( 8961) seconds.
Offline data collection
capabilities: 			 (0x5b) SMART execute Offline immediate.
					Auto Offline data collection on/off support.
					Suspend Offline collection upon new
					command.
					Offline surface scan supported.
					Self-test supported.
					No Conveyance Self-test supported.
					Selective Self-test supported.
SMART capabilities:            (0x0003)	Saves SMART data before entering
					power-saving mode.
					Supports SMART auto save timer.
Error logging capability:        (0x01)	Error logging supported.
					General Purpose Logging supported.
Short self-test routine 
recommended polling time: 	 (   2) minutes.
Extended self-test routine
recommended polling time: 	 ( 153) minutes.
SCT capabilities: 	       (0x003f)	SCT Status supported.
					SCT Error Recovery Control supported.
					SCT Feature Control supported.
					SCT Data Table supported.

SMART Attributes Data Structure revision number: 16
Vendor Specific SMART Attributes with Thresholds:
ID# ATTRIBUTE_NAME          FLAGS    VALUE WORST THRESH FAIL RAW_VALUE
  1 Raw_Read_Error_Rate     POSR--   253   100   051    -    0
  3 Spin_Up_Time            POS---   100   100   015    -    7488
  4 Start_Stop_Count        -O--CK   100   100   000    -    365
  5 Reallocated_Sector_Ct   PO--CK   253   253   010    -    0
  7 Seek_Error_Rate         POSR--   253   253   051    -    0
  8 Seek_Time_Performance   P-S--K   253   253   015    -    0
  9 Power_On_Hours          -O--CK   253   253   000    -    182
 10 Spin_Retry_Count        PO--CK   253   253   051    -    0
 11 Calibration_Retry_Count -O--C-   253   100   000    -    0
 12 Power_Cycle_Count       -O--CK   100   100   000    -    266
187 Reported_Uncorrect      -O--CK   253   253   000    -    0
188 Command_Timeout         -O--CK   253   253   000    -    0
190 Airflow_Temperature_Cel -O---K   072   052   000    -    28
194 Temperature_Celsius     -O---K   154   094   000    -    28
195 Hardware_ECC_Recovered  -O-RC-   100   100   000    -    21366
196 Reallocated_Event_Count -O--CK   253   253   000    -    0
197 Total_Pending_Sectors   -O--C-   253   253   000    -    0
198 Offline_Uncorrectable   ----CK   253   253   000    -    0
199 UDMA_CRC_Error_Count    -OSRCK   200   200   000    -    103
200 Multi_Zone_Error_Rate   -O-R--   253   100   000    -    0
201 Soft_Read_Error_Rate    -O-R--   253   100   000    -    0
202 Data_Address_Mark_Errs  -O--CK   100   100   000    -    2
                            ||||||_ K auto-keep
                            |||||__ C event count
                            ||||___ R error rate
                            |||____ S speed/performance
                            ||_____ O updated online
                            |______ P prefailure warning

General Purpose Log Directory Version 1
SMART           Log Directory Version 1 [multi-sector log support]
Address    Access  R/W   Size  Description
0x00       GPL,SL  R/O      1  Log Directory
0x01           SL  R/O      1  Summary SMART error log
0x02           SL  R/O      2  Comprehensive SMART error log
0x03       GPL     R/O      2  Ext. Comprehensive SMART error log
0x06           SL  R/O      1  SMART self-test log
0x10       GPL     R/O      1  SATA NCQ Queued Error log
0x11       GPL     R/O      1  SATA Phy Event Counters log
0x80-0x9f  GPL,SL  R/W     16  Host vendor specific log

SMART Extended Comprehensive Error Log Version: 1 (2 sectors)
Invalid Error Log index = 0x0000, trying reserved byte (0x04) instead
Device Error Count: 132 (device log contains only the most recent 8 errors)
	CR     = Command Register
	FEATR  = Features Register
	COUNT  = Count (was: Sector Count) Register
	LBA_48 = Upper bytes of LBA High/Mid/Low Registers ]  ATA-8
	LH     = LBA High (was: Cylinder High) Register    ]   LBA
	LM     = LBA Mid (was: Cylinder Low) Register      ] Register
	LL     = LBA Low (was: Sector Number) Register     ]
	DV     = Device (was: Device/Head) Register
	DC     = Device Control Register
	ER     = Error register
	ST     = Status register
Powered_Up_Time is measured from power on, and printed as
DDd+hh:mm:SS.sss where DD=days, hh=hours, mm=minutes,
SS=sec, and sss=millisec. It "wraps" after 49.710 days.

Error 132 [3] occurred at disk power-on lifetime: 182 hours (7 days + 14 hours)
  When the command that caused the error occurred, the device was active or idle.

  After command completion occurred, registers were:
  ER -- ST COUNT  LBA_48  LH LM LL DV DC
  -- -- -- == -- == == == -- -- -- -- --
  84 -- 51 00 c0 00 00 00 00 00 28 40 00  Error: ICRC, ABRT 192 sectors at LBA = 0x00000028 = 40

  Commands leading to the command that caused the error were:
  CR FEATR COUNT  LBA_48  LH LM LL DV DC  Powered_Up_Time  Command/Feature_Name
  -- == -- == -- == == == -- -- -- -- --  ---------------  --------------------
  25 00 00 00 c0 00 00 00 00 00 28 40 00     00:07:19.625  READ DMA EXT
  25 00 00 00 08 00 00 00 00 08 38 40 00     00:07:19.563  READ DMA EXT
  25 00 00 00 01 00 00 3a 38 60 2f 40 00     00:07:19.563  READ DMA EXT
  25 00 00 00 01 00 00 3a 38 60 2e 40 00     00:07:19.563  READ DMA EXT
  25 00 00 00 01 00 00 3a 38 60 2d 40 00     00:07:19.563  READ DMA EXT

Error 131 [2] occurred at disk power-on lifetime: 182 hours (7 days + 14 hours)
  When the command that caused the error occurred, the device was active or idle.

  After command completion occurred, registers were:
  ER -- ST COUNT  LBA_48  LH LM LL DV DC
  -- -- -- == -- == == == -- -- -- -- --
  84 -- 51 00 08 00 00 00 00 08 00 40 00  Error: ICRC, ABRT 8 sectors at LBA = 0x00000800 = 2048

  Commands leading to the command that caused the error were:
  CR FEATR COUNT  LBA_48  LH LM LL DV DC  Powered_Up_Time  Command/Feature_Name
  -- == -- == -- == == == -- -- -- -- --  ---------------  --------------------
  25 00 00 00 08 00 00 00 00 08 00 40 00     00:07:18.500  READ DMA EXT
  ec 00 00 00 01 00 00 00 00 00 00 00 00     00:07:18.500  IDENTIFY DEVICE
  25 00 00 00 08 00 00 3a 38 57 f0 40 00     00:07:18.500  READ DMA EXT
  e5 00 00 00 00 00 00 00 00 00 00 00 00     00:07:18.500  CHECK POWER MODE
  25 00 00 00 08 00 00 3a 38 57 80 40 00     00:07:18.500  READ DMA EXT

Error 130 [1] occurred at disk power-on lifetime: 181 hours (7 days + 13 hours)
  When the command that caused the error occurred, the device was active or idle.

  After command completion occurred, registers were:
  ER -- ST COUNT  LBA_48  LH LM LL DV DC
  -- -- -- == -- == == == -- -- -- -- --
  84 -- 51 01 80 00 00 00 00 08 80 40 00  Error: ICRC, ABRT 384 sectors at LBA = 0x00000880 = 2176

  Commands leading to the command that caused the error were:
  CR FEATR COUNT  LBA_48  LH LM LL DV DC  Powered_Up_Time  Command/Feature_Name
  -- == -- == -- == == == -- -- -- -- --  ---------------  --------------------
  25 da da 01 80 00 00 00 00 08 80 40 00     00:00:10.188  READ DMA EXT
  25 da da 00 38 00 00 00 00 08 40 40 00     00:00:10.188  READ DMA EXT
  25 da da 00 18 00 00 00 00 08 20 40 00     00:00:10.188  READ DMA EXT
  25 da da 00 08 00 00 00 00 08 10 40 00     00:00:10.188  READ DMA EXT
  25 da da 00 08 00 00 00 00 08 78 40 00     00:00:10.188  READ DMA EXT

Error 129 [0] occurred at disk power-on lifetime: 72 hours (3 days + 0 hours)
  When the command that caused the error occurred, the device was active or idle.

  After command completion occurred, registers were:
  ER -- ST COUNT  LBA_48  LH LM LL DV DC
  -- -- -- == -- == == == -- -- -- -- --
  84 -- 51 01 00 00 00 00 01 83 07 40 00  Error: ICRC, ABRT 256 sectors at LBA = 0x00018307 = 99079

  Commands leading to the command that caused the error were:
  CR FEATR COUNT  LBA_48  LH LM LL DV DC  Powered_Up_Time  Command/Feature_Name
  -- == -- == -- == == == -- -- -- -- --  ---------------  --------------------
  25 00 00 01 00 00 00 00 01 83 07 40 00     18:21:51.938  READ DMA EXT
  25 00 00 01 00 00 00 00 01 82 07 40 00     18:21:51.625  READ DMA EXT
  25 00 00 01 00 00 00 00 01 81 07 40 00     18:21:51.500  READ DMA EXT
  25 00 00 00 60 00 00 00 01 80 a7 40 00     18:21:51.438  READ DMA EXT
  25 00 00 00 28 00 00 00 01 80 7f 40 00     18:21:51.438  READ DMA EXT

Error 128 [7] occurred at disk power-on lifetime: 54 hours (2 days + 6 hours)
  When the command that caused the error occurred, the device was active or idle.

  After command completion occurred, registers were:
  ER -- ST COUNT  LBA_48  LH LM LL DV DC
  -- -- -- == -- == == == -- -- -- -- --
  84 -- 51 01 00 00 00 00 02 93 07 40 00  Error: ICRC, ABRT 256 sectors at LBA = 0x00029307 = 168711

  Commands leading to the command that caused the error were:
  CR FEATR COUNT  LBA_48  LH LM LL DV DC  Powered_Up_Time  Command/Feature_Name
  -- == -- == -- == == == -- -- -- -- --  ---------------  --------------------
  25 00 00 01 00 00 00 00 02 93 07 40 00     00:00:29.938  READ DMA EXT
  ea 00 00 00 00 00 00 00 00 00 00 40 00     00:00:29.250  FLUSH CACHE EXT
  35 00 00 00 08 00 00 00 b7 5b 3d 40 00     00:00:29.250  WRITE DMA EXT
  ea 00 00 00 00 00 00 00 00 00 00 40 00     00:00:29.250  FLUSH CACHE EXT
  35 00 00 00 01 00 00 00 1e a4 3d 40 00     00:00:29.188  WRITE DMA EXT

Error 127 [6] occurred at disk power-on lifetime: 54 hours (2 days + 6 hours)
  When the command that caused the error occurred, the device was active or idle.

  After command completion occurred, registers were:
  ER -- ST COUNT  LBA_48  LH LM LL DV DC
  -- -- -- == -- == == == -- -- -- -- --
  84 -- 51 01 00 00 00 00 02 8e 07 40 00  Error: ICRC, ABRT 256 sectors at LBA = 0x00028e07 = 167431

  Commands leading to the command that caused the error were:
  CR FEATR COUNT  LBA_48  LH LM LL DV DC  Powered_Up_Time  Command/Feature_Name
  -- == -- == -- == == == -- -- -- -- --  ---------------  --------------------
  25 00 00 01 00 00 00 00 02 8e 07 40 00     00:00:27.250  READ DMA EXT
  25 00 00 01 00 00 00 00 02 8d 07 40 00     00:00:27.063  READ DMA EXT
  25 00 00 01 00 00 00 00 02 8c 07 40 00     00:00:26.938  READ DMA EXT
  25 00 00 01 00 00 00 00 02 8b 07 40 00     00:00:26.813  READ DMA EXT
  25 00 00 01 00 00 00 00 02 8a 07 40 00     00:00:26.750  READ DMA EXT

Error 126 [5] occurred at disk power-on lifetime: 54 hours (2 days + 6 hours)
  When the command that caused the error occurred, the device was active or idle.

  After command completion occurred, registers were:
  ER -- ST COUNT  LBA_48  LH LM LL DV DC
  -- -- -- == -- == == == -- -- -- -- --
  84 -- 51 01 00 00 00 00 01 aa 17 40 00  Error: ICRC, ABRT 256 sectors at LBA = 0x0001aa17 = 109079

  Commands leading to the command that caused the error were:
  CR FEATR COUNT  LBA_48  LH LM LL DV DC  Powered_Up_Time  Command/Feature_Name
  -- == -- == -- == == == -- -- -- -- --  ---------------  --------------------
  25 00 00 01 00 00 00 00 01 aa 17 40 00     11:56:03.563  READ DMA EXT
  35 00 00 00 02 00 00 00 6b 0f 9a 40 00     11:56:03.500  WRITE DMA EXT
  35 00 00 00 08 00 00 00 33 c4 f5 40 00     11:56:03.500  WRITE DMA EXT
  35 00 00 00 02 00 00 00 6b 0f 98 40 00     11:56:03.500  WRITE DMA EXT
  35 00 00 00 08 00 00 00 33 c4 f5 40 00     11:56:03.500  WRITE DMA EXT

Error 125 [4] occurred at disk power-on lifetime: 54 hours (2 days + 6 hours)
  When the command that caused the error occurred, the device was active or idle.

  After command completion occurred, registers were:
  ER -- ST COUNT  LBA_48  LH LM LL DV DC
  -- -- -- == -- == == == -- -- -- -- --
  84 -- 51 01 00 00 00 00 01 a6 17 40 00  Error: ICRC, ABRT 256 sectors at LBA = 0x0001a617 = 108055

  Commands leading to the command that caused the error were:
  CR FEATR COUNT  LBA_48  LH LM LL DV DC  Powered_Up_Time  Command/Feature_Name
  -- == -- == -- == == == -- -- -- -- --  ---------------  --------------------
  25 00 00 01 00 00 00 00 01 a6 17 40 00     11:55:58.875  READ DMA EXT
  35 00 00 00 02 00 00 00 6b 0f 32 40 00     11:55:58.875  WRITE DMA EXT
  35 00 00 00 08 00 00 00 33 c4 ed 40 00     11:55:58.875  WRITE DMA EXT
  35 00 00 00 02 00 00 00 6b 0f 30 40 00     11:55:58.750  WRITE DMA EXT
  35 00 00 00 08 00 00 00 33 c4 ed 40 00     11:55:58.750  WRITE DMA EXT

SMART Extended Self-test Log (GP Log 0x07) not supported

SMART Self-test log structure revision number 1
No self-tests have been logged.  [To run self-tests, use: smartctl -t]

SMART Selective self-test log data structure revision number 0
Note: revision number not 1 implies that no selective self-test has ever been run
 SPAN  MIN_LBA  MAX_LBA  CURRENT_TEST_STATUS
    1        0        0  Not_testing
    2        0        0  Not_testing
    3        0        0  Not_testing
    4        0        0  Not_testing
    5        0        0  Not_testing
Selective self-test flags (0x0):
  After scanning selected spans, do NOT read-scan remainder of disk.
If Selective self-test is pending on power-up, resume after 0 minute delay.

SCT Status Version:                  3
SCT Version (vendor specific):       256 (0x0100)
SCT Support Level:                   1
Device State:                        Active (0)
Current Temperature:                    28 Celsius
Power Cycle Min/Max Temperature:     27/28 Celsius
Lifetime    Min/Max Temperature:      9/48 Celsius
Under/Over Temperature Limit Count:   0/0

SCT Temperature History Version:     2
Temperature Sampling Period:         1 minute
Temperature Logging Interval:        1 minute
Min/Max recommended Temperature:     -4/72 Celsius
Min/Max Temperature Limit:           -9/77 Celsius
Temperature History Size (Index):    128 (73)

Index    Estimated Time   Temperature Celsius
  74    2020-02-29 21:15    41  **********************
  75    2020-02-29 21:16    30  ***********
  76    2020-02-29 21:17    40  *********************
  77    2020-02-29 21:18    40  *********************
  78    2020-02-29 21:19    17  -
  79    2020-02-29 21:20    19  -
  80    2020-02-29 21:21    20  *
  81    2020-02-29 21:22    21  **
  82    2020-02-29 21:23    21  **
  83    2020-02-29 21:24    22  ***
  84    2020-02-29 21:25    23  ****
  85    2020-02-29 21:26    24  *****
  86    2020-02-29 21:27    25  ******
  87    2020-02-29 21:28    25  ******
  88    2020-02-29 21:29    26  *******
  89    2020-02-29 21:30    27  ********
  90    2020-02-29 21:31    27  ********
  91    2020-02-29 21:32    28  *********
  92    2020-02-29 21:33    28  *********
  93    2020-02-29 21:34    29  **********
  94    2020-02-29 21:35    29  **********
  95    2020-02-29 21:36    30  ***********
  96    2020-02-29 21:37    30  ***********
  97    2020-02-29 21:38    30  ***********
  98    2020-02-29 21:39    31  ************
  99    2020-02-29 21:40    31  ************
 100    2020-02-29 21:41    32  *************
 101    2020-02-29 21:42    32  *************
 102    2020-02-29 21:43    32  *************
 103    2020-02-29 21:44    33  **************
 104    2020-02-29 21:45    33  **************
 105    2020-02-29 21:46    35  ****************
 106    2020-02-29 21:47    35  ****************
 107    2020-02-29 21:48    35  ****************
 108    2020-02-29 21:49    36  *****************
 109    2020-02-29 21:50    36  *****************
 110    2020-02-29 21:51    30  ***********
 111    2020-02-29 21:52    31  ************
 112    2020-02-29 21:53    31  ************
 113    2020-02-29 21:54    19  -
 114    2020-02-29 21:55    20  *
 115    2020-02-29 21:56    20  *
 116    2020-02-29 21:57    21  **
 117    2020-02-29 21:58    22  ***
 118    2020-02-29 21:59    23  ****
 119    2020-02-29 22:00    24  *****
 120    2020-02-29 22:01    35  ****************
 121    2020-02-29 22:02    25  ******
 122    2020-02-29 22:03    26  *******
 123    2020-02-29 22:04    26  *******
 124    2020-02-29 22:05    27  ********
 125    2020-02-29 22:06    28  *********
 126    2020-02-29 22:07    28  *********
 127    2020-02-29 22:08    28  *********
   0    2020-02-29 22:09    29  **********
   1    2020-02-29 22:10    29  **********
   2    2020-02-29 22:11    30  ***********
   3    2020-02-29 22:12    30  ***********
   4    2020-02-29 22:13    31  ************
   5    2020-02-29 22:14    31  ************
   6    2020-02-29 22:15    32  *************
   7    2020-02-29 22:16    32  *************
   8    2020-02-29 22:17    32  *************
   9    2020-02-29 22:18    33  **************
  10    2020-02-29 22:19    33  **************
  11    2020-02-29 22:20    35  ****************
  12    2020-02-29 22:21    35  ****************
  13    2020-02-29 22:22    35  ****************
  14    2020-02-29 22:23    32  *************
  15    2020-02-29 22:24    19  -
  16    2020-02-29 22:25    20  *
  17    2020-02-29 22:26    21  **
  18    2020-02-29 22:27    22  ***
  19    2020-02-29 22:28    22  ***
  20    2020-02-29 22:29    23  ****
  21    2020-02-29 22:30    24  *****
  22    2020-02-29 22:31    24  *****
  23    2020-02-29 22:32    25  ******
  24    2020-02-29 22:33    26  *******
  25    2020-02-29 22:34    27  ********
  26    2020-02-29 22:35    27  ********
  27    2020-02-29 22:36    28  *********
  28    2020-02-29 22:37    28  *********
  29    2020-02-29 22:38    28  *********
  30    2020-02-29 22:39    29  **********
  31    2020-02-29 22:40    29  **********
  32    2020-02-29 22:41    30  ***********
  33    2020-02-29 22:42    30  ***********
  34    2020-02-29 22:43    31  ************
  35    2020-02-29 22:44    31  ************
  36    2020-02-29 22:45    32  *************
  37    2020-02-29 22:46    32  *************
  38    2020-02-29 22:47    32  *************
  39    2020-02-29 22:48    33  **************
  40    2020-02-29 22:49    33  **************
  41    2020-02-29 22:50    33  **************
  42    2020-02-29 22:51    35  ****************
 ...    ..(  2 skipped).    ..  ****************
  45    2020-02-29 22:54    35  ****************
  46    2020-02-29 22:55    36  *****************
  47    2020-02-29 22:56    36  *****************
  48    2020-02-29 22:57    37  ******************
  49    2020-02-29 22:58    41  **********************
  50    2020-02-29 22:59    19  -
  51    2020-02-29 23:00    20  *
  52    2020-02-29 23:01    20  *
  53    2020-02-29 23:02    21  **
  54    2020-02-29 23:03    22  ***
  55    2020-02-29 23:04    23  ****
  56    2020-02-29 23:05    37  ******************
  57    2020-02-29 23:06    22  ***
  58    2020-02-29 23:07    23  ****
  59    2020-02-29 23:08    23  ****
  60    2020-02-29 23:09    24  *****
  61    2020-02-29 23:10    38  *******************
  62    2020-02-29 23:11    25  ******
  63    2020-02-29 23:12    26  *******
  64    2020-02-29 23:13    27  ********
  65    2020-02-29 23:14    28  *********
  66    2020-02-29 23:15    28  *********
  67    2020-02-29 23:16    28  *********
  68    2020-02-29 23:17    29  **********
  69    2020-02-29 23:18    29  **********
  70    2020-02-29 23:19    41  **********************
  71    2020-02-29 23:20    27  ********
  72    2020-02-29 23:21    28  *********
  73    2020-02-29 23:22    41  **********************

SCT Error Recovery Control:
           Read: Disabled
          Write: Disabled

Device Statistics (GP/SMART Log 0x04) not supported

SATA Phy Event Counters (GP Log 0x11)
ID      Size     Value  Description
0x0001  2            0  Command failed due to ICRC error
0x0002  2            0  R_ERR response for data FIS
0x0003  2            0  R_ERR response for device-to-host data FIS
0x0004  2            0  R_ERR response for host-to-device data FIS
0x0005  2            0  R_ERR response for non-data FIS
0x0006  2            0  R_ERR response for device-to-host non-data FIS
0x0007  2            0  R_ERR response for host-to-device non-data FIS
0x0008  2            0  Device-to-host non-data FIS retries
0x0009  2            0  Transition from drive PhyRdy to drive PhyNRdy
0x000a  2            0  Device-to-host register FISes sent due to a COMRESET
0x000b  2            0  CRC errors within host-to-device FIS
0x000d  2            0  Non-CRC errors within host-to-device FIS
0x000f  2            0  R_ERR response for host-to-device data FIS, CRC
0x0010  2            0  R_ERR response for host-to-device data FIS, non-CRC
0x0012  2            0  R_ERR response for host-to-device non-data FIS, CRC
0x0013  2            0  R_ERR response for host-to-device non-data FIS, non-CRC
0x8001  2            0  Vendor specific

