Sheet: Sheet1
A1: DT | B1: ID | C1: Model | D1: Size | E1: Partitioning | F1: Serial Number | G1: Assessment | H1: Powered On | I1: Avg. Read Rate | J1: Avg. Write Rate | K1: Avg. Access Time | L1: Model | M1: Serial | N1: Size | O1: Partition table | P1: Heads | Q1: Sectors/track | R1: Cylinders | S1: Total sectors | T1: Sector size | U1: Info | V1: free | W1: ebay
A2: -C001 | B2: ata-SAMSUNG_HD300LJ_S0D7J1FL605006 | C2: SAMSUNG HD300LJ (ZT100-12) | D2: 300 GB (300.069.052.416 bytes) | F2: S0D7J1FL605006 | G2: Disk is OK (20° C / 68° F) | H2: 2 years, 3 months and 20 days | I2: 48,7 MB/s (100 samples) | J2: 27,4 MB/s (100 samples) | K2: 15,78 msec (1000 samples) | L2: ASMT 2115 | M2: S0D7J1FL605006 | N2: 279.46 GiB | O2: unrecognized | R2: 36481 | S2: 586072368 | T2: 512 | U2: Unknown (nvidia_raid_member 100) | V2: 0
A3: -C002 | B3: ata-SAMSUNG_HD300LJ_S0D7J13LB03919 | C3: SAMSUNG HD300LJ (ZT100-13) | D3: 300 GB (300.067.970.560 bytes) | E3: Unknown () | F3: S0D7J13LB03919 | G3: Disk is OK (20° C / 68° F) | H3: 1 year, 8 months and 3 days | I3: 49,1 MB/s (100 samples) | J3: 27,5 MB/s (100 samples) | K3: 15,94 msec (1000 samples) | L3: ASMT 2115 | M3: S0D7J13LB03919 | N3: 279.46 GiB | O3: loop | R3: 36481 | S3: 586070255 | T3: 512 | U3: VA | V3: 218
A4: -C003 | B4: ata-SAMSUNG_HD300LJ_S0D7J13LB03910 | C4: SAMSUNG HD300LJ (ZT100-13) | D4: 300 GB (300.067.970.560 bytes) | E4: Unknown () | F4: S0D7J13LB03910 | G4: Disk is OK (24° C / 75° F) | H4: 1 year, 1 month and 8 days | I4: 48,2 MB/s (100 samples) | J4: 27,3 MB/s (100 samples) | K4: 15,83 msec (1000 samples) | L4: ASMT 2115 | M4: S0D7J13LB03910 | N4: 279.46 GiB | O4: msdos | R4: 36481 | S4: 586070255 | T4: 512 | U4: MONI RAINER | V4: 192
A5: -C004 | B5: ata-SAMSUNG_HD300LJ_S0D7J1FL501724 | C5: SAMSUNG HD300LJ (ZT100-12) | D5: 300 GB (300.067.970.560 bytes) | E5: Master Boot Record | F5: S0D7J1FL501724 | G5: Disk is OK (23° C / 73° F) | H5: 8 months and 11 days | I5: 49,0 MB/s (100 samples) | J5: 27,7 MB/s (100 samples) | K5: 15,79 msec (1000 samples) | L5: ASMT 2115 | M5: S0D7J1FL501724 | N5: 279.46 GiB | O5: msdos | R5: 36481 | S5: 586070255 | T5: 512 | U5: SEAR | V5: 256
A6: -C005 | B6: ata-Hitachi_HDS721010DLE630_MSE5215V08DRKU | C6: Hitachi HDS721010DLE630 (MS2OA5R0) | D6: 1,0 TB (1.000.204.886.016 bytes) | E6: Master Boot Record | F6: MSE5215V08DRKU | G6: Disk is OK (25° C / 77° F) | H6: 2 months and 29 days | I6: 150,9 MB/s (100 samples) | J6: 97,2 MB/s (100 samples) | K6: 18,43 msec (1000 samples) | L6: ASMT 2115 | M6: MSE5215V08DRKU | N6: 931.51 GiB | O6: msdos | P6: 255 | Q6: 63 | R6: 121601 | S6: 1953525168 | T6: 512
A7: -C006 | B7: ata-SAMSUNG_HD501LJ_S0Z4J1FP907224 | C7: SAMSUNG HD501LJ (CR100-10) | D7: 500 GB (500.107.862.016 bytes) | E7: Master Boot Record | F7: S0Z4J1FP907224 | G7: Disk is OK (20° C / 68° F) | H7: 3 years, 0 months and 14 days | I7: 56,6 MB/s (100 samples) | J7: 53,4 MB/s (100 samples) | K7: 14,75 msec (1000 samples) | L7: ASMT 2115 | M7: S0Z4J1FP907224 | N7: 465.76 GiB | O7: msdos | P7: 255 | Q7: 63 | R7: 60801 | S7: 976773168 | T7: 512 | U7: misc viele
A8: -C007 | B8: ata-WDC_WD10EZEX-22RKKA0_WD-WCC1S6269549 | C8: WDC WD10EZEX-22RKKA0 (80.00A80) | D8: 1,0 TB (1.000.204.886.016 bytes) | E8: GUID Partition Table | F8: WD-WCC1S6269549 | G8: Disk is OK (24° C / 75° F) | H8: 2 years, 1 month and 17 days | I8: 163,6 MB/s (100 samples) | J8: 100,1 MB/s (100 samples) | K8: 15,13 msec (1000 samples) | L8: ASMT 2115 | M8: WD-WCC1S6269549 | N8: 931.51 GiB | O8: gpt | P8: 255 | Q8: 63 | R8: 121601 | S8: 1953525168 | T8: 512
A9: -C008 | B9: ata-WDC_WD5000AAKX-001CA0_WD-WCAYUS005843 | C9: WDC WD5000AAKX-001CA0 (15.01H15) | D9: 500 GB (500.107.862.016 bytes) | E9: Master Boot Record | F9: WD-WCAYUS005843 | G9: Disk is OK (26° C / 79° F) | H9: 1 month and 4 days | I9: 105,0 MB/s (100 samples) | J9: 73,1 MB/s (100 samples) | K9: 16,17 msec (1000 samples) | L9: ASMT 2115 | M9: WD-WCAYUS005843 | N9: 465.76 GiB | O9: msdos | P9: 255 | Q9: 63 | R9: 60801 | S9: 976773168 | T9: 512
A10: -C009 | B10: ata-TOSHIBA_DT01ACA100_Y2IMXX1PS | C10: TOSHIBA DT01ACA100 (MS2OA750) | D10: 1,0 TB (1.000.204.886.016 bytes) | E10: Master Boot Record | F10: Y2IMXX1PS | G10: Disk is OK (33° C / 91° F) | H10: 9 days and 20 hours | I10: 165,4 MB/s (100 samples) | J10: 97,2 MB/s (100 samples) | K10: 18,36 msec (1000 samples) | L10: ASMT 2115 | M10: Y2IMXX1PS | N10: 931.51 GiB | O10: msdos | P10: 255 | Q10: 63 | R10: 121601 | S10: 1953525168 | T10: 512
A11: -C010 | B11: ata-Hitachi_HDT721010SLA360_STF601MH00XEAB | C11: Hitachi HDT721010SLA360 (ST6OA3AA) | D11: 1,0 TB (1.000.204.886.016 bytes) | E11: Master Boot Record | F11: STF601MH00XEAB | G11: Disk is OK (29° C / 84° F) | H11: 7 months and 2 days | I11: 95,1 MB/s (100 samples) | J11: 73,6 MB/s (100 samples) | K11: 13,72 msec (1000 samples) | L11: ASMT 2115 | M11: STF601MH00XEAB | N11: 931.51 GiB | O11: msdos | P11: 255 | Q11: 63 | R11: 121601 | S11: 1953525168 | T11: 512
A12: -C011 | B12: ata-WDC_WD10EAVS-00D7B1_WD-WCAU46649856 | C12: 2115 (0) | D12: — | F12: 00000000000000000000 | G12: SMART is not supported
A13: -C012 | B13: ata-WDC_WD10EZEX-22RKKA0_WD-WCC1S6274413 | C13: WDC WD10EZEX-22RKKA0 (80.00A80) | D13: 1,0 TB (1.000.204.886.016 bytes) | E13: GUID Partition Table | F13: WD-WCC1S6274413 | G13: Disk is OK (24° C / 75° F) | H13: 4 months and 19 days | I13: 149,8 MB/s (100 samples) | J13: 94,4 MB/s (100 samples) | K13: 15,06 msec (1000 samples) | L13: ASMT 2115 | M13: WD-WCC1S6274413 | N13: 931.51 GiB | O13: gpt | P13: 255 | Q13: 63 | R13: 121601 | S13: 1953525168 | T13: 512
A14: -C013 | B14: ata-WDC_WD10EAVS-00D7B0_WD-WCAU41582391 | C14: WDC WD10EAVS-00D7B0 (01.01A01) | D14: 1,0 TB (1.000.204.886.016 bytes) | E14: Master Boot Record | F14: WD-WCAU41582391 | G14: Disk is OK, one bad sector (27° C / 81° F) | H14: 1 year, 8 months and 14 days | I14: 75,6 MB/s (100 samples) | J14: 47,5 MB/s (100 samples) | K14: 20,24 msec (1000 samples) | L14: ASMT 2115 | M14: WD-WCAU41582391 | N14: 931.51 GiB | O14: msdos | P14: 255 | Q14: 63 | R14: 121601 | S14: 1953525168 | T14: 512
A15: -C014 | B15: ata-ST380815AS_9RW3YTML | C15: ST380815AS (4.ADA) | D15: 80 GB (80.000.000.000 bytes) | E15: Master Boot Record | F15: Master Boot Record | G15: Disk is OK, 671 bad sectors (36° C / 97° F) | H15: 6 months and 11 days | I15: aborted | U15: 14P RECOVERY | V15: 32
A16: -C015 | B16: ata-WDC_WD800JD-55MUA1_WD-WMAMD6021658 | C16: WDC WD800JD-55MUA1 (10.01E01) | D16: 80 GB (80.026.361.856 bytes) | E16: Master Boot Record | F16: WD-WMAMD6021658 | G16: Disk is OK, one attribute failed in the past (16° C / 61° F) | H16: 2 years, 10 months and 0 days | I16: 52,2 MB/s (100 samples) | J16: 28,2 MB/s (100 samples) | K16: 19,40 msec (1000 samples) | U16: anwender
A17: -C016 | B17: ata-ST3250310AS_6RY3A2DF | C17: ST3250310AS (3.AAB) | D17: 250 GB (250.059.350.016 bytes) | E17: Master Boot Record | F17: 6RY3A2DF | G17: Disk is OK, one attribute failed in the past (25° C / 77° F) | H17: 1 year, 3 months and 15 days | I17: 73,5 MB/s (100 samples) | J17: 35,3 MB/s (100 samples) | K17: 15,64 msec (1000 samples) | U17: PQSERVICE ACER
A18: -C017 | B18: ata-ST340014AS_5MQ233GB | C18: ST340014AS (8.12) | D18: 40 GB (40.000.000.000 bytes) | E18: Master Boot Record | F18: 5MQ233GB | G18: Disk is OK (21° C / 70° F) | H18: 1 year, 3 months and 11 days | I18: 49,0 MB/s (100 samples) | J18: 26,6 MB/s (100 samples) | K18: 13,23 msec (1000 samples) | U18: daniel
A19: -C018 | B19: ata-Maxtor_6V080E0_V22TQT7G | C19: Maxtor 6V080E0 (VA111680) | D19: 80 GB (80.026.361.856 bytes) | E19: Master Boot Record | F19: V22TQT7G | G19: Disk is OK (28° C / 82° F) | H19: 3 years, 2 months and 22 days | I19: 56,4 MB/s (100 samples) | J19: 27,2 MB/s (100 samples) | K19: 14,67 msec (1000 samples) | L19: ASMT 2115 | M19: V22TQT7G | N19: 74.53 GiB | O19: msdos | R19: 9729 | S19: 156301488 | T19: 512 | U19: Horst Menzel
A20: -C019 | B20: ata-Hitachi_HDS721680PLA380_PVFB34ZLTNVBZB | C20: Hitachi HDS721680PLA380 (P21OABNA) | D20: 80 GB (80.000.000.000 bytes) | E20: Master Boot Record | F20: PVFB34ZLTNVBZB | G20: Disk is OK, one bad sector (44° C / 111° F) | H20: 6 months and 10 days | I20: 62,8 MB/s (100 samples) | J20: 30,5 MB/s (100 samples) | K20: 13,89 msec (1000 samples) | U20: empty tcs viktor
A21: -C020 | B21: ata-ExcelStor_Technology_J880S_PFDB30K2CVCMMB | C21: ExcelStor Technology J880S (PF2OA60A) | D21: 82 GB (82.348.277.760 bytes) | E21: Master Boot Record | F21: PFDB30K2CVCMMB | G21: Disk is OK, 3 bad sectors (25° C / 77° F) | H21: 1 year, 4 months and 7 days | I21: 48,9 MB/s (100 samples) | J21: 38,2 MB/s (100 samples) | K21: 13,37 msec (1000 samples)
A22: -C021 | B22: ata-SAMSUNG_HD502HI_S1VZJ90Z267756 | C22: SAMSUNG HD502HI (1AG01118) | D22: 500 GB (500.107.862.016 bytes) | E22: Master Boot Record | F22: S1VZJ90Z267756 | G22: Disk is OK (25° C / 77° F) | H22: 5 months and 9 days | I22: 90,0 MB/s (100 samples) | J22: 52,9 MB/s (100 samples) | K22: 15,41 msec (1000 samples) | U22: MB-Mobil2016 Sicherung | V22: 59 | W22: 274258031319
A23: -C022 | B23: ata-ST3500312CS_6VVE41C1 | C23: ST3500312CS (SS16) | D23: 500 GB (500.107.862.016 bytes) | E23: Master Boot Record | F23: 6VVE41C1 | G23: Disk is OK, one attribute failed in the past (36° C / 97° F) | H23: 4 years, 5 months and 4 days | I23: 91,0 MB/s (100 samples) | J23: 49,8 MB/s (100 samples) | K23: 16,14 msec (1000 samples) | U23: MB-Mobil2016 System | W23: 193338343808
A24: -C023 | B24: ata-Hitachi_HTS543225A7A384_E00G42333PDJLS | C24: Hitachi HTS543225A7A384 (ESBOA60W) | D24: 250 GB (250.059.350.016 bytes) | E24: Master Boot Record | F24: E00G42333PDJLS | G24: Disk is OK (29° C / 84° F) | H24: 9 months and 19 days | I24: 64,2 MB/s (100 samples) | J24: 34,9 MB/s (100 samples) | K24: 18,03 msec (1000 samples) | U24: empty scan | V24: 250 | W24: 124070672661
A25: -C024 | B25: ata-SAMSUNG_HD501LJ_S1K4J1NQ405160 | C25: SAMSUNG HD501LJ (CR100-10) | D25: 500 GB (500.107.862.016 bytes) | E25: GUID Partition Table | F25: S1K4J1NQ405160 | G25: Disk is OK (30° C / 86° F) | H25: 7 days and 14 hours | I25: 52,3 MB/s (100 samples) | J25: 44,8 MB/s (100 samples) | K25: 16,44 msec (1000 samples) | U25: Recover! Disconnect error? | V25: 500 | W25: 153825941740
A26: -C025 | B26: ata-ST3320418AS_9VMVQ1CZ | C26: ST3320418AS (CC46) | D26: 320 GB (320.072.933.376 bytes) | E26: Master Boot Record | F26: 9VMVQ1CZ | G26: Disk is OK (23° C / 73° F) | H26: 1 year, 2 months and 14 days | I26: 86,8 MB/s (100 samples) | J26: 55,1 MB/s (100 samples) | K26: 14,40 msec (1000 samples) | U26: Recover! | W26: 174185954988
A27: -C026 | B27: ata-WDC_WD10EZRX-00A8LB0 | C27: WDC WD10EZRX-00A8LB0 | D27: — | F27: WDC_WD10EZRX-00A8LB0 | G27: SMART is not supported | U27: malfunction | W27: 193331850028
A28: -C027 | B28: ata-Hitachi_HDP725050GLA360_GEC534RJ2SHUTJ | C28: Hitachi HDP725050GLA360 (GM4OA5CA) | D28: 500 GB (500.107.862.016 bytes) | F28: GEC534RJ2SHUTJ | G28: Disk is OK (44° C / 111° F) | H28: 4 months and 21 days | I28: 82,3 MB/s (100 samples) | J28: 55,3 MB/s (100 samples) | K28: 18,68 msec (1000 samples) | U28: Recover! Adat | W28: 114107746078
A29: -C028 | B29: ata-Corsair_Force_3_SSD_11246518000007430954 | C29: Corsair Force 3 SSD (1.2) | D29: 60 GB (60.022.480.896 bytes) | F29: 11246518000007430954 | G29: Disk is OK (0° C / 32° F) | H29: 9 months and 14 days | I29: 156,2 MB/s (100 samples) | J29: 78,0 MB/s (100 samples) | K29: 0,46 msec (1000 samples) | U29: empty scan | W29: 264630005041
A30: -C029 | B30: ata-Hitachi_HTS545016B9A300_101122PBPB08EC0UJGNF | C30: Hitachi HTS545016B9A300 (PBBOC60S) | D30: 160 GB (160.041.885.696 bytes) | E30: Master Boot Record | F30: 101122PBPB08EC0UJGNF | G30: Disk is OK (26° C / 79° F) | H30: 3 days and 5 hours | I30: 50,7 MB/s (100 samples) | J30: 35,3 MB/s (100 samples) | K30: 18,46 msec (1000 samples) | U30: scanned | W30: 333496955459
A31: -C030 | B31: ata-SK_hynix_SC210_2.5_7MM_256GB_EJ55N76521180641L | C31: SK hynix SC210 2.5 7MM 256GB (20001L00) | D31: 256 GB (256.060.514.304 bytes) | E31: GUID Partition Table | F31: EJ55N76521180641L | G31: Disk is OK (28° C / 82° F) | H31: 2 months and 24 days | I31: 256,9 MB/s (100 samples) | J31: 231,1 MB/s (100 samples) | K31: 0,27 msec (1000 samples) | L31: ASMT 2115 | M31: EJ55N76521180641L | N31: 238.47 GiB | O31: gpt | P31: 255 | Q31: 63 | R31: 31130 | S31: 500118192 | T31: 512
A32: -C031 | B32: ata-TOSHIBA_MQ03ABB200_371IC5YCT | C32: TOSHIBA MQ03ABB200 (JP050U) | D32: 2,0 TB (2.000.398.934.016 bytes) | E32: Master Boot Record | F32: 371IC5YCT | G32: Disk is OK, 1432 bad sectors (28° C / 82° F) | H32: 3 months and 29 days | I32: 102,1 MB/s (100 samples) | J32: 38,6 MB/s (100 samples) | K32: 17,84 msec (1000 samples)
A33: -C032 | B33: usb-Intenso_External_USB_3.0_20170614154EC-0:0 | C33: Intenso External USB 3.0 (1201) | D33: 2,0 TB (2.000.398.934.016 bytes) | E33: Master Boot Record | F33: 20170614154EC
A34: -C033 | B34: ata-SAMSUNG_HN-M750MBB_S2SHJ9BB603222 | C34: SAMSUNG HN-M750MBB (2AR10001) | D34: 750 GB (750.156.374.016 bytes) | E34: Master Boot Record | F34: S2SHJ9BB603222 | G34: Disk is OK (27° C / 81° F) | H34: 2 months and 5 days
A35: -C034 | B35: ata-WDC_WD1600AAJS-00L7A0_WD-WMAV3E499032 | C35: WDC WD1600AAJS-00L7A0 (01.03E01) | D35: 160 GB (160.041.885.696 bytes) | E35: Master Boot Record | F35: Master Boot Record | G35: Disk is OK (29° C / 84° F) | H35: 1 year, 3 months and 21 days | I35: 83,8 MB/s (100 samples) | J35: 47,4 MB/s (100 samples) | K35: 15,71 msec (1000 samples) | U35: Recover! | W35: 202901454540
A36: -C035 | B36: ata-Hitachi_HDT721016SLA380_STA0L7MB35MARB | C36: Hitachi HDT721016SLA380 (ST1OA3AA) | D36: 160 GB (160.041.885.696 bytes) | E36: Master Boot Record | F36: STA0L7MB35MARB | G36: Disk is OK (29° C / 84° F) | H36: 10 months and 21 days | I36: 100,6 MB/s (100 samples) | J36: 61,4 MB/s (100 samples) | K36: 17,75 msec (1000 samples) | U36: Recover! | W36: 202900161018
A37: -CE001 | B37: ata-Samsung_SSD_850_EVO_500GB_S21JNXAGC64845L | C37: Samsung SSD 850 EVO 500GB (EMT02B6Q) | D37: 500 GB (500.107.862.016 bytes) | E37: Master Boot Record | F37: S21JNXAGC64845L | G37: Disk is OK (30° C / 86° F) | H37: 4 months and 7 days | I37: 236,7 MB/s (100 samples) | J37: 153,5 MB/s (100 samples) | K37: 0,25 msec (1000 samples) | L37: ASMT 2115 | M37: S21JNXAGC64845L | N37: 465.76 GiB | O37: msdos | R37: 60801 | S37: 976773168 | T37: 512 | U37: MB-Mobil2016
A38: -CE002 | B38: ata-HGST_HTS721075A9E630_JR11004M16LA5F | C38: HGST HTS721075A9E630 (JB2OA3T0) | D38: 750 GB (750.156.374.016 bytes) | E38: Master Boot Record | F38: JR11004M16LA5F | G38: Disk is OK (26° C / 79° F) | H38: 4 months and 6 days | I38: 91,1 MB/s (100 samples) | J38: 52,4 MB/s (100 samples) | K38: 15,49 msec (1000 samples) | L38: ASMT 2115 | M38: JR11004M16LA5F | N38: 698.64 GiB | O38: msdos | R38: 91201 | S38: 1465149168 | T38: 512 | U38: MB-Mobil2016
A39: -CE003 | B39: ata-WDC_WD7500BPVT-60HXZT3_WD-WX21E43CAH33 | C39: WDC WD7500BPVT-60HXZT3 (01.01A01) | D39: 750 GB (750.156.374.016 bytes) | E39: Master Boot Record | F39: WD-WX21E43CAH33 | G39: Disk is OK (26° C / 79° F) | H39: 1 year, 6 months and 14 days | I39: 80,9 MB/s (100 samples) | J39: 51,5 MB/s (100 samples) | K39: 17,63 msec (1000 samples) | L39: ASMT 2115 | M39: WD-WX21E43CAH33 | N39: 698.64 GiB | O39: msdos | R39: 91201 | S39: 1465149168 | T39: 512 | U39: Bindig-NB2013
B40: usb-WD_Elements_25A3_574343374B30565236393341-0:0 | C40: WD Elements 25A3 (1019) | D40: 4,0 TB (4.000.752.599.040 bytes) | E40: GUID Partition Table | F40: 574343374B30565236393341 | I40: 147,6 MB/s (100 samples) | J40: 149,8 MB/s (100 samples) | K40: 16,57 msec (1000 samples) | L40: WD Elements 25A3 | M40: WD-WCC7K0VR693A | N40: 3.64 TiB | O40: gpt | P40: 255 | Q40: 63 | R40: 486397 | S40: 7813969920 | T40: 512
B41: nvme-KBG20ZMS512G_NVMe_TOSHIBA_512GB_67NPA0T0PQRU | C41: KBG20ZMS512G NVMe TOSHIBA 512GB | D41: 512 GB (512.110.190.592 bytes) | E41: Master Boot Record | F41: 67NPA0T0PQRU | I41: 983,0 MB/s (1000 samples) | J41: – | K41: 0,21 msec (1000 samples) | L41: KBG20ZMS512G NVMe TOSHIBA 512GB | M41: none | N41: 476.94 GiB | O41: msdos | P41: 255 | Q41: 63 | R41: 62260 | S41: 1000215216 | T41: 512
B42: ata-Hitachi_HTS543216L9SA00_090924FB2203BNGV996A | C42: Hitachi HTS543216L9SA00 (FB2OC43C) | D42: 160 GB (160.041.885.696 bytes) | E42: Master Boot Record | F42: 090924FB2203BNGV996A | G42: Disk is OK (37° C / 99° F) | H42: 5 months and 2 days | I42: 46,5 MB/s (100 samples) | J42: 22,7 MB/s (100 samples) | K42: 18,41 msec (1000 samples) | L42: ASMT 2115 | M42: 090924FB2203BNGV996A | N42: 149.05 GiB | O42: msdos | P42: 255 | Q42: 63 | R42: 19457 | S42: 312581808 | T42: 512 | U42: REINER-TOSH
B43: usb-AI_Mass_Storage-0:0 | C43: AI Mass Storage (0100) | D43: 8,1 GB (8.069.890.048 bytes) | E43: Master Boot Record | F43: AI_Mass_Storage-0:0 | I43: 19,6 MB/s (100 samples) | J43: 10,0 MB/s (100 samples) | K43: 6,47 msec (1000 samples) | L43: AI Mass Storage | M43: none | N43: 7.52 GiB | O43: msdos | P43: 255 | Q43: 63 | R43: 981 | S43: 15761504 | T43: 512 | U43: MTDVD YUMI
A44: -C036 | B44: ata-ST250DM000-1BD141_S2A50B8B | C44: ST250DM000-1BD141 (KC45) | D44: 250 GB (250.059.350.016 bytes) | E44: Master Boot Record | F44: S2A50B8B | G44: Disk is OK (38° C / 100° F) | H44: 9 months and 11 days | I44: 104,1 MB/s (100 samples) | J44: 35,7 MB/s (100 samples) | K44: 16,05 msec (1000 samples)

Sheet: Sheet2
A1: of:=[$Sheet1.A1] -> DT | B1: of:=[$Sheet1.B1] -> ID | C1: of:=[$Sheet1.C1] -> Model | D1: of:=[$Sheet1.D1] -> Size | E1: Size B | F1: Size GB | G1: of:=[$Sheet1.E1] -> Partitioning | H1: of:=[$Sheet1.F1] -> Serial Number
A2: of:=[$Sheet1.A2] -> -C001 | B2: of:=[$Sheet1.B2] -> ata-SAMSUNG_HD300LJ_S0D7J1FL605006 | C2: of:=[$Sheet1.C2] -> SAMSUNG HD300LJ (ZT100-12) | D2: of:=[$Sheet1.D2] -> 300 GB (300.069.052.416 bytes) | E2: of:=IFERROR(SUBSTITUTE(SUBSTITUTE(RIGHT([.D2];LEN([.D2])-SEARCH("(";[.D2]));" bytes)";"");".";""); ) -> 300069052416 | F2: of:=[.E2]/1024/1024/1024 -> 279.461082458496 | G2: of:=[$Sheet1.E2] -> 0 | H2: of:=[$Sheet1.F2] -> S0D7J1FL605006
A3: of:=[$Sheet1.A3] -> -C002 | B3: of:=[$Sheet1.B3] -> ata-SAMSUNG_HD300LJ_S0D7J13LB03919 | C3: of:=[$Sheet1.C3] -> SAMSUNG HD300LJ (ZT100-13) | D3: of:=[$Sheet1.D3] -> 300 GB (300.067.970.560 bytes) | E3: of:=IFERROR(SUBSTITUTE(SUBSTITUTE(RIGHT([.D3];LEN([.D3])-SEARCH("(";[.D3]));" bytes)";"");".";""); ) -> 300067970560 | F3: of:=[.E3]/1024/1024/1024 -> 279.460074901581 | G3: of:=[$Sheet1.E3] -> Unknown () | H3: of:=[$Sheet1.F3] -> S0D7J13LB03919
A4: of:=[$Sheet1.A4] -> -C003 | B4: of:=[$Sheet1.B4] -> ata-SAMSUNG_HD300LJ_S0D7J13LB03910 | C4: of:=[$Sheet1.C4] -> SAMSUNG HD300LJ (ZT100-13) | D4: of:=[$Sheet1.D4] -> 300 GB (300.067.970.560 bytes) | E4: of:=IFERROR(SUBSTITUTE(SUBSTITUTE(RIGHT([.D4];LEN([.D4])-SEARCH("(";[.D4]));" bytes)";"");".";""); ) -> 300067970560 | F4: of:=[.E4]/1024/1024/1024 -> 279.460074901581 | G4: of:=[$Sheet1.E4] -> Unknown () | H4: of:=[$Sheet1.F4] -> S0D7J13LB03910
A5: of:=[$Sheet1.A5] -> -C004 | B5: of:=[$Sheet1.B5] -> ata-SAMSUNG_HD300LJ_S0D7J1FL501724 | C5: of:=[$Sheet1.C5] -> SAMSUNG HD300LJ (ZT100-12) | D5: of:=[$Sheet1.D5] -> 300 GB (300.067.970.560 bytes) | E5: of:=IFERROR(SUBSTITUTE(SUBSTITUTE(RIGHT([.D5];LEN([.D5])-SEARCH("(";[.D5]));" bytes)";"");".";""); ) -> 300067970560 | F5: of:=[.E5]/1024/1024/1024 -> 279.460074901581 | G5: of:=[$Sheet1.E5] -> Master Boot Record | H5: of:=[$Sheet1.F5] -> S0D7J1FL501724
A6: of:=[$Sheet1.A6] -> -C005 | B6: of:=[$Sheet1.B6] -> ata-Hitachi_HDS721010DLE630_MSE5215V08DRKU | C6: of:=[$Sheet1.C6] -> Hitachi HDS721010DLE630 (MS2OA5R0) | D6: of:=[$Sheet1.D6] -> 1,0 TB (1.000.204.886.016 bytes) | E6: of:=IFERROR(SUBSTITUTE(SUBSTITUTE(RIGHT([.D6];LEN([.D6])-SEARCH("(";[.D6]));" bytes)";"");".";""); ) -> 1000204886016 | F6: of:=[.E6]/1024/1024/1024 -> 931.513389587402 | G6: of:=[$Sheet1.E6] -> Master Boot Record | H6: of:=[$Sheet1.F6] -> MSE5215V08DRKU
A7: of:=[$Sheet1.A7] -> -C006 | B7: of:=[$Sheet1.B7] -> ata-SAMSUNG_HD501LJ_S0Z4J1FP907224 | C7: of:=[$Sheet1.C7] -> SAMSUNG HD501LJ (CR100-10) | D7: of:=[$Sheet1.D7] -> 500 GB (500.107.862.016 bytes) | E7: of:=IFERROR(SUBSTITUTE(SUBSTITUTE(RIGHT([.D7];LEN([.D7])-SEARCH("(";[.D7]));" bytes)";"");".";""); ) -> 500107862016 | F7: of:=[.E7]/1024/1024/1024 -> 465.761741638184 | G7: of:=[$Sheet1.E7] -> Master Boot Record | H7: of:=[$Sheet1.F7] -> S0Z4J1FP907224
A8: of:=[$Sheet1.A8] -> -C007 | B8: of:=[$Sheet1.B8] -> ata-WDC_WD10EZEX-22RKKA0_WD-WCC1S6269549 | C8: of:=[$Sheet1.C8] -> WDC WD10EZEX-22RKKA0 (80.00A80) | D8: of:=[$Sheet1.D8] -> 1,0 TB (1.000.204.886.016 bytes) | E8: of:=IFERROR(SUBSTITUTE(SUBSTITUTE(RIGHT([.D8];LEN([.D8])-SEARCH("(";[.D8]));" bytes)";"");".";""); ) -> 1000204886016 | F8: of:=[.E8]/1024/1024/1024 -> 931.513389587402 | G8: of:=[$Sheet1.E8] -> GUID Partition Table | H8: of:=[$Sheet1.F8] -> WD-WCC1S6269549
A9: of:=[$Sheet1.A9] -> -C008 | B9: of:=[$Sheet1.B9] -> ata-WDC_WD5000AAKX-001CA0_WD-WCAYUS005843 | C9: of:=[$Sheet1.C9] -> WDC WD5000AAKX-001CA0 (15.01H15) | D9: of:=[$Sheet1.D9] -> 500 GB (500.107.862.016 bytes) | E9: of:=IFERROR(SUBSTITUTE(SUBSTITUTE(RIGHT([.D9];LEN([.D9])-SEARCH("(";[.D9]));" bytes)";"");".";""); ) -> 500107862016 | F9: of:=[.E9]/1024/1024/1024 -> 465.761741638184 | G9: of:=[$Sheet1.E9] -> Master Boot Record | H9: of:=[$Sheet1.F9] -> WD-WCAYUS005843
A10: of:=[$Sheet1.A10] -> -C009 | B10: of:=[$Sheet1.B10] -> ata-TOSHIBA_DT01ACA100_Y2IMXX1PS | C10: of:=[$Sheet1.C10] -> TOSHIBA DT01ACA100 (MS2OA750) | D10: of:=[$Sheet1.D10] -> 1,0 TB (1.000.204.886.016 bytes) | E10: of:=IFERROR(SUBSTITUTE(SUBSTITUTE(RIGHT([.D10];LEN([.D10])-SEARCH("(";[.D10]));" bytes)";"");".";""); ) -> 1000204886016 | F10: of:=[.E10]/1024/1024/1024 -> 931.513389587402 | G10: of:=[$Sheet1.E10] -> Master Boot Record | H10: of:=[$Sheet1.F10] -> Y2IMXX1PS
A11: of:=[$Sheet1.A11] -> -C010 | B11: of:=[$Sheet1.B11] -> ata-Hitachi_HDT721010SLA360_STF601MH00XEAB | C11: of:=[$Sheet1.C11] -> Hitachi HDT721010SLA360 (ST6OA3AA) | D11: of:=[$Sheet1.D11] -> 1,0 TB (1.000.204.886.016 bytes) | E11: of:=IFERROR(SUBSTITUTE(SUBSTITUTE(RIGHT([.D11];LEN([.D11])-SEARCH("(";[.D11]));" bytes)";"");".";""); ) -> 1000204886016 | F11: of:=[.E11]/1024/1024/1024 -> 931.513389587402 | G11: of:=[$Sheet1.E11] -> Master Boot Record | H11: of:=[$Sheet1.F11] -> STF601MH00XEAB
A12: of:=[$Sheet1.A12] -> -C011 | B12: of:=[$Sheet1.B12] -> ata-WDC_WD10EAVS-00D7B1_WD-WCAU46649856 | C12: of:=[$Sheet1.C12] -> 2115 (0) | D12: of:=[$Sheet1.D12] -> — | E12: of:=IFERROR(SUBSTITUTE(SUBSTITUTE(RIGHT([.D12];LEN([.D12])-SEARCH("(";[.D12]));" bytes)";"");".";""); ) -> 0 | F12: of:=[.E12]/1024/1024/1024 -> 0 | G12: of:=[$Sheet1.E12] -> 0 | H12: of:=[$Sheet1.F12] -> 00000000000000000000
A13: of:=[$Sheet1.A13] -> -C012 | B13: of:=[$Sheet1.B13] -> ata-WDC_WD10EZEX-22RKKA0_WD-WCC1S6274413 | C13: of:=[$Sheet1.C13] -> WDC WD10EZEX-22RKKA0 (80.00A80) | D13: of:=[$Sheet1.D13] -> 1,0 TB (1.000.204.886.016 bytes) | E13: of:=IFERROR(SUBSTITUTE(SUBSTITUTE(RIGHT([.D13];LEN([.D13])-SEARCH("(";[.D13]));" bytes)";"");".";""); ) -> 1000204886016 | F13: of:=[.E13]/1024/1024/1024 -> 931.513389587402 | G13: of:=[$Sheet1.E13] -> GUID Partition Table | H13: of:=[$Sheet1.F13] -> WD-WCC1S6274413
A14: of:=[$Sheet1.A14] -> -C013 | B14: of:=[$Sheet1.B14] -> ata-WDC_WD10EAVS-00D7B0_WD-WCAU41582391 | C14: of:=[$Sheet1.C14] -> WDC WD10EAVS-00D7B0 (01.01A01) | D14: of:=[$Sheet1.D14] -> 1,0 TB (1.000.204.886.016 bytes) | E14: of:=IFERROR(SUBSTITUTE(SUBSTITUTE(RIGHT([.D14];LEN([.D14])-SEARCH("(";[.D14]));" bytes)";"");".";""); ) -> 1000204886016 | F14: of:=[.E14]/1024/1024/1024 -> 931.513389587402 | G14: of:=[$Sheet1.E14] -> Master Boot Record | H14: of:=[$Sheet1.F14] -> WD-WCAU41582391
A15: of:=[$Sheet1.A15] -> -C014 | B15: of:=[$Sheet1.B15] -> ata-ST380815AS_9RW3YTML | C15: of:=[$Sheet1.C15] -> ST380815AS (4.ADA) | D15: of:=[$Sheet1.D15] -> 80 GB (80.000.000.000 bytes) | E15: of:=IFERROR(SUBSTITUTE(SUBSTITUTE(RIGHT([.D15];LEN([.D15])-SEARCH("(";[.D15]));" bytes)";"");".";""); ) -> 80000000000 | F15: of:=[.E15]/1024/1024/1024 -> 74.5058059692383 | G15: of:=[$Sheet1.E15] -> Master Boot Record | H15: of:=[$Sheet1.F15] -> Master Boot Record
A16: of:=[$Sheet1.A16] -> -C015 | B16: of:=[$Sheet1.B16] -> ata-WDC_WD800JD-55MUA1_WD-WMAMD6021658 | C16: of:=[$Sheet1.C16] -> WDC WD800JD-55MUA1 (10.01E01) | D16: of:=[$Sheet1.D16] -> 80 GB (80.026.361.856 bytes) | E16: of:=IFERROR(SUBSTITUTE(SUBSTITUTE(RIGHT([.D16];LEN([.D16])-SEARCH("(";[.D16]));" bytes)";"");".";""); ) -> 80026361856 | F16: of:=[.E16]/1024/1024/1024 -> 74.5303573608399 | G16: of:=[$Sheet1.E16] -> Master Boot Record | H16: of:=[$Sheet1.F16] -> WD-WMAMD6021658
A17: of:=[$Sheet1.A17] -> -C016 | B17: of:=[$Sheet1.B17] -> ata-ST3250310AS_6RY3A2DF | C17: of:=[$Sheet1.C17] -> ST3250310AS (3.AAB) | D17: of:=[$Sheet1.D17] -> 250 GB (250.059.350.016 bytes) | E17: of:=IFERROR(SUBSTITUTE(SUBSTITUTE(RIGHT([.D17];LEN([.D17])-SEARCH("(";[.D17]));" bytes)";"");".";""); ) -> 250059350016 | F17: of:=[.E17]/1024/1024/1024 -> 232.885917663574 | G17: of:=[$Sheet1.E17] -> Master Boot Record | H17: of:=[$Sheet1.F17] -> 6RY3A2DF
A18: of:=[$Sheet1.A18] -> -C017 | B18: of:=[$Sheet1.B18] -> ata-ST340014AS_5MQ233GB | C18: of:=[$Sheet1.C18] -> ST340014AS (8.12) | D18: of:=[$Sheet1.D18] -> 40 GB (40.000.000.000 bytes) | E18: of:=IFERROR(SUBSTITUTE(SUBSTITUTE(RIGHT([.D18];LEN([.D18])-SEARCH("(";[.D18]));" bytes)";"");".";""); ) -> 40000000000 | F18: of:=[.E18]/1024/1024/1024 -> 37.2529029846191 | G18: of:=[$Sheet1.E18] -> Master Boot Record | H18: of:=[$Sheet1.F18] -> 5MQ233GB
A19: of:=[$Sheet1.A19] -> -C018 | B19: of:=[$Sheet1.B19] -> ata-Maxtor_6V080E0_V22TQT7G | C19: of:=[$Sheet1.C19] -> Maxtor 6V080E0 (VA111680) | D19: of:=[$Sheet1.D19] -> 80 GB (80.026.361.856 bytes) | E19: of:=IFERROR(SUBSTITUTE(SUBSTITUTE(RIGHT([.D19];LEN([.D19])-SEARCH("(";[.D19]));" bytes)";"");".";""); ) -> 80026361856 | F19: of:=[.E19]/1024/1024/1024 -> 74.5303573608399 | G19: of:=[$Sheet1.E19] -> Master Boot Record | H19: of:=[$Sheet1.F19] -> V22TQT7G
A20: of:=[$Sheet1.A20] -> -C019 | B20: of:=[$Sheet1.B20] -> ata-Hitachi_HDS721680PLA380_PVFB34ZLTNVBZB | C20: of:=[$Sheet1.C20] -> Hitachi HDS721680PLA380 (P21OABNA) | D20: of:=[$Sheet1.D20] -> 80 GB (80.000.000.000 bytes) | E20: of:=IFERROR(SUBSTITUTE(SUBSTITUTE(RIGHT([.D20];LEN([.D20])-SEARCH("(";[.D20]));" bytes)";"");".";""); ) -> 80000000000 | F20: of:=[.E20]/1024/1024/1024 -> 74.5058059692383 | G20: of:=[$Sheet1.E20] -> Master Boot Record | H20: of:=[$Sheet1.F20] -> PVFB34ZLTNVBZB
A21: of:=[$Sheet1.A21] -> -C020 | B21: of:=[$Sheet1.B21] -> ata-ExcelStor_Technology_J880S_PFDB30K2CVCMMB | C21: of:=[$Sheet1.C21] -> ExcelStor Technology J880S (PF2OA60A) | D21: of:=[$Sheet1.D21] -> 82 GB (82.348.277.760 bytes) | E21: of:=IFERROR(SUBSTITUTE(SUBSTITUTE(RIGHT([.D21];LEN([.D21])-SEARCH("(";[.D21]));" bytes)";"");".";""); ) -> 82348277760 | F21: of:=[.E21]/1024/1024/1024 -> 76.6928100585938 | G21: of:=[$Sheet1.E21] -> Master Boot Record | H21: of:=[$Sheet1.F21] -> PFDB30K2CVCMMB
A22: of:=[$Sheet1.A22] -> -C021 | B22: of:=[$Sheet1.B22] -> ata-SAMSUNG_HD502HI_S1VZJ90Z267756 | C22: of:=[$Sheet1.C22] -> SAMSUNG HD502HI (1AG01118) | D22: of:=[$Sheet1.D22] -> 500 GB (500.107.862.016 bytes) | E22: of:=IFERROR(SUBSTITUTE(SUBSTITUTE(RIGHT([.D22];LEN([.D22])-SEARCH("(";[.D22]));" bytes)";"");".";""); ) -> 500107862016 | F22: of:=[.E22]/1024/1024/1024 -> 465.761741638184 | G22: of:=[$Sheet1.E22] -> Master Boot Record | H22: of:=[$Sheet1.F22] -> S1VZJ90Z267756
A23: of:=[$Sheet1.A23] -> -C022 | B23: of:=[$Sheet1.B23] -> ata-ST3500312CS_6VVE41C1 | C23: of:=[$Sheet1.C23] -> ST3500312CS (SS16) | D23: of:=[$Sheet1.D23] -> 500 GB (500.107.862.016 bytes) | E23: of:=IFERROR(SUBSTITUTE(SUBSTITUTE(RIGHT([.D23];LEN([.D23])-SEARCH("(";[.D23]));" bytes)";"");".";""); ) -> 500107862016 | F23: of:=[.E23]/1024/1024/1024 -> 465.761741638184 | G23: of:=[$Sheet1.E23] -> Master Boot Record | H23: of:=[$Sheet1.F23] -> 6VVE41C1
A24: of:=[$Sheet1.A24] -> -C023 | B24: of:=[$Sheet1.B24] -> ata-Hitachi_HTS543225A7A384_E00G42333PDJLS | C24: of:=[$Sheet1.C24] -> Hitachi HTS543225A7A384 (ESBOA60W) | D24: of:=[$Sheet1.D24] -> 250 GB (250.059.350.016 bytes) | E24: of:=IFERROR(SUBSTITUTE(SUBSTITUTE(RIGHT([.D24];LEN([.D24])-SEARCH("(";[.D24]));" bytes)";"");".";""); ) -> 250059350016 | F24: of:=[.E24]/1024/1024/1024 -> 232.885917663574 | G24: of:=[$Sheet1.E24] -> Master Boot Record | H24: of:=[$Sheet1.F24] -> E00G42333PDJLS
A25: of:=[$Sheet1.A25] -> -C024 | B25: of:=[$Sheet1.B25] -> ata-SAMSUNG_HD501LJ_S1K4J1NQ405160 | C25: of:=[$Sheet1.C25] -> SAMSUNG HD501LJ (CR100-10) | D25: of:=[$Sheet1.D25] -> 500 GB (500.107.862.016 bytes) | E25: of:=IFERROR(SUBSTITUTE(SUBSTITUTE(RIGHT([.D25];LEN([.D25])-SEARCH("(";[.D25]));" bytes)";"");".";""); ) -> 500107862016 | F25: of:=[.E25]/1024/1024/1024 -> 465.761741638184 | G25: of:=[$Sheet1.E25] -> GUID Partition Table | H25: of:=[$Sheet1.F25] -> S1K4J1NQ405160
A26: of:=[$Sheet1.A26] -> -C025 | B26: of:=[$Sheet1.B26] -> ata-ST3320418AS_9VMVQ1CZ | C26: of:=[$Sheet1.C26] -> ST3320418AS (CC46) | D26: of:=[$Sheet1.D26] -> 320 GB (320.072.933.376 bytes) | E26: of:=IFERROR(SUBSTITUTE(SUBSTITUTE(RIGHT([.D26];LEN([.D26])-SEARCH("(";[.D26]));" bytes)";"");".";""); ) -> 320072933376 | F26: of:=[.E26]/1024/1024/1024 -> 298.091148376465 | G26: of:=[$Sheet1.E26] -> Master Boot Record | H26: of:=[$Sheet1.F26] -> 9VMVQ1CZ
A27: of:=[$Sheet1.A27] -> -C026 | B27: of:=[$Sheet1.B27] -> ata-WDC_WD10EZRX-00A8LB0 | C27: of:=[$Sheet1.C27] -> WDC WD10EZRX-00A8LB0 | D27: of:=[$Sheet1.D27] -> — | E27: of:=IFERROR(SUBSTITUTE(SUBSTITUTE(RIGHT([.D27];LEN([.D27])-SEARCH("(";[.D27]));" bytes)";"");".";""); ) -> 0 | F27: of:=[.E27]/1024/1024/1024 -> 0 | G27: of:=[$Sheet1.E27] -> 0 | H27: of:=[$Sheet1.F27] -> WDC_WD10EZRX-00A8LB0
A28: of:=[$Sheet1.A28] -> -C027 | B28: of:=[$Sheet1.B28] -> ata-Hitachi_HDP725050GLA360_GEC534RJ2SHUTJ | C28: of:=[$Sheet1.C28] -> Hitachi HDP725050GLA360 (GM4OA5CA) | D28: of:=[$Sheet1.D28] -> 500 GB (500.107.862.016 bytes) | E28: of:=IFERROR(SUBSTITUTE(SUBSTITUTE(RIGHT([.D28];LEN([.D28])-SEARCH("(";[.D28]));" bytes)";"");".";""); ) -> 500107862016 | F28: of:=[.E28]/1024/1024/1024 -> 465.761741638184 | G28: of:=[$Sheet1.E28] -> 0 | H28: of:=[$Sheet1.F28] -> GEC534RJ2SHUTJ
A29: of:=[$Sheet1.A29] -> -C028 | B29: of:=[$Sheet1.B29] -> ata-Corsair_Force_3_SSD_11246518000007430954 | C29: of:=[$Sheet1.C29] -> Corsair Force 3 SSD (1.2) | D29: of:=[$Sheet1.D29] -> 60 GB (60.022.480.896 bytes) | E29: of:=IFERROR(SUBSTITUTE(SUBSTITUTE(RIGHT([.D29];LEN([.D29])-SEARCH("(";[.D29]));" bytes)";"");".";""); ) -> 60022480896 | F29: of:=[.E29]/1024/1024/1024 -> 55.9002914428711 | G29: of:=[$Sheet1.E29] -> 0 | H29: of:=[$Sheet1.F29] -> 11246518000007430954
A30: of:=[$Sheet1.A30] -> -C029 | B30: of:=[$Sheet1.B30] -> ata-Hitachi_HTS545016B9A300_101122PBPB08EC0UJGNF | C30: of:=[$Sheet1.C30] -> Hitachi HTS545016B9A300 (PBBOC60S) | D30: of:=[$Sheet1.D30] -> 160 GB (160.041.885.696 bytes) | E30: of:=IFERROR(SUBSTITUTE(SUBSTITUTE(RIGHT([.D30];LEN([.D30])-SEARCH("(";[.D30]));" bytes)";"");".";""); ) -> 160041885696 | F30: of:=[.E30]/1024/1024/1024 -> 149.050621032715 | G30: of:=[$Sheet1.E30] -> Master Boot Record | H30: of:=[$Sheet1.F30] -> 101122PBPB08EC0UJGNF
A31: of:=[$Sheet1.A31] -> -C030 | B31: of:=[$Sheet1.B31] -> ata-SK_hynix_SC210_2.5_7MM_256GB_EJ55N76521180641L | C31: of:=[$Sheet1.C31] -> SK hynix SC210 2.5 7MM 256GB (20001L00) | D31: of:=[$Sheet1.D31] -> 256 GB (256.060.514.304 bytes) | E31: of:=IFERROR(SUBSTITUTE(SUBSTITUTE(RIGHT([.D31];LEN([.D31])-SEARCH("(";[.D31]));" bytes)";"");".";""); ) -> 256060514304 | F31: of:=[.E31]/1024/1024/1024 -> 238.474937438965 | G31: of:=[$Sheet1.E31] -> GUID Partition Table | H31: of:=[$Sheet1.F31] -> EJ55N76521180641L
A32: of:=[$Sheet1.A32] -> -C031 | B32: of:=[$Sheet1.B32] -> ata-TOSHIBA_MQ03ABB200_371IC5YCT | C32: of:=[$Sheet1.C32] -> TOSHIBA MQ03ABB200 (JP050U) | D32: of:=[$Sheet1.D32] -> 2,0 TB (2.000.398.934.016 bytes) | E32: of:=IFERROR(SUBSTITUTE(SUBSTITUTE(RIGHT([.D32];LEN([.D32])-SEARCH("(";[.D32]));" bytes)";"");".";""); ) -> 2000398934016 | F32: of:=[.E32]/1024/1024/1024 -> 1863.01668548584 | G32: of:=[$Sheet1.E32] -> Master Boot Record | H32: of:=[$Sheet1.F32] -> 371IC5YCT
A33: of:=[$Sheet1.A33] -> -C032 | B33: of:=[$Sheet1.B33] -> usb-Intenso_External_USB_3.0_20170614154EC-0:0 | C33: of:=[$Sheet1.C33] -> Intenso External USB 3.0 (1201) | D33: of:=[$Sheet1.D33] -> 2,0 TB (2.000.398.934.016 bytes) | E33: of:=IFERROR(SUBSTITUTE(SUBSTITUTE(RIGHT([.D33];LEN([.D33])-SEARCH("(";[.D33]));" bytes)";"");".";""); ) -> 2000398934016 | F33: of:=[.E33]/1024/1024/1024 -> 1863.01668548584 | G33: of:=[$Sheet1.E33] -> Master Boot Record | H33: of:=[$Sheet1.F33] -> 20170614154EC
A34: of:=[$Sheet1.A34] -> -C033 | B34: of:=[$Sheet1.B34] -> ata-SAMSUNG_HN-M750MBB_S2SHJ9BB603222 | C34: of:=[$Sheet1.C34] -> SAMSUNG HN-M750MBB (2AR10001) | D34: of:=[$Sheet1.D34] -> 750 GB (750.156.374.016 bytes) | E34: of:=IFERROR(SUBSTITUTE(SUBSTITUTE(RIGHT([.D34];LEN([.D34])-SEARCH("(";[.D34]));" bytes)";"");".";""); ) -> 750156374016 | F34: of:=[.E34]/1024/1024/1024 -> 698.637565612793 | G34: of:=[$Sheet1.E34] -> Master Boot Record | H34: of:=[$Sheet1.F34] -> S2SHJ9BB603222
A35: of:=[$Sheet1.A35] -> -C034 | B35: of:=[$Sheet1.B35] -> ata-WDC_WD1600AAJS-00L7A0_WD-WMAV3E499032 | C35: of:=[$Sheet1.C35] -> WDC WD1600AAJS-00L7A0 (01.03E01) | D35: of:=[$Sheet1.D35] -> 160 GB (160.041.885.696 bytes) | E35: of:=IFERROR(SUBSTITUTE(SUBSTITUTE(RIGHT([.D35];LEN([.D35])-SEARCH("(";[.D35]));" bytes)";"");".";""); ) -> 160041885696 | F35: of:=[.E35]/1024/1024/1024 -> 149.050621032715 | G35: of:=[$Sheet1.E35] -> Master Boot Record | H35: of:=[$Sheet1.F35] -> Master Boot Record
A36: of:=[$Sheet1.A36] -> -C035 | B36: of:=[$Sheet1.B36] -> ata-Hitachi_HDT721016SLA380_STA0L7MB35MARB | C36: of:=[$Sheet1.C36] -> Hitachi HDT721016SLA380 (ST1OA3AA) | D36: of:=[$Sheet1.D36] -> 160 GB (160.041.885.696 bytes) | E36: of:=IFERROR(SUBSTITUTE(SUBSTITUTE(RIGHT([.D36];LEN([.D36])-SEARCH("(";[.D36]));" bytes)";"");".";""); ) -> 160041885696 | F36: of:=[.E36]/1024/1024/1024 -> 149.050621032715 | G36: of:=[$Sheet1.E36] -> Master Boot Record | H36: of:=[$Sheet1.F36] -> STA0L7MB35MARB
A37: of:=[$Sheet1.A37] -> -CE001 | B37: of:=[$Sheet1.B37] -> ata-Samsung_SSD_850_EVO_500GB_S21JNXAGC64845L | C37: of:=[$Sheet1.C37] -> Samsung SSD 850 EVO 500GB (EMT02B6Q) | D37: of:=[$Sheet1.D37] -> 500 GB (500.107.862.016 bytes) | E37: of:=IFERROR(SUBSTITUTE(SUBSTITUTE(RIGHT([.D37];LEN([.D37])-SEARCH("(";[.D37]));" bytes)";"");".";""); ) -> 500107862016 | F37: of:=[.E37]/1024/1024/1024 -> 465.761741638184 | G37: of:=[$Sheet1.E37] -> Master Boot Record | H37: of:=[$Sheet1.F37] -> S21JNXAGC64845L
A38: of:=[$Sheet1.A38] -> -CE002 | B38: of:=[$Sheet1.B38] -> ata-HGST_HTS721075A9E630_JR11004M16LA5F | C38: of:=[$Sheet1.C38] -> HGST HTS721075A9E630 (JB2OA3T0) | D38: of:=[$Sheet1.D38] -> 750 GB (750.156.374.016 bytes) | E38: of:=IFERROR(SUBSTITUTE(SUBSTITUTE(RIGHT([.D38];LEN([.D38])-SEARCH("(";[.D38]));" bytes)";"");".";""); ) -> 750156374016 | F38: of:=[.E38]/1024/1024/1024 -> 698.637565612793 | G38: of:=[$Sheet1.E38] -> Master Boot Record | H38: of:=[$Sheet1.F38] -> JR11004M16LA5F
A39: of:=[$Sheet1.A39] -> -CE003 | B39: of:=[$Sheet1.B39] -> ata-WDC_WD7500BPVT-60HXZT3_WD-WX21E43CAH33 | C39: of:=[$Sheet1.C39] -> WDC WD7500BPVT-60HXZT3 (01.01A01) | D39: of:=[$Sheet1.D39] -> 750 GB (750.156.374.016 bytes) | E39: of:=IFERROR(SUBSTITUTE(SUBSTITUTE(RIGHT([.D39];LEN([.D39])-SEARCH("(";[.D39]));" bytes)";"");".";""); ) -> 750156374016 | F39: of:=[.E39]/1024/1024/1024 -> 698.637565612793 | G39: of:=[$Sheet1.E39] -> Master Boot Record | H39: of:=[$Sheet1.F39] -> WD-WX21E43CAH33
A40: of:=[$Sheet1.A40] -> 0 | B40: of:=[$Sheet1.B40] -> usb-WD_Elements_25A3_574343374B30565236393341-0:0 | C40: of:=[$Sheet1.C40] -> WD Elements 25A3 (1019) | D40: of:=[$Sheet1.D40] -> 4,0 TB (4.000.752.599.040 bytes) | E40: of:=IFERROR(SUBSTITUTE(SUBSTITUTE(RIGHT([.D40];LEN([.D40])-SEARCH("(";[.D40]));" bytes)";"");".";""); ) -> 4000752599040 | F40: of:=[.E40]/1024/1024/1024 -> 3725.9912109375 | G40: of:=[$Sheet1.E40] -> GUID Partition Table | H40: of:=[$Sheet1.F40] -> 574343374B30565236393341
A41: of:=[$Sheet1.A41] -> 0 | B41: of:=[$Sheet1.B41] -> nvme-KBG20ZMS512G_NVMe_TOSHIBA_512GB_67NPA0T0PQRU | C41: of:=[$Sheet1.C41] -> KBG20ZMS512G NVMe TOSHIBA 512GB | D41: of:=[$Sheet1.D41] -> 512 GB (512.110.190.592 bytes) | E41: of:=IFERROR(SUBSTITUTE(SUBSTITUTE(RIGHT([.D41];LEN([.D41])-SEARCH("(";[.D41]));" bytes)";"");".";""); ) -> 512110190592 | F41: of:=[.E41]/1024/1024/1024 -> 476.939781188965 | G41: of:=[$Sheet1.E41] -> Master Boot Record | H41: of:=[$Sheet1.F41] -> 67NPA0T0PQRU
A42: of:=[$Sheet1.A42] -> 0 | B42: of:=[$Sheet1.B42] -> ata-Hitachi_HTS543216L9SA00_090924FB2203BNGV996A | C42: of:=[$Sheet1.C42] -> Hitachi HTS543216L9SA00 (FB2OC43C) | D42: of:=[$Sheet1.D42] -> 160 GB (160.041.885.696 bytes) | E42: of:=IFERROR(SUBSTITUTE(SUBSTITUTE(RIGHT([.D42];LEN([.D42])-SEARCH("(";[.D42]));" bytes)";"");".";""); ) -> 160041885696 | F42: of:=[.E42]/1024/1024/1024 -> 149.050621032715 | G42: of:=[$Sheet1.E42] -> Master Boot Record | H42: of:=[$Sheet1.F42] -> 090924FB2203BNGV996A
A43: of:=[$Sheet1.A43] -> 0 | B43: of:=[$Sheet1.B43] -> usb-AI_Mass_Storage-0:0 | C43: of:=[$Sheet1.C43] -> AI Mass Storage (0100) | D43: of:=[$Sheet1.D43] -> 8,1 GB (8.069.890.048 bytes) | E43: of:=IFERROR(SUBSTITUTE(SUBSTITUTE(RIGHT([.D43];LEN([.D43])-SEARCH("(";[.D43]));" bytes)";"");".";""); ) -> 8069890048 | F43: of:=[.E43]/1024/1024/1024 -> 7.51567077636719 | G43: of:=[$Sheet1.E43] -> Master Boot Record | H43: of:=[$Sheet1.F43] -> AI_Mass_Storage-0:0
A44: of:=[$Sheet1.A44] -> -C036 | B44: of:=[$Sheet1.B44] -> ata-ST250DM000-1BD141_S2A50B8B | C44: of:=[$Sheet1.C44] -> ST250DM000-1BD141 (KC45) | D44: of:=[$Sheet1.D44] -> 250 GB (250.059.350.016 bytes) | E44: of:=IFERROR(SUBSTITUTE(SUBSTITUTE(RIGHT([.D44];LEN([.D44])-SEARCH("(";[.D44]));" bytes)";"");".";""); ) -> 250059350016 | F44: of:=[.E44]/1024/1024/1024 -> 232.885917663574 | G44: of:=[$Sheet1.E44] -> Master Boot Record | H44: of:=[$Sheet1.F44] -> S2A50B8B
A45: of:=[$Sheet1.A45] -> 0 | B45: of:=[$Sheet1.B45] -> 0 | C45: of:=[$Sheet1.C45] -> 0 | D45: of:=[$Sheet1.D45] -> 0 | E45: of:=IFERROR(SUBSTITUTE(SUBSTITUTE(RIGHT([.D45];LEN([.D45])-SEARCH("(";[.D45]));" bytes)";"");".";""); ) -> 0 | F45: of:=[.E45]/1024/1024/1024 -> 0 | G45: of:=[$Sheet1.E45] -> 0 | H45: of:=[$Sheet1.F45] -> 0
A46: of:=[$Sheet1.A46] -> 0 | B46: of:=[$Sheet1.B46] -> 0 | C46: of:=[$Sheet1.C46] -> 0 | D46: of:=[$Sheet1.D46] -> 0 | E46: of:=IFERROR(SUBSTITUTE(SUBSTITUTE(RIGHT([.D46];LEN([.D46])-SEARCH("(";[.D46]));" bytes)";"");".";""); ) -> 0 | F46: of:=[.E46]/1024/1024/1024 -> 0 | G46: of:=[$Sheet1.E46] -> 0 | H46: of:=[$Sheet1.F46] -> 0