smartctl 6.6 2016-05-31 r4324 [x86_64-linux-5.3.0-40-generic] (local build)
Copyright (C) 2002-16, Bruce Allen, Christian Franke, www.smartmontools.org

=== START OF INFORMATION SECTION ===
Model Family:     SAMSUNG SpinPoint F2 EG
Device Model:     SAMSUNG HD502HI
Serial Number:    S1VZJ90Z267756
LU WWN Device Id: 5 0024e9 201f03b6b
Firmware Version: 1AG01118
User Capacity:    500.107.862.016 bytes [500 GB]
Sector Size:      512 bytes logical/physical
Device is:        In smartctl database [for details use: -P show]
ATA Version is:   ATA/ATAPI-7, ATA8-ACS T13/1699-D revision 3b
Local Time is:    Sat Feb 29 03:18:28 2020 CET
SMART support is: Available - device has SMART capability.
SMART support is: Enabled
AAM feature is:   Disabled
APM feature is:   Disabled
Rd look-ahead is: Enabled
Write cache is:   Enabled
ATA Security is:  Disabled, NOT FROZEN [SEC1]
Wt Cache Reorder: Enabled

=== START OF READ SMART DATA SECTION ===
SMART overall-health self-assessment test result: PASSED

General SMART Values:
Offline data collection status:  (0x00)	Offline data collection activity
					was never started.
					Auto Offline Data Collection: Disabled.
Self-test execution status:      (   0)	The previous self-test routine completed
					without error or no self-test has ever 
					been run.
Total time to complete Offline 
data collection: 		( 6503) seconds.
Offline data collection
capabilities: 			 (0x7b) SMART execute Offline immediate.
					Auto Offline data collection on/off support.
					Suspend Offline collection upon new
					command.
					Offline surface scan supported.
					Self-test supported.
					Conveyance Self-test supported.
					Selective Self-test supported.
SMART capabilities:            (0x0003)	Saves SMART data before entering
					power-saving mode.
					Supports SMART auto save timer.
Error logging capability:        (0x01)	Error logging supported.
					General Purpose Logging supported.
Short self-test routine 
recommended polling time: 	 (   2) minutes.
Extended self-test routine
recommended polling time: 	 ( 109) minutes.
Conveyance self-test routine
recommended polling time: 	 (  12) minutes.
SCT capabilities: 	       (0x003f)	SCT Status supported.
					SCT Error Recovery Control supported.
					SCT Feature Control supported.
					SCT Data Table supported.

SMART Attributes Data Structure revision number: 16
Vendor Specific SMART Attributes with Thresholds:
ID# ATTRIBUTE_NAME          FLAGS    VALUE WORST THRESH FAIL RAW_VALUE
  1 Raw_Read_Error_Rate     POSR--   100   100   051    -    0
  3 Spin_Up_Time            POS---   086   086   011    -    4980
  4 Start_Stop_Count        -O--CK   098   098   000    -    1879
  5 Reallocated_Sector_Ct   PO--CK   100   100   010    -    0
  7 Seek_Error_Rate         POSR--   100   100   051    -    0
  8 Seek_Time_Performance   P-S--K   100   100   015    -    0
  9 Power_On_Hours          -O--CK   099   099   000    -    3872
 10 Spin_Retry_Count        PO--CK   100   100   051    -    0
 11 Calibration_Retry_Count -O--C-   100   100   000    -    4
 12 Power_Cycle_Count       -O--CK   098   098   000    -    1841
 13 Read_Soft_Error_Rate    -OSR--   100   100   000    -    0
183 Runtime_Bad_Block       -O--CK   100   100   000    -    0
184 End-to-End_Error        PO--CK   100   100   000    -    0
187 Reported_Uncorrect      -O--CK   100   100   000    -    0
188 Command_Timeout         -O--CK   100   100   000    -    0
190 Airflow_Temperature_Cel -O---K   082   067   000    -    18 (Min/Max 18/18)
194 Temperature_Celsius     -O---K   077   064   000    -    23 (Min/Max 18/23)
195 Hardware_ECC_Recovered  -O-RC-   100   100   000    -    14008
196 Reallocated_Event_Count -O--CK   100   100   000    -    0
197 Current_Pending_Sector  -O--C-   100   100   000    -    0
198 Offline_Uncorrectable   ----CK   100   100   000    -    0
199 UDMA_CRC_Error_Count    -OSRCK   100   100   000    -    0
200 Multi_Zone_Error_Rate   -O-R--   100   100   000    -    0
201 Soft_Read_Error_Rate    -O-R--   253   253   000    -    0
                            ||||||_ K auto-keep
                            |||||__ C event count
                            ||||___ R error rate
                            |||____ S speed/performance
                            ||_____ O updated online
                            |______ P prefailure warning

General Purpose Log Directory Version 1
SMART           Log Directory Version 1 [multi-sector log support]
Address    Access  R/W   Size  Description
0x00       GPL,SL  R/O      1  Log Directory
0x01           SL  R/O      1  Summary SMART error log
0x02           SL  R/O      2  Comprehensive SMART error log
0x03       GPL     R/O      2  Ext. Comprehensive SMART error log
0x04       GPL     R/O      2  Device Statistics log
0x06           SL  R/O      1  SMART self-test log
0x07       GPL     R/O      2  Extended self-test log
0x09           SL  R/W      1  Selective self-test log
0x10       GPL     R/O      1  SATA NCQ Queued Error log
0x11       GPL     R/O      1  SATA Phy Event Counters log
0x20       GPL     R/O      2  Streaming performance log [OBS-8]
0x21       GPL     R/O      1  Write stream error log
0x22       GPL     R/O      1  Read stream error log
0x80-0x9f  GPL,SL  R/W     16  Host vendor specific log
0xe0       GPL,SL  R/W      1  SCT Command/Status
0xe1       GPL,SL  R/W      1  SCT Data Transfer

SMART Extended Comprehensive Error Log Version: 1 (2 sectors)
No Errors Logged

SMART Extended Self-test Log Version: 1 (2 sectors)
No self-tests have been logged.  [To run self-tests, use: smartctl -t]

SMART Selective self-test log data structure revision number 1
 SPAN  MIN_LBA  MAX_LBA  CURRENT_TEST_STATUS
    1        0        0  Not_testing
    2        0        0  Not_testing
    3        0        0  Not_testing
    4        0        0  Not_testing
    5        0        0  Not_testing
Selective self-test flags (0x0):
  After scanning selected spans, do NOT read-scan remainder of disk.
If Selective self-test is pending on power-up, resume after 0 minute delay.

SCT Status Version:                  2
SCT Version (vendor specific):       256 (0x0100)
SCT Support Level:                   1
Device State:                        Active (0)
Current Temperature:                 23 Celsius
Power Cycle Max Temperature:         23 Celsius
Lifetime    Max Temperature:         36 Celsius

SCT Temperature History Version:     2
Temperature Sampling Period:         1 minute
Temperature Logging Interval:        1 minute
Min/Max recommended Temperature:     -4/72 Celsius
Min/Max Temperature Limit:           -9/77 Celsius
Temperature History Size (Index):    128 (48)

Index    Estimated Time   Temperature Celsius
  49    2020-02-29 01:11    34  ***************
 ...    ..(  5 skipped).    ..  ***************
  55    2020-02-29 01:17    34  ***************
  56    2020-02-29 01:18    35  ****************
  57    2020-02-29 01:19    35  ****************
  58    2020-02-29 01:20    34  ***************
  59    2020-02-29 01:21    35  ****************
  60    2020-02-29 01:22    35  ****************
  61    2020-02-29 01:23    34  ***************
  62    2020-02-29 01:24    34  ***************
  63    2020-02-29 01:25    34  ***************
  64    2020-02-29 01:26    35  ****************
 ...    ..(  3 skipped).    ..  ****************
  68    2020-02-29 01:30    35  ****************
  69    2020-02-29 01:31    34  ***************
  70    2020-02-29 01:32    34  ***************
  71    2020-02-29 01:33    33  **************
  72    2020-02-29 01:34    33  **************
  73    2020-02-29 01:35    33  **************
  74    2020-02-29 01:36    32  *************
 ...    ..(  3 skipped).    ..  *************
  78    2020-02-29 01:40    32  *************
  79    2020-02-29 01:41    31  ************
 ...    ..(  5 skipped).    ..  ************
  85    2020-02-29 01:47    31  ************
  86    2020-02-29 01:48    30  ***********
 ...    ..(  9 skipped).    ..  ***********
  96    2020-02-29 01:58    30  ***********
  97    2020-02-29 01:59    29  **********
 ...    ..( 14 skipped).    ..  **********
 112    2020-02-29 02:14    29  **********
 113    2020-02-29 02:15    28  *********
 ...    ..(  6 skipped).    ..  *********
 120    2020-02-29 02:22    28  *********
 121    2020-02-29 02:23    18  -
 122    2020-02-29 02:24    18  -
 123    2020-02-29 02:25    19  -
 124    2020-02-29 02:26    19  -
 125    2020-02-29 02:27    20  *
 126    2020-02-29 02:28    20  *
 127    2020-02-29 02:29    21  **
   0    2020-02-29 02:30    21  **
   1    2020-02-29 02:31    21  **
   2    2020-02-29 02:32    22  ***
   3    2020-02-29 02:33    22  ***
   4    2020-02-29 02:34    22  ***
   5    2020-02-29 02:35    23  ****
 ...    ..(  2 skipped).    ..  ****
   8    2020-02-29 02:38    23  ****
   9    2020-02-29 02:39    24  *****
 ...    ..(  2 skipped).    ..  *****
  12    2020-02-29 02:42    24  *****
  13    2020-02-29 02:43    25  ******
 ...    ..(  5 skipped).    ..  ******
  19    2020-02-29 02:49    25  ******
  20    2020-02-29 02:50    26  *******
 ...    ..(  8 skipped).    ..  *******
  29    2020-02-29 02:59    26  *******
  30    2020-02-29 03:00    27  ********
  31    2020-02-29 03:01    17  -
  32    2020-02-29 03:02    18  -
  33    2020-02-29 03:03    18  -
  34    2020-02-29 03:04    19  -
  35    2020-02-29 03:05    19  -
  36    2020-02-29 03:06    20  *
  37    2020-02-29 03:07    20  *
  38    2020-02-29 03:08    21  **
  39    2020-02-29 03:09    21  **
  40    2020-02-29 03:10    21  **
  41    2020-02-29 03:11    22  ***
 ...    ..(  2 skipped).    ..  ***
  44    2020-02-29 03:14    22  ***
  45    2020-02-29 03:15    23  ****
 ...    ..(  2 skipped).    ..  ****
  48    2020-02-29 03:18    23  ****

SCT Error Recovery Control:
           Read: Disabled
          Write: Disabled

ATA_READ_LOG_EXT (addr=0x04:0x00, page=0, n=1) failed: scsi error aborted command
Read Device Statistics page 0x00 failed

SATA Phy Event Counters (GP Log 0x11)
ID      Size     Value  Description
0x000a  2            0  Device-to-host register FISes sent due to a COMRESET
0x0001  2            0  Command failed due to ICRC error
0x0002  2            0  R_ERR response for data FIS
0x0003  2            0  R_ERR response for device-to-host data FIS
0x0004  2            0  R_ERR response for host-to-device data FIS
0x0005  2            0  R_ERR response for non-data FIS
0x0006  2            0  R_ERR response for device-to-host non-data FIS
0x0007  2            0  R_ERR response for host-to-device non-data FIS
0x0008  2            0  Device-to-host non-data FIS retries
0x0009  2            0  Transition from drive PhyRdy to drive PhyNRdy
0x000b  2            0  CRC errors within host-to-device FIS
0x000d  2            0  Non-CRC errors within host-to-device FIS
0x000f  2            0  R_ERR response for host-to-device data FIS, CRC
0x0010  2            0  R_ERR response for host-to-device data FIS, non-CRC
0x0012  2            0  R_ERR response for host-to-device non-data FIS, CRC
0x0013  2            0  R_ERR response for host-to-device non-data FIS, non-CRC

