smartctl 6.6 2016-05-31 r4324 [x86_64-linux-5.3.0-40-generic] (local build)
Copyright (C) 2002-16, Bruce Allen, Christian Franke, www.smartmontools.org

=== START OF INFORMATION SECTION ===
Model Family:     Hitachi Deskstar 7K1000.B
Device Model:     Hitachi HDT721016SLA380
Serial Number:    STA0L7MB35MARB
LU WWN Device Id: 5 000cca 345ecd4fd
Firmware Version: ST1OA3AA
User Capacity:    160.041.885.696 bytes [160 GB]
Sector Size:      512 bytes logical/physical
Rotation Rate:    7200 rpm
Device is:        In smartctl database [for details use: -P show]
ATA Version is:   ATA8-ACS T13/1699-D revision 4
SATA Version is:  SATA 2.6, 3.0 Gb/s
Local Time is:    Tue Mar  3 01:42:15 2020 CET
SMART support is: Available - device has SMART capability.
SMART support is: Enabled
AAM level is:     254 (maximum performance), recommended: 128
APM feature is:   Disabled
Rd look-ahead is: Enabled
Write cache is:   Enabled
ATA Security is:  Disabled, NOT FROZEN [SEC1]
Wt Cache Reorder: Enabled

=== START OF READ SMART DATA SECTION ===
SMART overall-health self-assessment test result: PASSED

General SMART Values:
Offline data collection status:  (0x84)	Offline data collection activity
					was suspended by an interrupting command from host.
					Auto Offline Data Collection: Enabled.
Self-test execution status:      (   0)	The previous self-test routine completed
					without error or no self-test has ever 
					been run.
Total time to complete Offline 
data collection: 		( 2371) seconds.
Offline data collection
capabilities: 			 (0x5b) SMART execute Offline immediate.
					Auto Offline data collection on/off support.
					Suspend Offline collection upon new
					command.
					Offline surface scan supported.
					Self-test supported.
					No Conveyance Self-test supported.
					Selective Self-test supported.
SMART capabilities:            (0x0003)	Saves SMART data before entering
					power-saving mode.
					Supports SMART auto save timer.
Error logging capability:        (0x01)	Error logging supported.
					General Purpose Logging supported.
Short self-test routine 
recommended polling time: 	 (   1) minutes.
Extended self-test routine
recommended polling time: 	 (  40) minutes.
SCT capabilities: 	       (0x003d)	SCT Status supported.
					SCT Error Recovery Control supported.
					SCT Feature Control supported.
					SCT Data Table supported.

SMART Attributes Data Structure revision number: 16
Vendor Specific SMART Attributes with Thresholds:
ID# ATTRIBUTE_NAME          FLAGS    VALUE WORST THRESH FAIL RAW_VALUE
  1 Raw_Read_Error_Rate     PO-R--   100   100   016    -    0
  2 Throughput_Performance  P-S---   100   100   054    -    54
  3 Spin_Up_Time            POS---   110   110   024    -    227 (Average 227)
  4 Start_Stop_Count        -O--C-   100   100   000    -    1181
  5 Reallocated_Sector_Ct   PO--CK   100   100   005    -    0
  7 Seek_Error_Rate         PO-R--   100   100   067    -    0
  8 Seek_Time_Performance   P-S---   100   100   020    -    56
  9 Power_On_Hours          -O--C-   099   099   000    -    7823
 10 Spin_Retry_Count        PO--C-   100   100   060    -    0
 12 Power_Cycle_Count       -O--CK   100   100   000    -    1181
192 Power-Off_Retract_Count -O--CK   099   099   000    -    1214
193 Load_Cycle_Count        -O--C-   099   099   000    -    1214
194 Temperature_Celsius     -O----   193   193   000    -    31 (Min/Max 16/50)
196 Reallocated_Event_Count -O--CK   100   100   000    -    0
197 Current_Pending_Sector  -O---K   100   100   000    -    0
198 Offline_Uncorrectable   ---R--   100   100   000    -    0
199 UDMA_CRC_Error_Count    -O-R--   200   200   000    -    0
                            ||||||_ K auto-keep
                            |||||__ C event count
                            ||||___ R error rate
                            |||____ S speed/performance
                            ||_____ O updated online
                            |______ P prefailure warning

General Purpose Log Directory Version 1
SMART           Log Directory Version 1 [multi-sector log support]
Address    Access  R/W   Size  Description
0x00       GPL,SL  R/O      1  Log Directory
0x01           SL  R/O      1  Summary SMART error log
0x03       GPL     R/O      1  Ext. Comprehensive SMART error log
0x06           SL  R/O      1  SMART self-test log
0x07       GPL     R/O      1  Extended self-test log
0x09           SL  R/W      1  Selective self-test log
0x10       GPL     R/O      1  SATA NCQ Queued Error log
0x11       GPL     R/O      1  SATA Phy Event Counters log
0x20       GPL     R/O      1  Streaming performance log [OBS-8]
0x21       GPL     R/O      1  Write stream error log
0x22       GPL     R/O      1  Read stream error log
0x80-0x9f  GPL,SL  R/W     16  Host vendor specific log
0xe0       GPL,SL  R/W      1  SCT Command/Status
0xe1       GPL,SL  R/W      1  SCT Data Transfer

SMART Extended Comprehensive Error Log Version: 1 (1 sectors)
Device Error Count: 7 (device log contains only the most recent 4 errors)
	CR     = Command Register
	FEATR  = Features Register
	COUNT  = Count (was: Sector Count) Register
	LBA_48 = Upper bytes of LBA High/Mid/Low Registers ]  ATA-8
	LH     = LBA High (was: Cylinder High) Register    ]   LBA
	LM     = LBA Mid (was: Cylinder Low) Register      ] Register
	LL     = LBA Low (was: Sector Number) Register     ]
	DV     = Device (was: Device/Head) Register
	DC     = Device Control Register
	ER     = Error register
	ST     = Status register
Powered_Up_Time is measured from power on, and printed as
DDd+hh:mm:SS.sss where DD=days, hh=hours, mm=minutes,
SS=sec, and sss=millisec. It "wraps" after 49.710 days.

Error 7 [2] occurred at disk power-on lifetime: 2467 hours (102 days + 19 hours)
  When the command that caused the error occurred, the device was active or idle.

  After command completion occurred, registers were:
  ER -- ST COUNT  LBA_48  LH LM LL DV DC
  -- -- -- == -- == == == -- -- -- -- --
  40 -- 51 00 16 00 00 00 fe cf 49 e0 00  Error: UNC 22 sectors at LBA = 0x00fecf49 = 16699209

  Commands leading to the command that caused the error were:
  CR FEATR COUNT  LBA_48  LH LM LL DV DC  Powered_Up_Time  Command/Feature_Name
  -- == -- == -- == == == -- -- -- -- --  ---------------  --------------------
  25 00 00 00 20 00 00 00 fe cf 3f e0 00     00:20:51.400  READ DMA EXT
  35 00 00 00 0a 00 00 00 ca 86 1f e0 00     00:20:51.400  WRITE DMA EXT
  35 00 00 00 10 00 00 00 ab ef 27 e0 00     00:20:51.400  WRITE DMA EXT
  25 00 00 00 10 00 00 00 a9 be c7 e0 00     00:20:51.400  READ DMA EXT
  35 00 00 00 40 00 00 00 9c 79 97 e0 00     00:20:51.400  WRITE DMA EXT

Error 6 [1] occurred at disk power-on lifetime: 2467 hours (102 days + 19 hours)
  When the command that caused the error occurred, the device was active or idle.

  After command completion occurred, registers were:
  ER -- ST COUNT  LBA_48  LH LM LL DV DC
  -- -- -- == -- == == == -- -- -- -- --
  40 -- 51 00 16 00 00 00 fe cf 49 e0 00  Error: UNC 22 sectors at LBA = 0x00fecf49 = 16699209

  Commands leading to the command that caused the error were:
  CR FEATR COUNT  LBA_48  LH LM LL DV DC  Powered_Up_Time  Command/Feature_Name
  -- == -- == -- == == == -- -- -- -- --  ---------------  --------------------
  25 00 00 00 20 00 00 00 fe cf 3f e0 00     00:20:47.000  READ DMA EXT
  35 00 00 00 10 00 00 00 ab eb 97 e0 00     00:20:47.000  WRITE DMA EXT
  25 00 00 00 10 00 00 00 a9 be c7 e0 00     00:20:47.000  READ DMA EXT
  25 00 00 00 08 00 00 00 5e c2 af e0 00     00:20:47.000  READ DMA EXT
  25 00 00 00 08 00 00 00 5d 37 37 e0 00     00:20:47.000  READ DMA EXT

Error 5 [0] occurred at disk power-on lifetime: 2467 hours (102 days + 19 hours)
  When the command that caused the error occurred, the device was active or idle.

  After command completion occurred, registers were:
  ER -- ST COUNT  LBA_48  LH LM LL DV DC
  -- -- -- == -- == == == -- -- -- -- --
  40 -- 51 00 16 00 00 00 fe cf 49 e0 00  Error: UNC 22 sectors at LBA = 0x00fecf49 = 16699209

  Commands leading to the command that caused the error were:
  CR FEATR COUNT  LBA_48  LH LM LL DV DC  Powered_Up_Time  Command/Feature_Name
  -- == -- == -- == == == -- -- -- -- --  ---------------  --------------------
  25 00 00 00 20 00 00 00 fe cf 3f e0 00     00:20:42.600  READ DMA EXT
  25 00 00 00 10 00 00 00 a9 be c7 e0 00     00:20:42.500  READ DMA EXT
  25 00 00 00 08 00 00 00 5e c2 af e0 00     00:20:42.500  READ DMA EXT
  25 00 00 00 08 00 00 00 5d 37 37 e0 00     00:20:42.500  READ DMA EXT
  25 00 00 00 08 00 00 00 5d 41 17 e0 00     00:20:42.500  READ DMA EXT

Error 4 [3] occurred at disk power-on lifetime: 2466 hours (102 days + 18 hours)
  When the command that caused the error occurred, the device was active or idle.

  After command completion occurred, registers were:
  ER -- ST COUNT  LBA_48  LH LM LL DV DC
  -- -- -- == -- == == == -- -- -- -- --
  40 -- 51 00 16 00 00 00 fe cf 49 e0 00  Error: UNC 22 sectors at LBA = 0x00fecf49 = 16699209

  Commands leading to the command that caused the error were:
  CR FEATR COUNT  LBA_48  LH LM LL DV DC  Powered_Up_Time  Command/Feature_Name
  -- == -- == -- == == == -- -- -- -- --  ---------------  --------------------
  25 00 00 00 20 00 00 00 fe cf 3f e0 00     00:05:45.800  READ DMA EXT
  25 00 00 00 50 00 00 00 d7 e1 5f e0 00     00:05:45.800  READ DMA EXT
  25 00 00 00 08 00 00 00 d7 b3 bf e0 00     00:05:45.800  READ DMA EXT
  25 00 00 00 80 00 00 00 bf f2 df e0 00     00:05:45.800  READ DMA EXT
  25 00 00 00 02 00 00 01 1e 80 18 e0 00     00:05:45.800  READ DMA EXT

SMART Extended Self-test Log Version: 1 (1 sectors)
No self-tests have been logged.  [To run self-tests, use: smartctl -t]

SMART Selective self-test log data structure revision number 1
 SPAN  MIN_LBA  MAX_LBA  CURRENT_TEST_STATUS
    1        0        0  Not_testing
    2        0        0  Not_testing
    3        0        0  Not_testing
    4        0        0  Not_testing
    5        0        0  Not_testing
Selective self-test flags (0x0):
  After scanning selected spans, do NOT read-scan remainder of disk.
If Selective self-test is pending on power-up, resume after 0 minute delay.

SCT Status Version:                  3
SCT Version (vendor specific):       256 (0x0100)
SCT Support Level:                   1
Device State:                        SMART Off-line Data Collection executing in background (4)
Current Temperature:                    31 Celsius
Power Cycle Min/Max Temperature:     29/31 Celsius
Lifetime    Min/Max Temperature:     16/50 Celsius
Under/Over Temperature Limit Count:   0/0

SCT Temperature History Version:     2
Temperature Sampling Period:         1 minute
Temperature Logging Interval:        1 minute
Min/Max recommended Temperature:      0/60 Celsius
Min/Max Temperature Limit:           -40/70 Celsius
Temperature History Size (Index):    128 (8)

Index    Estimated Time   Temperature Celsius
   9    2020-03-02 23:35    38  *******************
 ...    ..( 66 skipped).    ..  *******************
  76    2020-03-03 00:42    38  *******************
  77    2020-03-03 00:43     ?  -
  78    2020-03-03 00:44    39  ********************
 ...    ..(  8 skipped).    ..  ********************
  87    2020-03-03 00:53    39  ********************
  88    2020-03-03 00:54     ?  -
  89    2020-03-03 00:55    38  *******************
  90    2020-03-03 00:56    38  *******************
  91    2020-03-03 00:57    39  ********************
  92    2020-03-03 00:58    39  ********************
  93    2020-03-03 00:59    38  *******************
  94    2020-03-03 01:00    38  *******************
  95    2020-03-03 01:01    38  *******************
  96    2020-03-03 01:02    39  ********************
  97    2020-03-03 01:03    38  *******************
  98    2020-03-03 01:04    38  *******************
  99    2020-03-03 01:05    38  *******************
 100    2020-03-03 01:06    39  ********************
 101    2020-03-03 01:07    39  ********************
 102    2020-03-03 01:08     ?  -
 103    2020-03-03 01:09    26  *******
 104    2020-03-03 01:10    27  ********
 105    2020-03-03 01:11    28  *********
 106    2020-03-03 01:12    29  **********
 107    2020-03-03 01:13    30  ***********
 108    2020-03-03 01:14    31  ************
 109    2020-03-03 01:15    31  ************
 110    2020-03-03 01:16    31  ************
 111    2020-03-03 01:17    32  *************
 ...    ..(  2 skipped).    ..  *************
 114    2020-03-03 01:20    32  *************
 115    2020-03-03 01:21     ?  -
 116    2020-03-03 01:22    32  *************
 117    2020-03-03 01:23    32  *************
 118    2020-03-03 01:24    33  **************
 119    2020-03-03 01:25    34  ***************
 ...    ..(  2 skipped).    ..  ***************
 122    2020-03-03 01:28    34  ***************
 123    2020-03-03 01:29    35  ****************
 124    2020-03-03 01:30    34  ***************
 125    2020-03-03 01:31    35  ****************
 ...    ..(  3 skipped).    ..  ****************
   1    2020-03-03 01:35    35  ****************
   2    2020-03-03 01:36     ?  -
   3    2020-03-03 01:37     ?  -
   4    2020-03-03 01:38    27  ********
   5    2020-03-03 01:39    28  *********
   6    2020-03-03 01:40    29  **********
   7    2020-03-03 01:41     ?  -
   8    2020-03-03 01:42    30  ***********

SCT Error Recovery Control:
           Read: Disabled
          Write: Disabled

Device Statistics (GP/SMART Log 0x04) not supported

SATA Phy Event Counters (GP Log 0x11)
ID      Size     Value  Description
0x0001  2            0  Command failed due to ICRC error
0x0009  2            0  Transition from drive PhyRdy to drive PhyNRdy
0x000a  2            0  Device-to-host register FISes sent due to a COMRESET
0x000b  2            0  CRC errors within host-to-device FIS
0x000d  2            0  Non-CRC errors within host-to-device FIS

