smartctl 6.6 2016-05-31 r4324 [x86_64-linux-5.3.0-40-generic] (local build)
Copyright (C) 2002-16, Bruce Allen, Christian Franke, www.smartmontools.org

=== START OF INFORMATION SECTION ===
Model Family:     Hitachi Travelstar 5K500.B
Device Model:     Hitachi HTS545050B9A300
Serial Number:    090627PB4406Q7H4UR4A
LU WWN Device Id: 5 000cca 597d04984
Firmware Version: PB4OC60F
User Capacity:    500,107,862,016 bytes [500 GB]
Sector Size:      512 bytes logical/physical
Rotation Rate:    5400 rpm
Form Factor:      2.5 inches
Device is:        In smartctl database [for details use: -P show]
ATA Version is:   ATA8-ACS T13/1699-D revision 6
SATA Version is:  SATA 2.6, 3.0 Gb/s
Local Time is:    Tue Mar 10 13:01:37 2020 CET
SMART support is: Available - device has SMART capability.
SMART support is: Enabled
AAM feature is:   Disabled
APM level is:     128 (minimum power consumption without standby)
Rd look-ahead is: Enabled
Write cache is:   Enabled
ATA Security is:  Disabled, NOT FROZEN [SEC1]
Wt Cache Reorder: Enabled

=== START OF READ SMART DATA SECTION ===
SMART overall-health self-assessment test result: PASSED

General SMART Values:
Offline data collection status:  (0x00)	Offline data collection activity
					was never started.
					Auto Offline Data Collection: Disabled.
Self-test execution status:      (   0)	The previous self-test routine completed
					without error or no self-test has ever 
					been run.
Total time to complete Offline 
data collection: 		(  645) seconds.
Offline data collection
capabilities: 			 (0x5b) SMART execute Offline immediate.
					Auto Offline data collection on/off support.
					Suspend Offline collection upon new
					command.
					Offline surface scan supported.
					Self-test supported.
					No Conveyance Self-test supported.
					Selective Self-test supported.
SMART capabilities:            (0x0003)	Saves SMART data before entering
					power-saving mode.
					Supports SMART auto save timer.
Error logging capability:        (0x01)	Error logging supported.
					General Purpose Logging supported.
Short self-test routine 
recommended polling time: 	 (   2) minutes.
Extended self-test routine
recommended polling time: 	 ( 158) minutes.
SCT capabilities: 	       (0x003d)	SCT Status supported.
					SCT Error Recovery Control supported.
					SCT Feature Control supported.
					SCT Data Table supported.

SMART Attributes Data Structure revision number: 16
Vendor Specific SMART Attributes with Thresholds:
ID# ATTRIBUTE_NAME          FLAGS    VALUE WORST THRESH FAIL RAW_VALUE
  1 Raw_Read_Error_Rate     PO-R--   084   084   062    -    19988480
  2 Throughput_Performance  P-S---   100   100   040    -    0
  3 Spin_Up_Time            POS---   142   142   033    -    2
  4 Start_Stop_Count        -O--C-   089   089   000    -    18451
  5 Reallocated_Sector_Ct   PO--CK   100   100   005    -    0
  7 Seek_Error_Rate         PO-R--   100   100   067    -    0
  8 Seek_Time_Performance   P-S---   100   100   040    -    0
  9 Power_On_Hours          -O--C-   087   087   000    -    5822
 10 Spin_Retry_Count        PO--C-   100   100   060    -    0
 12 Power_Cycle_Count       -O--CK   097   097   000    -    5366
191 G-Sense_Error_Rate      -O-R--   100   100   000    -    0
192 Power-Off_Retract_Count -O--CK   100   100   000    -    49
193 Load_Cycle_Count        -O--C-   094   094   000    -    61643
194 Temperature_Celsius     -O----   189   189   000    -    29 (Min/Max 7/56)
196 Reallocated_Event_Count -O--CK   100   100   000    -    8
197 Current_Pending_Sector  -O---K   100   100   000    -    11
198 Offline_Uncorrectable   ---R--   100   100   000    -    0
199 UDMA_CRC_Error_Count    -O-R--   200   200   000    -    0
223 Load_Retry_Count        -O-R--   100   100   000    -    0
                            ||||||_ K auto-keep
                            |||||__ C event count
                            ||||___ R error rate
                            |||____ S speed/performance
                            ||_____ O updated online
                            |______ P prefailure warning

General Purpose Log Directory Version 1
SMART           Log Directory Version 1 [multi-sector log support]
Address    Access  R/W   Size  Description
0x00       GPL,SL  R/O      1  Log Directory
0x01           SL  R/O      1  Summary SMART error log
0x02           SL  R/O      1  Comprehensive SMART error log
0x03       GPL     R/O      1  Ext. Comprehensive SMART error log
0x06           SL  R/O      1  SMART self-test log
0x07       GPL     R/O      1  Extended self-test log
0x09           SL  R/W      1  Selective self-test log
0x10       GPL     R/O      1  SATA NCQ Queued Error log
0x11       GPL     R/O      1  SATA Phy Event Counters log
0x80-0x9f  GPL,SL  R/W     16  Host vendor specific log
0xe0       GPL,SL  R/W      1  SCT Command/Status
0xe1       GPL,SL  R/W      1  SCT Data Transfer

SMART Extended Comprehensive Error Log Version: 1 (1 sectors)
Device Error Count: 114 (device log contains only the most recent 4 errors)
	CR     = Command Register
	FEATR  = Features Register
	COUNT  = Count (was: Sector Count) Register
	LBA_48 = Upper bytes of LBA High/Mid/Low Registers ]  ATA-8
	LH     = LBA High (was: Cylinder High) Register    ]   LBA
	LM     = LBA Mid (was: Cylinder Low) Register      ] Register
	LL     = LBA Low (was: Sector Number) Register     ]
	DV     = Device (was: Device/Head) Register
	DC     = Device Control Register
	ER     = Error register
	ST     = Status register
Powered_Up_Time is measured from power on, and printed as
DDd+hh:mm:SS.sss where DD=days, hh=hours, mm=minutes,
SS=sec, and sss=millisec. It "wraps" after 49.710 days.

Error 114 [0] occurred at disk power-on lifetime: 5822 hours (242 days + 14 hours)
  When the command that caused the error occurred, the device was active or idle.

  After command completion occurred, registers were:
  ER -- ST COUNT  LBA_48  LH LM LL DV DC
  -- -- -- == -- == == == -- -- -- -- --
  40 -- 51 00 06 00 00 01 50 5f b2 41 00  Error: UNC 6 sectors at LBA = 0x01505fb2 = 22044594

  Commands leading to the command that caused the error were:
  CR FEATR COUNT  LBA_48  LH LM LL DV DC  Powered_Up_Time  Command/Feature_Name
  -- == -- == -- == == == -- -- -- -- --  ---------------  --------------------
  25 00 00 00 08 00 00 01 50 5f b0 40 00  2d+19:27:37.600  READ DMA EXT
  e5 00 00 00 00 00 00 00 00 00 00 00 00  2d+19:27:33.900  CHECK POWER MODE
  e5 00 00 00 00 00 00 00 00 00 00 00 00  2d+19:27:28.900  CHECK POWER MODE
  e5 00 00 00 00 00 00 00 00 00 00 00 00  2d+19:27:23.900  CHECK POWER MODE
  e5 00 00 00 00 00 00 00 00 00 00 00 00  2d+19:27:22.300  CHECK POWER MODE

Error 113 [3] occurred at disk power-on lifetime: 5822 hours (242 days + 14 hours)
  When the command that caused the error occurred, the device was active or idle.

  After command completion occurred, registers were:
  ER -- ST COUNT  LBA_48  LH LM LL DV DC
  -- -- -- == -- == == == -- -- -- -- --
  40 -- 51 00 04 00 00 01 67 ad ec 41 00  Error: UNC 4 sectors at LBA = 0x0167adec = 23571948

  Commands leading to the command that caused the error were:
  CR FEATR COUNT  LBA_48  LH LM LL DV DC  Powered_Up_Time  Command/Feature_Name
  -- == -- == -- == == == -- -- -- -- --  ---------------  --------------------
  25 00 00 00 08 00 00 01 67 ad e8 40 00  2d+19:27:18.600  READ DMA EXT
  e5 00 00 00 00 00 00 00 00 00 00 00 00  2d+19:27:13.900  CHECK POWER MODE
  e5 00 00 00 00 00 00 00 00 00 00 00 00  2d+19:27:08.900  CHECK POWER MODE
  e5 00 00 00 00 00 00 00 00 00 00 00 00  2d+19:27:03.900  CHECK POWER MODE
  e5 00 00 00 00 00 00 00 00 00 00 00 00  2d+19:26:58.900  CHECK POWER MODE

Error 112 [2] occurred at disk power-on lifetime: 5756 hours (239 days + 20 hours)
  When the command that caused the error occurred, the device was active or idle.

  After command completion occurred, registers were:
  ER -- ST COUNT  LBA_48  LH LM LL DV DC
  -- -- -- == -- == == == -- -- -- -- --
  40 -- 51 00 04 00 00 01 67 ad ec 41 00  Error: UNC 4 sectors at LBA = 0x0167adec = 23571948

  Commands leading to the command that caused the error were:
  CR FEATR COUNT  LBA_48  LH LM LL DV DC  Powered_Up_Time  Command/Feature_Name
  -- == -- == -- == == == -- -- -- -- --  ---------------  --------------------
  25 00 00 00 08 00 00 01 67 ad e8 40 00     00:46:18.800  READ DMA EXT
  e5 00 00 00 00 00 00 00 00 00 00 00 00     00:46:17.200  CHECK POWER MODE
  25 00 00 00 08 00 00 02 7e b8 78 40 00     00:46:13.500  READ DMA EXT
  e5 00 00 00 00 00 00 00 00 00 00 00 00     00:46:13.400  CHECK POWER MODE
  25 00 00 00 08 00 00 01 50 5f b0 40 00     00:46:09.700  READ DMA EXT

Error 111 [1] occurred at disk power-on lifetime: 5756 hours (239 days + 20 hours)
  When the command that caused the error occurred, the device was active or idle.

  After command completion occurred, registers were:
  ER -- ST COUNT  LBA_48  LH LM LL DV DC
  -- -- -- == -- == == == -- -- -- -- --
  40 -- 51 00 04 00 00 02 7e b8 7c 42 00  Error: UNC 4 sectors at LBA = 0x027eb87c = 41859196

  Commands leading to the command that caused the error were:
  CR FEATR COUNT  LBA_48  LH LM LL DV DC  Powered_Up_Time  Command/Feature_Name
  -- == -- == -- == == == -- -- -- -- --  ---------------  --------------------
  25 00 00 00 08 00 00 02 7e b8 78 40 00     00:46:13.500  READ DMA EXT
  e5 00 00 00 00 00 00 00 00 00 00 00 00     00:46:13.400  CHECK POWER MODE
  25 00 00 00 08 00 00 01 50 5f b0 40 00     00:46:09.700  READ DMA EXT
  e5 00 00 00 00 00 00 00 00 00 00 00 00     00:46:08.900  CHECK POWER MODE
  25 00 da 00 08 00 00 02 fd a7 78 40 00     00:46:05.200  READ DMA EXT

SMART Extended Self-test Log Version: 1 (1 sectors)
No self-tests have been logged.  [To run self-tests, use: smartctl -t]

SMART Selective self-test log data structure revision number 1
 SPAN  MIN_LBA  MAX_LBA  CURRENT_TEST_STATUS
    1        0        0  Not_testing
    2        0        0  Not_testing
    3        0        0  Not_testing
    4        0        0  Not_testing
    5        0        0  Not_testing
Selective self-test flags (0x0):
  After scanning selected spans, do NOT read-scan remainder of disk.
If Selective self-test is pending on power-up, resume after 0 minute delay.

SCT Status Version:                  3
SCT Version (vendor specific):       256 (0x0100)
SCT Support Level:                   1
Device State:                        Active (0)
Current Temperature:                    29 Celsius
Power Cycle Min/Max Temperature:     22/31 Celsius
Lifetime    Min/Max Temperature:      7/56 Celsius
Lifetime    Average Temperature:        36 Celsius
Under/Over Temperature Limit Count:   0/0

SCT Temperature History Version:     2
Temperature Sampling Period:         1 minute
Temperature Logging Interval:        1 minute
Min/Max recommended Temperature:      5/60 Celsius
Min/Max Temperature Limit:           -40/65 Celsius
Temperature History Size (Index):    478 (418)

Index    Estimated Time   Temperature Celsius
 419    2020-03-10 05:04    29  **********
 ...    ..( 24 skipped).    ..  **********
 444    2020-03-10 05:29    29  **********
 445    2020-03-10 05:30    28  *********
 ...    ..(242 skipped).    ..  *********
 210    2020-03-10 09:33    28  *********
 211    2020-03-10 09:34    27  ********
 ...    ..( 32 skipped).    ..  ********
 244    2020-03-10 10:07    27  ********
 245    2020-03-10 10:08    28  *********
 ...    ..(157 skipped).    ..  *********
 403    2020-03-10 12:46    28  *********
 404    2020-03-10 12:47    29  **********
 ...    ..( 13 skipped).    ..  **********
 418    2020-03-10 13:01    29  **********

SCT Error Recovery Control:
           Read: Disabled
          Write: Disabled

Device Statistics (GP/SMART Log 0x04) not supported

SATA Phy Event Counters (GP Log 0x11)
ID      Size     Value  Description
0x0001  2            0  Command failed due to ICRC error
0x0002  2            0  R_ERR response for data FIS
0x0005  2            0  R_ERR response for non-data FIS
0x0009  2            1  Transition from drive PhyRdy to drive PhyNRdy
0x000a  2            1  Device-to-host register FISes sent due to a COMRESET
0x000b  2            0  CRC errors within host-to-device FIS
0x000d  2            0  Non-CRC errors within host-to-device FIS

