smartctl 6.6 2016-05-31 r4324 [x86_64-linux-5.3.0-40-generic] (local build)
Copyright (C) 2002-16, Bruce Allen, Christian Franke, www.smartmontools.org

=== START OF INFORMATION SECTION ===
Model Family:     Hitachi Travelstar 5K500.B
Device Model:     Hitachi HTS545050B9A300
Serial Number:    090627PB4406Q7H4UR4A
LU WWN Device Id: 5 000cca 597d04984
Firmware Version: PB4OC60F
User Capacity:    500.107.862.016 bytes [500 GB]
Sector Size:      512 bytes logical/physical
Rotation Rate:    5400 rpm
Form Factor:      2.5 inches
Device is:        In smartctl database [for details use: -P show]
ATA Version is:   ATA8-ACS T13/1699-D revision 6
SATA Version is:  SATA 2.6, 3.0 Gb/s
Local Time is:    Sun Mar  8 02:16:48 2020 CET
SMART support is: Available - device has SMART capability.
SMART support is: Enabled

=== START OF READ SMART DATA SECTION ===
SMART overall-health self-assessment test result: PASSED

General SMART Values:
Offline data collection status:  (0x00)	Offline data collection activity
					was never started.
					Auto Offline Data Collection: Disabled.
Self-test execution status:      (   0)	The previous self-test routine completed
					without error or no self-test has ever 
					been run.
Total time to complete Offline 
data collection: 		(  645) seconds.
Offline data collection
capabilities: 			 (0x5b) SMART execute Offline immediate.
					Auto Offline data collection on/off support.
					Suspend Offline collection upon new
					command.
					Offline surface scan supported.
					Self-test supported.
					No Conveyance Self-test supported.
					Selective Self-test supported.
SMART capabilities:            (0x0003)	Saves SMART data before entering
					power-saving mode.
					Supports SMART auto save timer.
Error logging capability:        (0x01)	Error logging supported.
					General Purpose Logging supported.
Short self-test routine 
recommended polling time: 	 (   2) minutes.
Extended self-test routine
recommended polling time: 	 ( 158) minutes.
SCT capabilities: 	       (0x003d)	SCT Status supported.
					SCT Error Recovery Control supported.
					SCT Feature Control supported.
					SCT Data Table supported.

SMART Attributes Data Structure revision number: 16
Vendor Specific SMART Attributes with Thresholds:
ID# ATTRIBUTE_NAME          FLAG     VALUE WORST THRESH TYPE      UPDATED  WHEN_FAILED RAW_VALUE
  1 Raw_Read_Error_Rate     0x000b   084   084   062    Pre-fail  Always       -       19988480
  2 Throughput_Performance  0x0005   100   100   040    Pre-fail  Offline      -       0
  3 Spin_Up_Time            0x0007   142   142   033    Pre-fail  Always       -       2
  4 Start_Stop_Count        0x0012   089   089   000    Old_age   Always       -       18451
  5 Reallocated_Sector_Ct   0x0033   100   100   005    Pre-fail  Always       -       0
  7 Seek_Error_Rate         0x000b   100   100   067    Pre-fail  Always       -       0
  8 Seek_Time_Performance   0x0005   100   100   040    Pre-fail  Offline      -       0
  9 Power_On_Hours          0x0012   087   087   000    Old_age   Always       -       5764
 10 Spin_Retry_Count        0x0013   100   100   060    Pre-fail  Always       -       0
 12 Power_Cycle_Count       0x0032   097   097   000    Old_age   Always       -       5366
191 G-Sense_Error_Rate      0x000a   100   100   000    Old_age   Always       -       0
192 Power-Off_Retract_Count 0x0032   100   100   000    Old_age   Always       -       49
193 Load_Cycle_Count        0x0012   094   094   000    Old_age   Always       -       61443
194 Temperature_Celsius     0x0002   177   177   000    Old_age   Always       -       31 (Min/Max 7/56)
196 Reallocated_Event_Count 0x0032   100   100   000    Old_age   Always       -       8
197 Current_Pending_Sector  0x0022   100   100   000    Old_age   Always       -       11
198 Offline_Uncorrectable   0x0008   100   100   000    Old_age   Offline      -       0
199 UDMA_CRC_Error_Count    0x000a   200   200   000    Old_age   Always       -       0
223 Load_Retry_Count        0x000a   100   100   000    Old_age   Always       -       0

SMART Error Log Version: 1
ATA Error Count: 112 (device log contains only the most recent five errors)
	CR = Command Register [HEX]
	FR = Features Register [HEX]
	SC = Sector Count Register [HEX]
	SN = Sector Number Register [HEX]
	CL = Cylinder Low Register [HEX]
	CH = Cylinder High Register [HEX]
	DH = Device/Head Register [HEX]
	DC = Device Command Register [HEX]
	ER = Error register [HEX]
	ST = Status register [HEX]
Powered_Up_Time is measured from power on, and printed as
DDd+hh:mm:SS.sss where DD=days, hh=hours, mm=minutes,
SS=sec, and sss=millisec. It "wraps" after 49.710 days.

Error 112 occurred at disk power-on lifetime: 5756 hours (239 days + 20 hours)
  When the command that caused the error occurred, the device was active or idle.

  After command completion occurred, registers were:
  ER ST SC SN CL CH DH
  -- -- -- -- -- -- --
  40 51 04 ec ad 67 41  Error: UNC 4 sectors at LBA = 0x0167adec = 23571948

  Commands leading to the command that caused the error were:
  CR FR SC SN CL CH DH DC   Powered_Up_Time  Command/Feature_Name
  -- -- -- -- -- -- -- --  ----------------  --------------------
  25 00 08 e8 ad 67 40 00      00:46:18.800  READ DMA EXT
  e5 00 00 00 00 00 00 00      00:46:17.200  CHECK POWER MODE
  25 00 08 78 b8 7e 40 00      00:46:13.500  READ DMA EXT
  e5 00 00 00 00 00 00 00      00:46:13.400  CHECK POWER MODE
  25 00 08 b0 5f 50 40 00      00:46:09.700  READ DMA EXT

Error 111 occurred at disk power-on lifetime: 5756 hours (239 days + 20 hours)
  When the command that caused the error occurred, the device was active or idle.

  After command completion occurred, registers were:
  ER ST SC SN CL CH DH
  -- -- -- -- -- -- --
  40 51 04 7c b8 7e 42  Error: UNC 4 sectors at LBA = 0x027eb87c = 41859196

  Commands leading to the command that caused the error were:
  CR FR SC SN CL CH DH DC   Powered_Up_Time  Command/Feature_Name
  -- -- -- -- -- -- -- --  ----------------  --------------------
  25 00 08 78 b8 7e 40 00      00:46:13.500  READ DMA EXT
  e5 00 00 00 00 00 00 00      00:46:13.400  CHECK POWER MODE
  25 00 08 b0 5f 50 40 00      00:46:09.700  READ DMA EXT
  e5 00 00 00 00 00 00 00      00:46:08.900  CHECK POWER MODE
  25 da 08 78 a7 fd 40 00      00:46:05.200  READ DMA EXT

Error 110 occurred at disk power-on lifetime: 5756 hours (239 days + 20 hours)
  When the command that caused the error occurred, the device was active or idle.

  After command completion occurred, registers were:
  ER ST SC SN CL CH DH
  -- -- -- -- -- -- --
  40 51 06 b2 5f 50 41  Error: UNC 6 sectors at LBA = 0x01505fb2 = 22044594

  Commands leading to the command that caused the error were:
  CR FR SC SN CL CH DH DC   Powered_Up_Time  Command/Feature_Name
  -- -- -- -- -- -- -- --  ----------------  --------------------
  25 00 08 b0 5f 50 40 00      00:46:09.700  READ DMA EXT
  e5 00 00 00 00 00 00 00      00:46:08.900  CHECK POWER MODE
  25 da 08 78 a7 fd 40 00      00:46:05.200  READ DMA EXT
  b0 da 00 00 4f c2 00 00      00:46:04.100  SMART RETURN STATUS
  b0 d0 01 00 4f c2 00 00      00:46:04.100  SMART READ DATA

Error 109 occurred at disk power-on lifetime: 5756 hours (239 days + 20 hours)
  When the command that caused the error occurred, the device was active or idle.

  After command completion occurred, registers were:
  ER ST SC SN CL CH DH
  -- -- -- -- -- -- --
  40 51 08 78 a7 fd 42  Error: UNC 8 sectors at LBA = 0x02fda778 = 50177912

  Commands leading to the command that caused the error were:
  CR FR SC SN CL CH DH DC   Powered_Up_Time  Command/Feature_Name
  -- -- -- -- -- -- -- --  ----------------  --------------------
  25 da 08 78 a7 fd 40 00      00:46:05.200  READ DMA EXT
  b0 da 00 00 4f c2 00 00      00:46:04.100  SMART RETURN STATUS
  b0 d0 01 00 4f c2 00 00      00:46:04.100  SMART READ DATA
  b0 d1 01 00 4f c2 00 00      00:46:04.100  SMART READ ATTRIBUTE THRESHOLDS [OBS-4]
  ec 00 01 00 00 00 00 00      00:46:04.100  IDENTIFY DEVICE

Error 108 occurred at disk power-on lifetime: 5755 hours (239 days + 19 hours)
  When the command that caused the error occurred, the device was active or idle.

  After command completion occurred, registers were:
  ER ST SC SN CL CH DH
  -- -- -- -- -- -- --
  40 51 08 78 a7 fd 42  Error: UNC 8 sectors at LBA = 0x02fda778 = 50177912

  Commands leading to the command that caused the error were:
  CR FR SC SN CL CH DH DC   Powered_Up_Time  Command/Feature_Name
  -- -- -- -- -- -- -- --  ----------------  --------------------
  25 00 08 78 a7 fd 40 00      00:18:30.600  READ DMA EXT
  e5 00 00 00 00 00 00 00      00:18:26.100  CHECK POWER MODE
  e5 00 00 00 00 00 00 00      00:18:21.100  CHECK POWER MODE
  e5 00 00 00 00 00 00 00      00:18:16.100  CHECK POWER MODE
  e5 00 00 00 00 00 00 00      00:18:11.100  CHECK POWER MODE

SMART Self-test log structure revision number 1
No self-tests have been logged.  [To run self-tests, use: smartctl -t]

SMART Selective self-test log data structure revision number 1
 SPAN  MIN_LBA  MAX_LBA  CURRENT_TEST_STATUS
    1        0        0  Not_testing
    2        0        0  Not_testing
    3        0        0  Not_testing
    4        0        0  Not_testing
    5        0        0  Not_testing
Selective self-test flags (0x0):
  After scanning selected spans, do NOT read-scan remainder of disk.
If Selective self-test is pending on power-up, resume after 0 minute delay.

