smartctl 6.6 2016-05-31 r4324 [x86_64-linux-5.3.0-40-generic] (local build)
Copyright (C) 2002-16, Bruce Allen, Christian Franke, www.smartmontools.org

=== START OF INFORMATION SECTION ===
Model Family:     Maxtor DiamondMax 10 (SATA/300)
Device Model:     Maxtor 6V080E0
Serial Number:    V22TQT7G
Firmware Version: VA111680
User Capacity:    80.026.361.856 bytes [80,0 GB]
Sector Size:      512 bytes logical/physical
Device is:        In smartctl database [for details use: -P show]
ATA Version is:   ATA/ATAPI-7 T13/1532D revision 0
Local Time is:    Thu Feb 27 23:40:46 2020 CET
SMART support is: Available - device has SMART capability.
SMART support is: Enabled

=== START OF READ SMART DATA SECTION ===
SMART overall-health self-assessment test result: PASSED

General SMART Values:
Offline data collection status:  (0x80)	Offline data collection activity
					was never started.
					Auto Offline Data Collection: Enabled.
Self-test execution status:      (   0)	The previous self-test routine completed
					without error or no self-test has ever 
					been run.
Total time to complete Offline 
data collection: 		( 1141) seconds.
Offline data collection
capabilities: 			 (0x5b) SMART execute Offline immediate.
					Auto Offline data collection on/off support.
					Suspend Offline collection upon new
					command.
					Offline surface scan supported.
					Self-test supported.
					No Conveyance Self-test supported.
					Selective Self-test supported.
SMART capabilities:            (0x0003)	Saves SMART data before entering
					power-saving mode.
					Supports SMART auto save timer.
Error logging capability:        (0x01)	Error logging supported.
					General Purpose Logging supported.
Short self-test routine 
recommended polling time: 	 (   2) minutes.
Extended self-test routine
recommended polling time: 	 (  33) minutes.
SCT capabilities: 	       (0x0021)	SCT Status supported.
					SCT Data Table supported.

SMART Attributes Data Structure revision number: 32
Vendor Specific SMART Attributes with Thresholds:
ID# ATTRIBUTE_NAME          FLAG     VALUE WORST THRESH TYPE      UPDATED  WHEN_FAILED RAW_VALUE
  3 Spin_Up_Time            0x0027   224   224   063    Pre-fail  Always       -       9010
  4 Start_Stop_Count        0x0032   252   252   000    Old_age   Always       -       2329
  5 Reallocated_Sector_Ct   0x0033   253   253   063    Pre-fail  Always       -       0
  7 Seek_Error_Rate         0x000a   253   252   000    Old_age   Always       -       0
  8 Seek_Time_Performance   0x0027   246   234   187    Pre-fail  Always       -       34254
  9 Power_On_Hours          0x0032   172   172   000    Old_age   Always       -       28309
 10 Spin_Retry_Count        0x002b   253   252   157    Pre-fail  Always       -       0
 11 Calibration_Retry_Count 0x002b   253   252   223    Pre-fail  Always       -       0
 12 Power_Cycle_Count       0x0032   248   248   000    Old_age   Always       -       2336
189 High_Fly_Writes         0x003a   100   100   000    Old_age   Always       -       0
190 Airflow_Temperature_Cel 0x0022   077   058   000    Old_age   Always       -       23 (Min/Max 23/23)
192 Power-Off_Retract_Count 0x0032   253   253   000    Old_age   Always       -       0
193 Load_Cycle_Count        0x0032   253   253   000    Old_age   Always       -       0
194 Temperature_Celsius     0x0032   032   253   000    Old_age   Always       -       23
195 Hardware_ECC_Recovered  0x000a   253   252   000    Old_age   Always       -       2344
196 Reallocated_Event_Count 0x0008   253   253   000    Old_age   Offline      -       0
197 Current_Pending_Sector  0x0008   253   253   000    Old_age   Offline      -       0
198 Offline_Uncorrectable   0x0008   253   253   000    Old_age   Offline      -       0
199 UDMA_CRC_Error_Count    0x0008   199   199   000    Old_age   Offline      -       0
200 Multi_Zone_Error_Rate   0x000a   253   252   000    Old_age   Always       -       0
201 Soft_Read_Error_Rate    0x000a   253   252   000    Old_age   Always       -       0
202 Data_Address_Mark_Errs  0x000a   253   252   000    Old_age   Always       -       0
203 Run_Out_Cancel          0x000b   253   252   180    Pre-fail  Always       -       0
204 Soft_ECC_Correction     0x000a   253   252   000    Old_age   Always       -       0
205 Thermal_Asperity_Rate   0x000a   253   252   000    Old_age   Always       -       0
207 Spin_High_Current       0x002a   253   252   000    Old_age   Always       -       0
208 Spin_Buzz               0x002a   253   252   000    Old_age   Always       -       0
210 Unknown_Attribute       0x0032   253   252   000    Old_age   Always       -       0
211 Unknown_Attribute       0x0032   253   252   000    Old_age   Always       -       0
212 Unknown_Attribute       0x0032   253   252   000    Old_age   Always       -       0

SMART Error Log Version: 1
No Errors Logged

SMART Self-test log structure revision number 1
Num  Test_Description    Status                  Remaining  LifeTime(hours)  LBA_of_first_error
# 1  Selective offline   Completed without error       00%         1         -

SMART Selective self-test log data structure revision number 1
 SPAN    MIN_LBA    MAX_LBA  CURRENT_TEST_STATUS
    1          0   39062500  Not_testing
    2  117238987  156301487  Not_testing
    3          0          0  Not_testing
    4          0          0  Not_testing
    5          0          0  Not_testing
Selective self-test flags (0x0):
  After scanning selected spans, do NOT read-scan remainder of disk.
If Selective self-test is pending on power-up, resume after 0 minute delay.

