smartctl 6.6 2016-05-31 r4324 [x86_64-linux-5.3.0-40-generic] (local build)
Copyright (C) 2002-16, Bruce Allen, Christian Franke, www.smartmontools.org

=== START OF INFORMATION SECTION ===
Model Family:     Hitachi Deskstar P7K500
Device Model:     Hitachi HDP725050GLA360
Serial Number:    GEC534RJ2SHUTJ
LU WWN Device Id: 5 000cca 357e6def9
Firmware Version: GM4OA5CA
User Capacity:    500.107.862.016 bytes [500 GB]
Sector Size:      512 bytes logical/physical
Rotation Rate:    7200 rpm
Device is:        In smartctl database [for details use: -P show]
ATA Version is:   ATA8-ACS T13/1699-D revision 4
SATA Version is:  SATA 2.6, 3.0 Gb/s
Local Time is:    Sun Mar  1 16:47:54 2020 CET
SMART support is: Available - device has SMART capability.
SMART support is: Enabled
AAM feature is:   Disabled
APM feature is:   Disabled
Rd look-ahead is: Enabled
Write cache is:   Enabled
ATA Security is:  Disabled, NOT FROZEN [SEC1]
Wt Cache Reorder: Enabled

=== START OF READ SMART DATA SECTION ===
SMART overall-health self-assessment test result: PASSED

General SMART Values:
Offline data collection status:  (0x84)	Offline data collection activity
					was suspended by an interrupting command from host.
					Auto Offline Data Collection: Enabled.
Self-test execution status:      (   0)	The previous self-test routine completed
					without error or no self-test has ever 
					been run.
Total time to complete Offline 
data collection: 		( 7890) seconds.
Offline data collection
capabilities: 			 (0x5b) SMART execute Offline immediate.
					Auto Offline data collection on/off support.
					Suspend Offline collection upon new
					command.
					Offline surface scan supported.
					Self-test supported.
					No Conveyance Self-test supported.
					Selective Self-test supported.
SMART capabilities:            (0x0003)	Saves SMART data before entering
					power-saving mode.
					Supports SMART auto save timer.
Error logging capability:        (0x01)	Error logging supported.
					General Purpose Logging supported.
Short self-test routine 
recommended polling time: 	 (   1) minutes.
Extended self-test routine
recommended polling time: 	 ( 131) minutes.
SCT capabilities: 	       (0x003d)	SCT Status supported.
					SCT Error Recovery Control supported.
					SCT Feature Control supported.
					SCT Data Table supported.

SMART Attributes Data Structure revision number: 16
Vendor Specific SMART Attributes with Thresholds:
ID# ATTRIBUTE_NAME          FLAGS    VALUE WORST THRESH FAIL RAW_VALUE
  1 Raw_Read_Error_Rate     PO-R--   100   100   016    -    0
  2 Throughput_Performance  P-S---   133   133   054    -    138
  3 Spin_Up_Time            POS---   127   127   024    -    316 (Average 290)
  4 Start_Stop_Count        -O--C-   100   100   000    -    2089
  5 Reallocated_Sector_Ct   PO--CK   100   100   005    -    0
  7 Seek_Error_Rate         PO-R--   100   100   067    -    0
  8 Seek_Time_Performance   P-S---   129   129   020    -    30
  9 Power_On_Hours          -O--C-   100   100   000    -    3442
 10 Spin_Retry_Count        PO--C-   100   100   060    -    0
 12 Power_Cycle_Count       -O--CK   100   100   000    -    1055
192 Power-Off_Retract_Count -O--CK   099   099   000    -    2160
193 Load_Cycle_Count        -O--C-   099   099   000    -    2160
194 Temperature_Celsius     -O----   146   146   000    -    41 (Min/Max 12/59)
196 Reallocated_Event_Count -O--CK   100   100   000    -    0
197 Current_Pending_Sector  -O---K   100   100   000    -    0
198 Offline_Uncorrectable   ---R--   100   100   000    -    0
199 UDMA_CRC_Error_Count    -O-R--   200   200   000    -    6699
                            ||||||_ K auto-keep
                            |||||__ C event count
                            ||||___ R error rate
                            |||____ S speed/performance
                            ||_____ O updated online
                            |______ P prefailure warning

General Purpose Log Directory Version 1
SMART           Log Directory Version 1 [multi-sector log support]
Address    Access  R/W   Size  Description
0x00       GPL,SL  R/O      1  Log Directory
0x01           SL  R/O      1  Summary SMART error log
0x03       GPL     R/O      1  Ext. Comprehensive SMART error log
0x06           SL  R/O      1  SMART self-test log
0x07       GPL     R/O      1  Extended self-test log
0x09           SL  R/W      1  Selective self-test log
0x10       GPL     R/O      1  SATA NCQ Queued Error log
0x11       GPL     R/O      1  SATA Phy Event Counters log
0x20       GPL     R/O      1  Streaming performance log [OBS-8]
0x21       GPL     R/O      1  Write stream error log
0x22       GPL     R/O      1  Read stream error log
0x80-0x9f  GPL,SL  R/W     16  Host vendor specific log
0xe0       GPL,SL  R/W      1  SCT Command/Status
0xe1       GPL,SL  R/W      1  SCT Data Transfer

SMART Extended Comprehensive Error Log Version: 1 (1 sectors)
Device Error Count: 972 (device log contains only the most recent 4 errors)
	CR     = Command Register
	FEATR  = Features Register
	COUNT  = Count (was: Sector Count) Register
	LBA_48 = Upper bytes of LBA High/Mid/Low Registers ]  ATA-8
	LH     = LBA High (was: Cylinder High) Register    ]   LBA
	LM     = LBA Mid (was: Cylinder Low) Register      ] Register
	LL     = LBA Low (was: Sector Number) Register     ]
	DV     = Device (was: Device/Head) Register
	DC     = Device Control Register
	ER     = Error register
	ST     = Status register
Powered_Up_Time is measured from power on, and printed as
DDd+hh:mm:SS.sss where DD=days, hh=hours, mm=minutes,
SS=sec, and sss=millisec. It "wraps" after 49.710 days.

Error 972 [3] occurred at disk power-on lifetime: 3426 hours (142 days + 18 hours)
  When the command that caused the error occurred, the device was active or idle.

  After command completion occurred, registers were:
  ER -- ST COUNT  LBA_48  LH LM LL DV DC
  -- -- -- == -- == == == -- -- -- -- --
  84 -- 51 00 01 00 00 00 5b 8b 8f e0 00  Error: ABRT at LBA = 0x005b8b8f = 5999503

  Commands leading to the command that caused the error were:
  CR FEATR COUNT  LBA_48  LH LM LL DV DC  Powered_Up_Time  Command/Feature_Name
  -- == -- == -- == == == -- -- -- -- --  ---------------  --------------------
  39 00 00 00 08 00 00 00 5b 8b 88 e0 00     00:00:39.100  WRITE MULTIPLE EXT
  35 00 00 00 08 00 00 00 5b 8b 88 e0 00     00:00:39.100  WRITE DMA EXT
  25 00 00 00 08 00 00 00 60 00 00 e0 00     00:00:39.100  READ DMA EXT
  35 00 00 00 08 00 00 00 5b 8b 90 e0 00     00:00:39.100  WRITE DMA EXT
  35 00 00 00 08 00 00 00 5b 8b 88 e0 00     00:00:39.100  WRITE DMA EXT

Error 971 [2] occurred at disk power-on lifetime: 3426 hours (142 days + 18 hours)
  When the command that caused the error occurred, the device was active or idle.

  After command completion occurred, registers were:
  ER -- ST COUNT  LBA_48  LH LM LL DV DC
  -- -- -- == -- == == == -- -- -- -- --
  84 -- 51 00 01 00 00 00 5b 8b 8f e0 00  Error: ABRT at LBA = 0x005b8b8f = 5999503

  Commands leading to the command that caused the error were:
  CR FEATR COUNT  LBA_48  LH LM LL DV DC  Powered_Up_Time  Command/Feature_Name
  -- == -- == -- == == == -- -- -- -- --  ---------------  --------------------
  39 00 00 00 08 00 00 00 5b 8b 88 e0 00     00:00:39.100  WRITE MULTIPLE EXT
  35 00 00 00 08 00 00 00 5b 8b 88 e0 00     00:00:39.100  WRITE DMA EXT
  25 00 00 00 08 00 00 00 60 00 00 e0 00     00:00:39.100  READ DMA EXT
  35 00 00 00 08 00 00 00 5b 8b 90 e0 00     00:00:39.100  WRITE DMA EXT
  35 00 00 00 08 00 00 00 5b 8b 88 e0 00     00:00:39.100  WRITE DMA EXT

Error 970 [1] occurred at disk power-on lifetime: 3426 hours (142 days + 18 hours)
  When the command that caused the error occurred, the device was active or idle.

  After command completion occurred, registers were:
  ER -- ST COUNT  LBA_48  LH LM LL DV DC
  -- -- -- == -- == == == -- -- -- -- --
  84 -- 51 00 00 00 00 00 5b 8b 8f e0 00  Error: ICRC, ABRT at LBA = 0x005b8b8f = 5999503

  Commands leading to the command that caused the error were:
  CR FEATR COUNT  LBA_48  LH LM LL DV DC  Powered_Up_Time  Command/Feature_Name
  -- == -- == -- == == == -- -- -- -- --  ---------------  --------------------
  35 00 00 00 08 00 00 00 5b 8b 88 e0 00     00:00:39.100  WRITE DMA EXT
  25 00 00 00 08 00 00 00 60 00 00 e0 00     00:00:39.100  READ DMA EXT
  35 00 00 00 08 00 00 00 5b 8b 90 e0 00     00:00:39.100  WRITE DMA EXT
  35 00 00 00 08 00 00 00 5b 8b 88 e0 00     00:00:39.100  WRITE DMA EXT
  35 00 00 00 08 00 00 00 5b 8b 80 e0 00     00:00:39.100  WRITE DMA EXT

Error 969 [0] occurred at disk power-on lifetime: 3426 hours (142 days + 18 hours)
  When the command that caused the error occurred, the device was active or idle.

  After command completion occurred, registers were:
  ER -- ST COUNT  LBA_48  LH LM LL DV DC
  -- -- -- == -- == == == -- -- -- -- --
  84 -- 51 00 01 00 00 00 5b 8c 97 e0 00  Error: ABRT at LBA = 0x005b8c97 = 5999767

  Commands leading to the command that caused the error were:
  CR FEATR COUNT  LBA_48  LH LM LL DV DC  Powered_Up_Time  Command/Feature_Name
  -- == -- == -- == == == -- -- -- -- --  ---------------  --------------------
  39 00 00 00 08 00 00 00 5b 8c 90 e0 00     00:00:38.100  WRITE MULTIPLE EXT
  35 00 00 00 08 00 00 00 5b 8c 90 e0 00     00:00:38.100  WRITE DMA EXT
  39 00 00 00 08 00 00 00 5b 8c 90 e0 00     00:00:37.000  WRITE MULTIPLE EXT
  35 00 00 00 08 00 00 00 5b 8c 90 e0 00     00:00:37.000  WRITE DMA EXT
  39 00 00 00 08 00 00 00 5b 8c 90 e0 00     00:00:36.000  WRITE MULTIPLE EXT

SMART Extended Self-test Log Version: 1 (1 sectors)
No self-tests have been logged.  [To run self-tests, use: smartctl -t]

SMART Selective self-test log data structure revision number 1
 SPAN  MIN_LBA  MAX_LBA  CURRENT_TEST_STATUS
    1        0        0  Not_testing
    2        0        0  Not_testing
    3        0        0  Not_testing
    4        0        0  Not_testing
    5        0        0  Not_testing
Selective self-test flags (0x0):
  After scanning selected spans, do NOT read-scan remainder of disk.
If Selective self-test is pending on power-up, resume after 0 minute delay.

SCT Status Version:                  3
SCT Version (vendor specific):       256 (0x0100)
SCT Support Level:                   1
Device State:                        SMART Off-line Data Collection executing in background (4)
Current Temperature:                    41 Celsius
Power Cycle Min/Max Temperature:     25/44 Celsius
Lifetime    Min/Max Temperature:     12/59 Celsius
Under/Over Temperature Limit Count:   0/0

SCT Temperature History Version:     2
Temperature Sampling Period:         1 minute
Temperature Logging Interval:        1 minute
Min/Max recommended Temperature:      0/60 Celsius
Min/Max Temperature Limit:           -40/70 Celsius
Temperature History Size (Index):    128 (83)

Index    Estimated Time   Temperature Celsius
  84    2020-03-01 14:40    43  ************************
 ...    ..( 11 skipped).    ..  ************************
  96    2020-03-01 14:52    43  ************************
  97    2020-03-01 14:53    44  *************************
  98    2020-03-01 14:54    43  ************************
 ...    ..(  6 skipped).    ..  ************************
 105    2020-03-01 15:01    43  ************************
 106    2020-03-01 15:02    44  *************************
 107    2020-03-01 15:03    43  ************************
 108    2020-03-01 15:04    44  *************************
 ...    ..( 37 skipped).    ..  *************************
  18    2020-03-01 15:42    44  *************************
  19    2020-03-01 15:43    43  ************************
 ...    ..(  8 skipped).    ..  ************************
  28    2020-03-01 15:52    43  ************************
  29    2020-03-01 15:53    42  ***********************
 ...    ..(  3 skipped).    ..  ***********************
  33    2020-03-01 15:57    42  ***********************
  34    2020-03-01 15:58    43  ************************
 ...    ..(  7 skipped).    ..  ************************
  42    2020-03-01 16:06    43  ************************
  43    2020-03-01 16:07    42  ***********************
 ...    ..( 24 skipped).    ..  ***********************
  68    2020-03-01 16:32    42  ***********************
  69    2020-03-01 16:33    41  **********************
  70    2020-03-01 16:34    41  **********************
  71    2020-03-01 16:35    41  **********************
  72    2020-03-01 16:36    42  ***********************
  73    2020-03-01 16:37    42  ***********************
  74    2020-03-01 16:38    41  **********************
 ...    ..(  8 skipped).    ..  **********************
  83    2020-03-01 16:47    41  **********************

SCT Error Recovery Control:
           Read: Disabled
          Write: Disabled

Device Statistics (GP/SMART Log 0x04) not supported

SATA Phy Event Counters (GP Log 0x11)
ID      Size     Value  Description
0x0001  2            0  Command failed due to ICRC error
0x0009  2            0  Transition from drive PhyRdy to drive PhyNRdy
0x000a  2           11  Device-to-host register FISes sent due to a COMRESET
0x000b  2            0  CRC errors within host-to-device FIS
0x000d  2            0  Non-CRC errors within host-to-device FIS

