smartctl 6.6 2016-05-31 r4324 [x86_64-linux-5.3.0-40-generic] (local build)
Copyright (C) 2002-16, Bruce Allen, Christian Franke, www.smartmontools.org

=== START OF INFORMATION SECTION ===
Model Family:     Seagate Barracuda 7200.14 (AF)
Device Model:     ST250DM000-1BD141
Serial Number:    S2A50B8B
LU WWN Device Id: 5 000c50 04add6673
Firmware Version: KC45
User Capacity:    250.059.350.016 bytes [250 GB]
Sector Sizes:     512 bytes logical, 4096 bytes physical
Rotation Rate:    7200 rpm
Device is:        In smartctl database [for details use: -P show]
ATA Version is:   ATA8-ACS T13/1699-D revision 4
SATA Version is:  SATA 3.0, 6.0 Gb/s (current: 3.0 Gb/s)
Local Time is:    Tue Mar  3 04:59:17 2020 CET
SMART support is: Available - device has SMART capability.
SMART support is: Enabled
AAM level is:     254 (maximum performance), recommended: 208
APM feature is:   Unavailable
Rd look-ahead is: Enabled
Write cache is:   Enabled
ATA Security is:  Disabled, NOT FROZEN [SEC1]
Wt Cache Reorder: Enabled

=== START OF READ SMART DATA SECTION ===
SMART overall-health self-assessment test result: PASSED

General SMART Values:
Offline data collection status:  (0x82)	Offline data collection activity
					was completed without error.
					Auto Offline Data Collection: Enabled.
Self-test execution status:      (   0)	The previous self-test routine completed
					without error or no self-test has ever 
					been run.
Total time to complete Offline 
data collection: 		(  600) seconds.
Offline data collection
capabilities: 			 (0x7b) SMART execute Offline immediate.
					Auto Offline data collection on/off support.
					Suspend Offline collection upon new
					command.
					Offline surface scan supported.
					Self-test supported.
					Conveyance Self-test supported.
					Selective Self-test supported.
SMART capabilities:            (0x0003)	Saves SMART data before entering
					power-saving mode.
					Supports SMART auto save timer.
Error logging capability:        (0x01)	Error logging supported.
					General Purpose Logging supported.
Short self-test routine 
recommended polling time: 	 (   1) minutes.
Extended self-test routine
recommended polling time: 	 (  42) minutes.
Conveyance self-test routine
recommended polling time: 	 (   2) minutes.
SCT capabilities: 	       (0x303f)	SCT Status supported.
					SCT Error Recovery Control supported.
					SCT Feature Control supported.
					SCT Data Table supported.

SMART Attributes Data Structure revision number: 10
Vendor Specific SMART Attributes with Thresholds:
ID# ATTRIBUTE_NAME          FLAGS    VALUE WORST THRESH FAIL RAW_VALUE
  1 Raw_Read_Error_Rate     POSR--   115   099   006    -    96847112
  3 Spin_Up_Time            PO----   100   100   000    -    0
  4 Start_Stop_Count        -O--CK   099   099   020    -    1481
  5 Reallocated_Sector_Ct   PO--CK   100   100   036    -    0
  7 Seek_Error_Rate         POSR--   081   060   030    -    4431199268
  9 Power_On_Hours          -O--CK   093   093   000    -    6861
 10 Spin_Retry_Count        PO--C-   100   100   097    -    0
 12 Power_Cycle_Count       -O--CK   099   099   020    -    1477
183 Runtime_Bad_Block       -O--CK   100   100   000    -    0
184 End-to-End_Error        -O--CK   100   100   099    -    0
187 Reported_Uncorrect      -O--CK   100   100   000    -    0
188 Command_Timeout         -O--CK   100   100   000    -    1 1 1
189 High_Fly_Writes         -O-RCK   100   100   000    -    0
190 Airflow_Temperature_Cel -O---K   064   059   045    -    36 (Min/Max 26/36)
194 Temperature_Celsius     -O---K   036   041   000    -    36 (0 12 0 0 0)
195 Hardware_ECC_Recovered  -O-RC-   052   036   000    -    96847112
197 Current_Pending_Sector  -O--C-   100   100   000    -    0
198 Offline_Uncorrectable   ----C-   100   100   000    -    0
199 UDMA_CRC_Error_Count    -OSRCK   200   200   000    -    0
240 Head_Flying_Hours       ------   100   253   000    -    6856h+17m+01.666s
241 Total_LBAs_Written      ------   100   253   000    -    2516602234
242 Total_LBAs_Read         ------   100   253   000    -    3246947850
                            ||||||_ K auto-keep
                            |||||__ C event count
                            ||||___ R error rate
                            |||____ S speed/performance
                            ||_____ O updated online
                            |______ P prefailure warning

General Purpose Log Directory Version 1
SMART           Log Directory Version 1 [multi-sector log support]
Address    Access  R/W   Size  Description
0x00       GPL,SL  R/O      1  Log Directory
0x01           SL  R/O      1  Summary SMART error log
0x02           SL  R/O      5  Comprehensive SMART error log
0x03       GPL     R/O      5  Ext. Comprehensive SMART error log
0x06           SL  R/O      1  SMART self-test log
0x07       GPL     R/O      1  Extended self-test log
0x09           SL  R/W      1  Selective self-test log
0x10       GPL     R/O      1  SATA NCQ Queued Error log
0x11       GPL     R/O      1  SATA Phy Event Counters log
0x21       GPL     R/O      1  Write stream error log
0x22       GPL     R/O      1  Read stream error log
0x80-0x9f  GPL,SL  R/W     16  Host vendor specific log
0xa1       GPL,SL  VS      20  Device vendor specific log
0xa2       GPL     VS    2248  Device vendor specific log
0xa8       GPL,SL  VS     129  Device vendor specific log
0xa9       GPL,SL  VS       1  Device vendor specific log
0xab       GPL     VS       1  Device vendor specific log
0xb0       GPL     VS    2928  Device vendor specific log
0xbd       GPL     VS     252  Device vendor specific log
0xbe-0xbf  GPL     VS   65535  Device vendor specific log
0xc0       GPL,SL  VS       1  Device vendor specific log
0xe0       GPL,SL  R/W      1  SCT Command/Status
0xe1       GPL,SL  R/W      1  SCT Data Transfer

SMART Extended Comprehensive Error Log Version: 1 (5 sectors)
No Errors Logged

SMART Extended Self-test Log Version: 1 (1 sectors)
No self-tests have been logged.  [To run self-tests, use: smartctl -t]

SMART Selective self-test log data structure revision number 1
 SPAN  MIN_LBA  MAX_LBA  CURRENT_TEST_STATUS
    1        0        0  Not_testing
    2        0        0  Not_testing
    3        0        0  Not_testing
    4        0        0  Not_testing
    5        0        0  Not_testing
Selective self-test flags (0x0):
  After scanning selected spans, do NOT read-scan remainder of disk.
If Selective self-test is pending on power-up, resume after 0 minute delay.

SCT Status Version:                  3
SCT Version (vendor specific):       522 (0x020a)
SCT Support Level:                   1
Device State:                        Active (0)
Current Temperature:                    36 Celsius
Power Cycle Min/Max Temperature:     26/36 Celsius
Lifetime    Min/Max Temperature:     12/41 Celsius
Under/Over Temperature Limit Count:   0/0

SCT Temperature History Version:     2
Temperature Sampling Period:         1 minute
Temperature Logging Interval:        59 minutes
Min/Max recommended Temperature:     14/55 Celsius
Min/Max Temperature Limit:           10/60 Celsius
Temperature History Size (Index):    128 (93)

Index    Estimated Time   Temperature Celsius
  94    2020-02-26 23:14     ?  -
  95    2020-02-27 00:13    18  -
  96    2020-02-27 01:12    29  **********
  97    2020-02-27 02:11    30  ***********
  98    2020-02-27 03:10    30  ***********
  99    2020-02-27 04:09    30  ***********
 100    2020-02-27 05:08    31  ************
 101    2020-02-27 06:07    31  ************
 102    2020-02-27 07:06     ?  -
 103    2020-02-27 08:05    20  *
 104    2020-02-27 09:04    31  ************
 105    2020-02-27 10:03    32  *************
 106    2020-02-27 11:02    32  *************
 107    2020-02-27 12:01    32  *************
 108    2020-02-27 13:00     ?  -
 109    2020-02-27 13:59    20  *
 110    2020-02-27 14:58    31  ************
 111    2020-02-27 15:57    32  *************
 112    2020-02-27 16:56     ?  -
 113    2020-02-27 17:55    21  **
 114    2020-02-27 18:54    31  ************
 115    2020-02-27 19:53    31  ************
 116    2020-02-27 20:52    31  ************
 117    2020-02-27 21:51    32  *************
 118    2020-02-27 22:50    32  *************
 119    2020-02-27 23:49    32  *************
 120    2020-02-28 00:48    33  **************
 121    2020-02-28 01:47    33  **************
 122    2020-02-28 02:46     ?  -
 123    2020-02-28 03:45    21  **
 124    2020-02-28 04:44    32  *************
 125    2020-02-28 05:43    32  *************
 126    2020-02-28 06:42    32  *************
 127    2020-02-28 07:41    31  ************
   0    2020-02-28 08:40    33  **************
   1    2020-02-28 09:39    32  *************
   2    2020-02-28 10:38     ?  -
   3    2020-02-28 11:37    21  **
   4    2020-02-28 12:36    32  *************
   5    2020-02-28 13:35    31  ************
   6    2020-02-28 14:34    33  **************
   7    2020-02-28 15:33    33  **************
   8    2020-02-28 16:32    32  *************
   9    2020-02-28 17:31    32  *************
  10    2020-02-28 18:30     ?  -
  11    2020-02-28 19:29    21  **
  12    2020-02-28 20:28    30  ***********
  13    2020-02-28 21:27    31  ************
  14    2020-02-28 22:26    32  *************
  15    2020-02-28 23:25     ?  -
  16    2020-02-29 00:24    23  ****
  17    2020-02-29 01:23     ?  -
  18    2020-02-29 02:22    21  **
  19    2020-02-29 03:21    31  ************
  20    2020-02-29 04:20    31  ************
  21    2020-02-29 05:19     ?  -
  22    2020-02-29 06:18    21  **
  23    2020-02-29 07:17    32  *************
  24    2020-02-29 08:16    32  *************
  25    2020-02-29 09:15    33  **************
 ...    ..(  2 skipped).    ..  **************
  28    2020-02-29 12:12    33  **************
  29    2020-02-29 13:11     ?  -
  30    2020-02-29 14:10    21  **
  31    2020-02-29 15:09    32  *************
 ...    ..(  2 skipped).    ..  *************
  34    2020-02-29 18:06    32  *************
  35    2020-02-29 19:05    33  **************
  36    2020-02-29 20:04    32  *************
  37    2020-02-29 21:03     ?  -
  38    2020-02-29 22:02    21  **
  39    2020-02-29 23:01     ?  -
  40    2020-03-01 00:00    23  ****
  41    2020-03-01 00:59     ?  -
  42    2020-03-01 01:58    32  *************
  43    2020-03-01 02:57    33  **************
  44    2020-03-01 03:56    34  ***************
  45    2020-03-01 04:55    35  ****************
  46    2020-03-01 05:54    35  ****************
  47    2020-03-01 06:53    35  ****************
  48    2020-03-01 07:52    36  *****************
  49    2020-03-01 08:51    36  *****************
  50    2020-03-01 09:50     ?  -
  51    2020-03-01 10:49    23  ****
  52    2020-03-01 11:48    32  *************
  53    2020-03-01 12:47    33  **************
  54    2020-03-01 13:46    33  **************
  55    2020-03-01 14:45    34  ***************
  56    2020-03-01 15:44    35  ****************
  57    2020-03-01 16:43    35  ****************
  58    2020-03-01 17:42     ?  -
  59    2020-03-01 18:41    23  ****
  60    2020-03-01 19:40    33  **************
  61    2020-03-01 20:39    34  ***************
  62    2020-03-01 21:38    35  ****************
 ...    ..(  2 skipped).    ..  ****************
  65    2020-03-02 00:35    35  ****************
  66    2020-03-02 01:34     ?  -
  67    2020-03-02 02:33    22  ***
  68    2020-03-02 03:32    32  *************
  69    2020-03-02 04:31     ?  -
  70    2020-03-02 05:30    22  ***
  71    2020-03-02 06:29     ?  -
  72    2020-03-02 07:28    25  ******
  73    2020-03-02 08:27    35  ****************
  74    2020-03-02 09:26    36  *****************
  75    2020-03-02 10:25    37  ******************
  76    2020-03-02 11:24    37  ******************
  77    2020-03-02 12:23    37  ******************
  78    2020-03-02 13:22     ?  -
  79    2020-03-02 14:21    26  *******
  80    2020-03-02 15:20    35  ****************
  81    2020-03-02 16:19    36  *****************
  82    2020-03-02 17:18    36  *****************
  83    2020-03-02 18:17     ?  -
  84    2020-03-02 19:16    23  ****
  85    2020-03-02 20:15    33  **************
  86    2020-03-02 21:14     ?  -
  87    2020-03-02 22:13    22  ***
  88    2020-03-02 23:12     ?  -
  89    2020-03-03 00:11    21  **
  90    2020-03-03 01:10     ?  -
  91    2020-03-03 02:09    25  ******
  92    2020-03-03 03:08     ?  -
  93    2020-03-03 04:07    26  *******

SCT Error Recovery Control:
           Read: Disabled
          Write: Disabled

Device Statistics (GP/SMART Log 0x04) not supported

SATA Phy Event Counters (GP Log 0x11)
ID      Size     Value  Description
0x000a  2            1  Device-to-host register FISes sent due to a COMRESET
0x0001  2            0  Command failed due to ICRC error
0x0003  2            0  R_ERR response for device-to-host data FIS
0x0004  2            0  R_ERR response for host-to-device data FIS
0x0006  2            0  R_ERR response for device-to-host non-data FIS
0x0007  2            0  R_ERR response for host-to-device non-data FIS

