smartctl 6.6 2016-05-31 r4324 [x86_64-linux-5.3.0-40-generic] (local build)
Copyright (C) 2002-16, Bruce Allen, Christian Franke, www.smartmontools.org

=== START OF INFORMATION SECTION ===
Model Family:     SAMSUNG SpinPoint T133
Device Model:     SAMSUNG HD300LJ
Serial Number:    S0D7J13LB03910
Firmware Version: ZT100-13
User Capacity:    300.067.970.560 bytes [300 GB]
Sector Size:      512 bytes logical/physical
Device is:        In smartctl database [for details use: -P show]
ATA Version is:   ATA/ATAPI-7 T13/1532D revision 4a
Local Time is:    Thu Feb 27 23:14:03 2020 CET
SMART support is: Available - device has SMART capability.
SMART support is: Enabled

=== START OF READ SMART DATA SECTION ===
SMART overall-health self-assessment test result: PASSED

General SMART Values:
Offline data collection status:  (0x85)	Offline data collection activity
					was aborted by an interrupting command from host.
					Auto Offline Data Collection: Enabled.
Self-test execution status:      (   0)	The previous self-test routine completed
					without error or no self-test has ever 
					been run.
Total time to complete Offline 
data collection: 		( 7133) seconds.
Offline data collection
capabilities: 			 (0x5b) SMART execute Offline immediate.
					Auto Offline data collection on/off support.
					Suspend Offline collection upon new
					command.
					Offline surface scan supported.
					Self-test supported.
					No Conveyance Self-test supported.
					Selective Self-test supported.
SMART capabilities:            (0x0003)	Saves SMART data before entering
					power-saving mode.
					Supports SMART auto save timer.
Error logging capability:        (0x01)	Error logging supported.
					General Purpose Logging supported.
Short self-test routine 
recommended polling time: 	 (   2) minutes.
Extended self-test routine
recommended polling time: 	 ( 128) minutes.
SCT capabilities: 	       (0x003f)	SCT Status supported.
					SCT Error Recovery Control supported.
					SCT Feature Control supported.
					SCT Data Table supported.

SMART Attributes Data Structure revision number: 16
Vendor Specific SMART Attributes with Thresholds:
ID# ATTRIBUTE_NAME          FLAG     VALUE WORST THRESH TYPE      UPDATED  WHEN_FAILED RAW_VALUE
  1 Raw_Read_Error_Rate     0x000f   253   100   051    Pre-fail  Always       -       0
  3 Spin_Up_Time            0x0007   100   100   015    Pre-fail  Always       -       7872
  4 Start_Stop_Count        0x0032   100   100   000    Old_age   Always       -       641
  5 Reallocated_Sector_Ct   0x0033   253   253   010    Pre-fail  Always       -       0
  7 Seek_Error_Rate         0x000f   253   253   051    Pre-fail  Always       -       0
  8 Seek_Time_Performance   0x0025   253   253   015    Pre-fail  Offline      -       0
  9 Power_On_Hours          0x0032   100   100   000    Old_age   Always       -       9690
 10 Spin_Retry_Count        0x0033   253   253   051    Pre-fail  Always       -       0
 11 Calibration_Retry_Count 0x0012   253   253   000    Old_age   Always       -       0
 12 Power_Cycle_Count       0x0032   100   100   000    Old_age   Always       -       520
190 Airflow_Temperature_Cel 0x0022   078   052   000    Old_age   Always       -       22
194 Temperature_Celsius     0x0022   172   094   000    Old_age   Always       -       22
195 Hardware_ECC_Recovered  0x001a   100   100   000    Old_age   Always       -       12210
196 Reallocated_Event_Count 0x0032   253   253   000    Old_age   Always       -       0
197 Current_Pending_Sector  0x0012   253   253   000    Old_age   Always       -       0
198 Offline_Uncorrectable   0x0030   253   253   000    Old_age   Offline      -       0
199 UDMA_CRC_Error_Count    0x003e   200   200   000    Old_age   Always       -       0
200 Multi_Zone_Error_Rate   0x000a   253   100   000    Old_age   Always       -       0
201 Soft_Read_Error_Rate    0x000a   253   100   000    Old_age   Always       -       0
202 Data_Address_Mark_Errs  0x0032   253   253   000    Old_age   Always       -       0

SMART Error Log Version: 1
No Errors Logged

SMART Self-test log structure revision number 1
Num  Test_Description    Status                  Remaining  LifeTime(hours)  LBA_of_first_error
# 1  Short offline       Completed without error       00%      9674         -

SMART Selective self-test log data structure revision number 0
Note: revision number not 1 implies that no selective self-test has ever been run
 SPAN  MIN_LBA  MAX_LBA  CURRENT_TEST_STATUS
    1        0        0  Not_testing
    2        0        0  Not_testing
    3        0        0  Not_testing
    4        0        0  Not_testing
    5        0        0  Not_testing
Selective self-test flags (0x0):
  After scanning selected spans, do NOT read-scan remainder of disk.
If Selective self-test is pending on power-up, resume after 0 minute delay.

