smartctl 6.6 2016-05-31 r4324 [x86_64-linux-5.3.0-40-generic] (local build)
Copyright (C) 2002-16, Bruce Allen, Christian Franke, www.smartmontools.org

=== START OF INFORMATION SECTION ===
Model Family:     Seagate Barracuda 7200.12
Device Model:     ST3320418AS
Serial Number:    9VMVQ1CZ
LU WWN Device Id: 5 000c50 02d5a551e
Firmware Version: CC46
User Capacity:    320.072.933.376 bytes [320 GB]
Sector Size:      512 bytes logical/physical
Rotation Rate:    7200 rpm
Device is:        In smartctl database [for details use: -P show]
ATA Version is:   ATA8-ACS T13/1699-D revision 4
SATA Version is:  SATA 2.6, 3.0 Gb/s
Local Time is:    Sat Feb 29 23:42:49 2020 CET

==> WARNING: A firmware update for this drive may be available,
see the following Seagate web pages:
http://knowledge.seagate.com/articles/en_US/FAQ/207931en
http://knowledge.seagate.com/articles/en_US/FAQ/213891en

SMART support is: Available - device has SMART capability.
SMART support is: Enabled
AAM level is:     0 (vendor specific), recommended: 254
APM feature is:   Unavailable
Rd look-ahead is: Enabled
Write cache is:   Enabled
ATA Security is:  Disabled, NOT FROZEN [SEC1]
Wt Cache Reorder: Unknown

=== START OF READ SMART DATA SECTION ===
SMART overall-health self-assessment test result: PASSED

General SMART Values:
Offline data collection status:  (0x82)	Offline data collection activity
					was completed without error.
					Auto Offline Data Collection: Enabled.
Self-test execution status:      (   0)	The previous self-test routine completed
					without error or no self-test has ever 
					been run.
Total time to complete Offline 
data collection: 		(  617) seconds.
Offline data collection
capabilities: 			 (0x7b) SMART execute Offline immediate.
					Auto Offline data collection on/off support.
					Suspend Offline collection upon new
					command.
					Offline surface scan supported.
					Self-test supported.
					Conveyance Self-test supported.
					Selective Self-test supported.
SMART capabilities:            (0x0003)	Saves SMART data before entering
					power-saving mode.
					Supports SMART auto save timer.
Error logging capability:        (0x01)	Error logging supported.
					General Purpose Logging supported.
Short self-test routine 
recommended polling time: 	 (   1) minutes.
Extended self-test routine
recommended polling time: 	 (  63) minutes.
Conveyance self-test routine
recommended polling time: 	 (   2) minutes.
SCT capabilities: 	       (0x103f)	SCT Status supported.
					SCT Error Recovery Control supported.
					SCT Feature Control supported.
					SCT Data Table supported.

SMART Attributes Data Structure revision number: 10
Vendor Specific SMART Attributes with Thresholds:
ID# ATTRIBUTE_NAME          FLAGS    VALUE WORST THRESH FAIL RAW_VALUE
  1 Raw_Read_Error_Rate     POSR--   118   099   006    -    183201828
  3 Spin_Up_Time            PO----   097   097   000    -    0
  4 Start_Stop_Count        -O--CK   098   098   020    -    2242
  5 Reallocated_Sector_Ct   PO--CK   100   100   036    -    0
  7 Seek_Error_Rate         POSR--   081   060   030    -    147679259
  9 Power_On_Hours          -O--CK   088   088   000    -    10567
 10 Spin_Retry_Count        PO--C-   100   100   097    -    0
 12 Power_Cycle_Count       -O--CK   099   099   020    -    1121
183 Runtime_Bad_Block       -O--CK   100   100   000    -    0
184 End-to-End_Error        -O--CK   100   100   099    -    0
187 Reported_Uncorrect      -O--CK   100   100   000    -    0
188 Command_Timeout         -O--CK   100   100   000    -    0
189 High_Fly_Writes         -O-RCK   100   100   000    -    0
190 Airflow_Temperature_Cel -O---K   074   062   045    -    26 (Min/Max 23/26)
194 Temperature_Celsius     -O---K   026   040   000    -    26 (0 13 0 0 0)
195 Hardware_ECC_Recovered  -O-RC-   047   032   000    -    183201828
197 Current_Pending_Sector  -O--C-   100   100   000    -    0
198 Offline_Uncorrectable   ----C-   100   100   000    -    0
199 UDMA_CRC_Error_Count    -OSRCK   200   200   000    -    0
240 Head_Flying_Hours       ------   100   253   000    -    13687 (164 232 0)
241 Total_LBAs_Written      ------   100   253   000    -    4046740106
242 Total_LBAs_Read         ------   100   253   000    -    2150989829
                            ||||||_ K auto-keep
                            |||||__ C event count
                            ||||___ R error rate
                            |||____ S speed/performance
                            ||_____ O updated online
                            |______ P prefailure warning

General Purpose Log Directory Version 1
SMART           Log Directory Version 1 [multi-sector log support]
Address    Access  R/W   Size  Description
0x00       GPL,SL  R/O      1  Log Directory
0x01       GPL,SL  R/O      1  Summary SMART error log
0x02       GPL,SL  R/O      5  Comprehensive SMART error log
0x03       GPL     R/O      5  Ext. Comprehensive SMART error log
0x06       GPL,SL  R/O      1  SMART self-test log
0x07       GPL     R/O      1  Extended self-test log
0x09       GPL,SL  R/W      1  Selective self-test log
0x10       GPL     R/O      1  SATA NCQ Queued Error log
0x11       GPL     R/O      1  SATA Phy Event Counters log
0x21       GPL     R/O      1  Write stream error log
0x22       GPL     R/O      1  Read stream error log
0x80-0x9f  GPL,SL  R/W     16  Host vendor specific log
0xa1       GPL,SL  VS      20  Device vendor specific log
0xa2       GPL     VS    2248  Device vendor specific log
0xa8       GPL,SL  VS     129  Device vendor specific log
0xa9       GPL,SL  VS       1  Device vendor specific log
0xb0       GPL     VS    2928  Device vendor specific log
0xbd       GPL     VS     252  Device vendor specific log
0xbe-0xbf  GPL     VS   65535  Device vendor specific log
0xc0       GPL,SL  VS       1  Device vendor specific log
0xe0       GPL,SL  R/W      1  SCT Command/Status
0xe1       GPL,SL  R/W      1  SCT Data Transfer

SMART Extended Comprehensive Error Log Version: 1 (5 sectors)
No Errors Logged

SMART Extended Self-test Log Version: 1 (1 sectors)
Num  Test_Description    Status                  Remaining  LifeTime(hours)  LBA_of_first_error
# 1  Short offline       Completed without error       00%         0         -

SMART Selective self-test log data structure revision number 1
 SPAN  MIN_LBA  MAX_LBA  CURRENT_TEST_STATUS
    1        0        0  Not_testing
    2        0        0  Not_testing
    3        0        0  Not_testing
    4        0        0  Not_testing
    5        0        0  Not_testing
Selective self-test flags (0x0):
  After scanning selected spans, do NOT read-scan remainder of disk.
If Selective self-test is pending on power-up, resume after 0 minute delay.

SCT Status Version:                  3
SCT Version (vendor specific):       522 (0x020a)
SCT Support Level:                   1
Device State:                        Active (0)
Current Temperature:                    24 Celsius
Power Cycle Min/Max Temperature:     23/24 Celsius
Lifetime    Min/Max Temperature:     13/38 Celsius
Under/Over Temperature Limit Count:   0/0

SCT Temperature History Version:     2
Temperature Sampling Period:         1 minute
Temperature Logging Interval:        59 minutes
Min/Max recommended Temperature:     14/55 Celsius
Min/Max Temperature Limit:           10/60 Celsius
Temperature History Size (Index):    128 (87)

Index    Estimated Time   Temperature Celsius
  88    2020-02-24 18:08    28  *********
  89    2020-02-24 19:07    27  ********
 ...    ..(  2 skipped).    ..  ********
  92    2020-02-24 22:04    27  ********
  93    2020-02-24 23:03    28  *********
 ...    ..(  7 skipped).    ..  *********
 101    2020-02-25 06:55    28  *********
 102    2020-02-25 07:54     ?  -
 103    2020-02-25 08:53    19  -
 104    2020-02-25 09:52     ?  -
 105    2020-02-25 10:51    26  *******
 106    2020-02-25 11:50     ?  -
 107    2020-02-25 12:49    26  *******
 108    2020-02-25 13:48    26  *******
 109    2020-02-25 14:47    30  ***********
 110    2020-02-25 15:46    30  ***********
 111    2020-02-25 16:45    30  ***********
 112    2020-02-25 17:44    29  **********
 113    2020-02-25 18:43     ?  -
 114    2020-02-25 19:42    28  *********
 115    2020-02-25 20:41    28  *********
 116    2020-02-25 21:40    30  ***********
 117    2020-02-25 22:39    29  **********
 118    2020-02-25 23:38    29  **********
 119    2020-02-26 00:37     ?  -
 120    2020-02-26 01:36    19  -
 121    2020-02-26 02:35    19  -
 122    2020-02-26 03:34     ?  -
 123    2020-02-26 04:33    29  **********
 124    2020-02-26 05:32     ?  -
 125    2020-02-26 06:31    19  -
 126    2020-02-26 07:30    19  -
 127    2020-02-26 08:29    29  **********
 ...    ..( 13 skipped).    ..  **********
  13    2020-02-26 22:15    29  **********
  14    2020-02-26 23:14    31  ************
  15    2020-02-27 00:13    29  **********
  16    2020-02-27 01:12    28  *********
  17    2020-02-27 02:11    28  *********
  18    2020-02-27 03:10    28  *********
  19    2020-02-27 04:09    29  **********
  20    2020-02-27 05:08    28  *********
 ...    ..( 12 skipped).    ..  *********
  33    2020-02-27 17:55    28  *********
  34    2020-02-27 18:54     ?  -
  35    2020-02-27 19:53    19  -
  36    2020-02-27 20:52    19  -
  37    2020-02-27 21:51    30  ***********
  38    2020-02-27 22:50    31  ************
  39    2020-02-27 23:49    28  *********
 ...    ..(  8 skipped).    ..  *********
  48    2020-02-28 08:40    28  *********
  49    2020-02-28 09:39     ?  -
  50    2020-02-28 10:38    18  -
  51    2020-02-28 11:37    18  -
  52    2020-02-28 12:36    29  **********
  53    2020-02-28 13:35    28  *********
 ...    ..( 18 skipped).    ..  *********
  72    2020-02-29 08:16    28  *********
  73    2020-02-29 09:15     ?  -
  74    2020-02-29 10:14    19  -
  75    2020-02-29 11:13    19  -
  76    2020-02-29 12:12    29  **********
  77    2020-02-29 13:11    29  **********
  78    2020-02-29 14:10    29  **********
  79    2020-02-29 15:09     ?  -
  80    2020-02-29 16:08    19  -
  81    2020-02-29 17:07     ?  -
  82    2020-02-29 18:06    18  -
  83    2020-02-29 19:05     ?  -
  84    2020-02-29 20:04    16  -
  85    2020-02-29 21:03     ?  -
  86    2020-02-29 22:02    23  ****
  87    2020-02-29 23:01    23  ****

SCT Error Recovery Control:
           Read: Disabled
          Write: Disabled

Device Statistics (GP/SMART Log 0x04) not supported

SATA Phy Event Counters (GP Log 0x11)
ID      Size     Value  Description
0x000a  2            1  Device-to-host register FISes sent due to a COMRESET
0x0001  2            0  Command failed due to ICRC error
0x0003  2            0  R_ERR response for device-to-host data FIS
0x0004  2            0  R_ERR response for host-to-device data FIS
0x0006  2            0  R_ERR response for device-to-host non-data FIS
0x0007  2            0  R_ERR response for host-to-device non-data FIS

