smartctl 6.6 2016-05-31 r4324 [x86_64-linux-5.3.0-40-generic] (local build)
Copyright (C) 2002-16, Bruce Allen, Christian Franke, www.smartmontools.org

=== START OF INFORMATION SECTION ===
Model Family:     Hitachi/HGST Travelstar Z5K320
Device Model:     Hitachi HTS543225A7A384
Serial Number:    E00G42333PDJLS
LU WWN Device Id: 5 000cca 6c7f4015c
Firmware Version: ESBOA60W
User Capacity:    250.059.350.016 bytes [250 GB]
Sector Size:      512 bytes logical/physical
Rotation Rate:    5400 rpm
Form Factor:      2.5 inches
Device is:        In smartctl database [for details use: -P show]
ATA Version is:   ATA8-ACS T13/1699-D revision 6
SATA Version is:  SATA 2.6, 3.0 Gb/s
Local Time is:    Sat Feb 29 22:20:36 2020 CET
SMART support is: Available - device has SMART capability.
SMART support is: Enabled
AAM feature is:   Unavailable
APM level is:     128 (minimum power consumption without standby)
Rd look-ahead is: Enabled
Write cache is:   Enabled
ATA Security is:  Disabled, NOT FROZEN [SEC1]
Wt Cache Reorder: Enabled

=== START OF READ SMART DATA SECTION ===
SMART overall-health self-assessment test result: PASSED

General SMART Values:
Offline data collection status:  (0x00)	Offline data collection activity
					was never started.
					Auto Offline Data Collection: Disabled.
Self-test execution status:      (   0)	The previous self-test routine completed
					without error or no self-test has ever 
					been run.
Total time to complete Offline 
data collection: 		(   45) seconds.
Offline data collection
capabilities: 			 (0x5b) SMART execute Offline immediate.
					Auto Offline data collection on/off support.
					Suspend Offline collection upon new
					command.
					Offline surface scan supported.
					Self-test supported.
					No Conveyance Self-test supported.
					Selective Self-test supported.
SMART capabilities:            (0x0003)	Saves SMART data before entering
					power-saving mode.
					Supports SMART auto save timer.
Error logging capability:        (0x01)	Error logging supported.
					General Purpose Logging supported.
Short self-test routine 
recommended polling time: 	 (   2) minutes.
Extended self-test routine
recommended polling time: 	 (  78) minutes.
SCT capabilities: 	       (0x003d)	SCT Status supported.
					SCT Error Recovery Control supported.
					SCT Feature Control supported.
					SCT Data Table supported.

SMART Attributes Data Structure revision number: 16
Vendor Specific SMART Attributes with Thresholds:
ID# ATTRIBUTE_NAME          FLAGS    VALUE WORST THRESH FAIL RAW_VALUE
  1 Raw_Read_Error_Rate     PO-R--   100   100   062    -    0
  2 Throughput_Performance  P-S---   100   100   040    -    0
  3 Spin_Up_Time            POS---   253   253   033    -    1
  4 Start_Stop_Count        -O--C-   100   100   000    -    910
  5 Reallocated_Sector_Ct   PO--CK   100   100   005    -    0
  7 Seek_Error_Rate         PO-R--   100   100   067    -    0
  8 Seek_Time_Performance   P-S---   100   100   040    -    0
  9 Power_On_Hours          -O--C-   084   084   000    -    7045
 10 Spin_Retry_Count        PO--C-   100   100   060    -    0
 12 Power_Cycle_Count       -O--CK   100   100   000    -    901
191 G-Sense_Error_Rate      -O-R--   100   100   000    -    0
192 Power-Off_Retract_Count -O--CK   100   100   000    -    30
193 Load_Cycle_Count        -O--C-   093   093   000    -    74601
194 Temperature_Celsius     -O----   200   200   000    -    30 (Min/Max 17/55)
196 Reallocated_Event_Count -O--CK   100   100   000    -    0
197 Current_Pending_Sector  -O---K   100   100   000    -    0
198 Offline_Uncorrectable   ---R--   100   100   000    -    0
199 UDMA_CRC_Error_Count    -O-R--   200   200   000    -    0
223 Load_Retry_Count        -O-R--   100   100   000    -    0
                            ||||||_ K auto-keep
                            |||||__ C event count
                            ||||___ R error rate
                            |||____ S speed/performance
                            ||_____ O updated online
                            |______ P prefailure warning

General Purpose Log Directory Version 1
SMART           Log Directory Version 1 [multi-sector log support]
Address    Access  R/W   Size  Description
0x00       GPL,SL  R/O      1  Log Directory
0x01           SL  R/O      1  Summary SMART error log
0x02           SL  R/O      1  Comprehensive SMART error log
0x03       GPL     R/O      1  Ext. Comprehensive SMART error log
0x04       GPL     R/O      7  Device Statistics log
0x06           SL  R/O      1  SMART self-test log
0x07       GPL     R/O      1  Extended self-test log
0x09           SL  R/W      1  Selective self-test log
0x10       GPL     R/O      1  SATA NCQ Queued Error log
0x11       GPL     R/O      1  SATA Phy Event Counters log
0x80-0x9f  GPL,SL  R/W     16  Host vendor specific log
0xe0       GPL,SL  R/W      1  SCT Command/Status
0xe1       GPL,SL  R/W      1  SCT Data Transfer

SMART Extended Comprehensive Error Log Version: 1 (1 sectors)
No Errors Logged

SMART Extended Self-test Log Version: 1 (1 sectors)
No self-tests have been logged.  [To run self-tests, use: smartctl -t]

SMART Selective self-test log data structure revision number 1
 SPAN  MIN_LBA  MAX_LBA  CURRENT_TEST_STATUS
    1        0        0  Not_testing
    2        0        0  Not_testing
    3        0        0  Not_testing
    4        0        0  Not_testing
    5        0        0  Not_testing
Selective self-test flags (0x0):
  After scanning selected spans, do NOT read-scan remainder of disk.
If Selective self-test is pending on power-up, resume after 0 minute delay.

SCT Status Version:                  3
SCT Version (vendor specific):       256 (0x0100)
SCT Support Level:                   1
Device State:                        Active (0)
Current Temperature:                    30 Celsius
Power Cycle Min/Max Temperature:     27/30 Celsius
Lifetime    Min/Max Temperature:     17/55 Celsius
Lifetime    Average Temperature:        44 Celsius
Under/Over Temperature Limit Count:   0/0

SCT Temperature History Version:     2
Temperature Sampling Period:         1 minute
Temperature Logging Interval:        1 minute
Min/Max recommended Temperature:      0/60 Celsius
Min/Max Temperature Limit:           -40/65 Celsius
Temperature History Size (Index):    128 (106)

Index    Estimated Time   Temperature Celsius
 107    2020-02-29 20:13    21  **
 108    2020-02-29 20:14    22  ***
 109    2020-02-29 20:15    22  ***
 110    2020-02-29 20:16    22  ***
 111    2020-02-29 20:17    21  **
 112    2020-02-29 20:18    22  ***
 ...    ..(  2 skipped).    ..  ***
 115    2020-02-29 20:21    22  ***
 116    2020-02-29 20:22    21  **
 117    2020-02-29 20:23    22  ***
 118    2020-02-29 20:24    21  **
 119    2020-02-29 20:25    21  **
 120    2020-02-29 20:26    22  ***
 121    2020-02-29 20:27    21  **
 122    2020-02-29 20:28    22  ***
 ...    ..(  9 skipped).    ..  ***
   4    2020-02-29 20:38    22  ***
   5    2020-02-29 20:39    23  ****
   6    2020-02-29 20:40    22  ***
   7    2020-02-29 20:41    23  ****
 ...    ..(  3 skipped).    ..  ****
  11    2020-02-29 20:45    23  ****
  12    2020-02-29 20:46    24  *****
  13    2020-02-29 20:47    24  *****
  14    2020-02-29 20:48    23  ****
  15    2020-02-29 20:49    24  *****
 ...    ..(  3 skipped).    ..  *****
  19    2020-02-29 20:53    24  *****
  20    2020-02-29 20:54    23  ****
  21    2020-02-29 20:55    24  *****
  22    2020-02-29 20:56    23  ****
 ...    ..(  9 skipped).    ..  ****
  32    2020-02-29 21:06    23  ****
  33    2020-02-29 21:07    22  ***
  34    2020-02-29 21:08    22  ***
  35    2020-02-29 21:09    23  ****
  36    2020-02-29 21:10    23  ****
  37    2020-02-29 21:11    22  ***
 ...    ..( 18 skipped).    ..  ***
  56    2020-02-29 21:30    22  ***
  57    2020-02-29 21:31    23  ****
  58    2020-02-29 21:32    23  ****
  59    2020-02-29 21:33    22  ***
  60    2020-02-29 21:34    23  ****
 ...    ..(  3 skipped).    ..  ****
  64    2020-02-29 21:38    23  ****
  65    2020-02-29 21:39    24  *****
 ...    ..(  4 skipped).    ..  *****
  70    2020-02-29 21:44    24  *****
  71    2020-02-29 21:45     ?  -
  72    2020-02-29 21:46    19  -
  73    2020-02-29 21:47    20  *
  74    2020-02-29 21:48    21  **
  75    2020-02-29 21:49    22  ***
  76    2020-02-29 21:50    23  ****
  77    2020-02-29 21:51    24  *****
  78    2020-02-29 21:52    24  *****
  79    2020-02-29 21:53    24  *****
  80    2020-02-29 21:54    25  ******
  81    2020-02-29 21:55    26  *******
  82    2020-02-29 21:56    26  *******
  83    2020-02-29 21:57    26  *******
  84    2020-02-29 21:58    27  ********
  85    2020-02-29 21:59    27  ********
  86    2020-02-29 22:00    27  ********
  87    2020-02-29 22:01    28  *********
  88    2020-02-29 22:02    28  *********
  89    2020-02-29 22:03     ?  -
  90    2020-02-29 22:04     ?  -
  91    2020-02-29 22:05    22  ***
  92    2020-02-29 22:06     ?  -
  93    2020-02-29 22:07    27  ********
  94    2020-02-29 22:08    28  *********
 ...    ..(  2 skipped).    ..  *********
  97    2020-02-29 22:11    28  *********
  98    2020-02-29 22:12    29  **********
 ...    ..(  3 skipped).    ..  **********
 102    2020-02-29 22:16    29  **********
 103    2020-02-29 22:17    30  ***********
 ...    ..(  2 skipped).    ..  ***********
 106    2020-02-29 22:20    30  ***********

SCT Error Recovery Control:
           Read: Disabled
          Write: Disabled

Device Statistics (GP Log 0x04)
Page  Offset Size        Value Flags Description
0x01  =====  =               =  ===  == General Statistics (rev 1) ==
0x01  0x008  4             901  ---  Lifetime Power-On Resets
0x01  0x010  4            7045  ---  Power-on Hours
0x01  0x018  6      8190378689  ---  Logical Sectors Written
0x01  0x020  6       161577173  ---  Number of Write Commands
0x01  0x028  6     12190404596  ---  Logical Sectors Read
0x01  0x030  6       235993277  ---  Number of Read Commands
0x03  =====  =               =  ===  == Rotating Media Statistics (rev 1) ==
0x03  0x008  4            6818  ---  Spindle Motor Power-on Hours
0x03  0x010  4            6812  ---  Head Flying Hours
0x03  0x018  4           74601  ---  Head Load Events
0x03  0x020  4               0  ---  Number of Reallocated Logical Sectors
0x03  0x028  4               2  ---  Read Recovery Attempts
0x03  0x030  4               0  ---  Number of Mechanical Start Failures
0x04  =====  =               =  ===  == General Errors Statistics (rev 1) ==
0x04  0x008  4               0  ---  Number of Reported Uncorrectable Errors
0x04  0x010  4            2178  ---  Resets Between Cmd Acceptance and Completion
0x05  =====  =               =  ===  == Temperature Statistics (rev 1) ==
0x05  0x008  1              30  ---  Current Temperature
0x05  0x010  1              37  N--  Average Short Term Temperature
0x05  0x018  1              40  N--  Average Long Term Temperature
0x05  0x020  1              55  ---  Highest Temperature
0x05  0x028  1              17  ---  Lowest Temperature
0x05  0x030  1              49  N--  Highest Average Short Term Temperature
0x05  0x038  1              25  N--  Lowest Average Short Term Temperature
0x05  0x040  1              46  N--  Highest Average Long Term Temperature
0x05  0x048  1              25  N--  Lowest Average Long Term Temperature
0x05  0x050  4               0  ---  Time in Over-Temperature
0x05  0x058  1              60  ---  Specified Maximum Operating Temperature
0x05  0x060  4               0  ---  Time in Under-Temperature
0x05  0x068  1               0  ---  Specified Minimum Operating Temperature
0x06  =====  =               =  ===  == Transport Statistics (rev 1) ==
0x06  0x008  4            2991  ---  Number of Hardware Resets
0x06  0x010  4             954  ---  Number of ASR Events
0x06  0x018  4               0  ---  Number of Interface CRC Errors
                                |||_ C monitored condition met
                                ||__ D supports DSN
                                |___ N normalized value

SATA Phy Event Counters (GP Log 0x11)
ID      Size     Value  Description
0x0001  2            0  Command failed due to ICRC error
0x0002  2            0  R_ERR response for data FIS
0x0003  2            0  R_ERR response for device-to-host data FIS
0x0004  2            0  R_ERR response for host-to-device data FIS
0x0005  2            0  R_ERR response for non-data FIS
0x0006  2            0  R_ERR response for device-to-host non-data FIS
0x0007  2            0  R_ERR response for host-to-device non-data FIS
0x0009  2            0  Transition from drive PhyRdy to drive PhyNRdy
0x000a  2            0  Device-to-host register FISes sent due to a COMRESET
0x000b  2            0  CRC errors within host-to-device FIS
0x000d  2            0  Non-CRC errors within host-to-device FIS

