smartctl 6.6 2016-05-31 r4324 [x86_64-linux-5.3.0-40-generic] (local build)
Copyright (C) 2002-16, Bruce Allen, Christian Franke, www.smartmontools.org

=== START OF INFORMATION SECTION ===
Device Model:     TOSHIBA MQ03ABB200
Serial Number:    371IC5YCT
LU WWN Device Id: 5 000039 7a3b80322
Firmware Version: JP050U
User Capacity:    2.000.398.934.016 bytes [2,00 TB]
Sector Sizes:     512 bytes logical, 4096 bytes physical
Rotation Rate:    5400 rpm
Form Factor:      2.5 inches
Device is:        Not in smartctl database [for details use: -P showall]
ATA Version is:   ATA8-ACS (minor revision not indicated)
SATA Version is:  SATA 3.0, 6.0 Gb/s (current: 3.0 Gb/s)
Local Time is:    Mon Mar  2 00:28:10 2020 CET
SMART support is: Available - device has SMART capability.
SMART support is: Enabled
AAM feature is:   Unavailable
APM level is:     128 (minimum power consumption without standby)
Rd look-ahead is: Enabled
Write cache is:   Enabled
ATA Security is:  Disabled, NOT FROZEN [SEC1]
Wt Cache Reorder: Enabled

=== START OF READ SMART DATA SECTION ===
SMART overall-health self-assessment test result: PASSED

General SMART Values:
Offline data collection status:  (0x00)	Offline data collection activity
					was never started.
					Auto Offline Data Collection: Disabled.
Self-test execution status:      (   0)	The previous self-test routine completed
					without error or no self-test has ever 
					been run.
Total time to complete Offline 
data collection: 		(  120) seconds.
Offline data collection
capabilities: 			 (0x5b) SMART execute Offline immediate.
					Auto Offline data collection on/off support.
					Suspend Offline collection upon new
					command.
					Offline surface scan supported.
					Self-test supported.
					No Conveyance Self-test supported.
					Selective Self-test supported.
SMART capabilities:            (0x0003)	Saves SMART data before entering
					power-saving mode.
					Supports SMART auto save timer.
Error logging capability:        (0x01)	Error logging supported.
					General Purpose Logging supported.
Short self-test routine 
recommended polling time: 	 (   2) minutes.
Extended self-test routine
recommended polling time: 	 ( 372) minutes.
SCT capabilities: 	       (0x003d)	SCT Status supported.
					SCT Error Recovery Control supported.
					SCT Feature Control supported.
					SCT Data Table supported.

SMART Attributes Data Structure revision number: 16
Vendor Specific SMART Attributes with Thresholds:
ID# ATTRIBUTE_NAME          FLAGS    VALUE WORST THRESH FAIL RAW_VALUE
  1 Raw_Read_Error_Rate     PO-R--   100   099   050    -    0
  2 Throughput_Performance  P-S---   100   100   050    -    0
  3 Spin_Up_Time            POS--K   100   100   001    -    4103
  4 Start_Stop_Count        -O--CK   100   100   000    -    139
  5 Reallocated_Sector_Ct   PO--CK   100   100   050    -    1320
  7 Seek_Error_Rate         PO-R--   100   100   050    -    0
  8 Seek_Time_Performance   P-S---   100   100   050    -    0
  9 Power_On_Hours          -O--CK   093   093   000    -    2896
 10 Spin_Retry_Count        PO--CK   102   100   030    -    0
 12 Power_Cycle_Count       -O--CK   100   100   000    -    50
191 G-Sense_Error_Rate      -O--CK   100   100   000    -    4
192 Power-Off_Retract_Count -O--CK   100   100   000    -    13
193 Load_Cycle_Count        -O--CK   100   100   000    -    1486
194 Temperature_Celsius     -O---K   100   100   000    -    29 (Min/Max 18/44)
196 Reallocated_Event_Count -O--CK   100   100   000    -    126
197 Current_Pending_Sector  -O--CK   100   100   000    -    112
198 Offline_Uncorrectable   ----CK   100   100   000    -    0
199 UDMA_CRC_Error_Count    -O--CK   200   200   000    -    0
220 Disk_Shift              -O----   100   100   000    -    0
222 Loaded_Hours            -O--CK   100   100   000    -    39
223 Load_Retry_Count        -O--CK   100   100   000    -    0
224 Load_Friction           -O---K   100   100   000    -    0
226 Load-in_Time            -OS--K   100   100   000    -    268
240 Head_Flying_Hours       P-----   100   100   001    -    0
                            ||||||_ K auto-keep
                            |||||__ C event count
                            ||||___ R error rate
                            |||____ S speed/performance
                            ||_____ O updated online
                            |______ P prefailure warning

General Purpose Log Directory Version 1
SMART           Log Directory Version 1 [multi-sector log support]
Address    Access  R/W   Size  Description
0x00       GPL,SL  R/O      1  Log Directory
0x01           SL  R/O      1  Summary SMART error log
0x02           SL  R/O     51  Comprehensive SMART error log
0x03       GPL     R/O     64  Ext. Comprehensive SMART error log
0x04       GPL,SL  R/O      8  Device Statistics log
0x06           SL  R/O      1  SMART self-test log
0x07       GPL     R/O      1  Extended self-test log
0x09           SL  R/W      1  Selective self-test log
0x10       GPL     R/O      1  SATA NCQ Queued Error log
0x11       GPL     R/O      1  SATA Phy Event Counters log
0x24       GPL     R/O  12288  Current Device Internal Status Data log
0x25       GPL     R/O  12288  Saved Device Internal Status Data log
0x30       GPL,SL  R/O      9  IDENTIFY DEVICE data log
0x80-0x9f  GPL,SL  R/W     16  Host vendor specific log
0xa7       GPL     VS       8  Device vendor specific log
0xe0       GPL,SL  R/W      1  SCT Command/Status
0xe1       GPL,SL  R/W      1  SCT Data Transfer

SMART Extended Comprehensive Error Log Version: 1 (64 sectors)
Device Error Count: 2
	CR     = Command Register
	FEATR  = Features Register
	COUNT  = Count (was: Sector Count) Register
	LBA_48 = Upper bytes of LBA High/Mid/Low Registers ]  ATA-8
	LH     = LBA High (was: Cylinder High) Register    ]   LBA
	LM     = LBA Mid (was: Cylinder Low) Register      ] Register
	LL     = LBA Low (was: Sector Number) Register     ]
	DV     = Device (was: Device/Head) Register
	DC     = Device Control Register
	ER     = Error register
	ST     = Status register
Powered_Up_Time is measured from power on, and printed as
DDd+hh:mm:SS.sss where DD=days, hh=hours, mm=minutes,
SS=sec, and sss=millisec. It "wraps" after 49.710 days.

Error 2 [1] occurred at disk power-on lifetime: 2730 hours (113 days + 18 hours)
  When the command that caused the error occurred, the device was active or idle.

  After command completion occurred, registers were:
  ER -- ST COUNT  LBA_48  LH LM LL DV DC
  -- -- -- == -- == == == -- -- -- -- --
  40 -- 51 00 35 00 00 3e 3d 17 9b 4e 00  Error: UNC 53 sectors at LBA = 0x3e3d179b = 1044191131

  Commands leading to the command that caused the error were:
  CR FEATR COUNT  LBA_48  LH LM LL DV DC  Powered_Up_Time  Command/Feature_Name
  -- == -- == -- == == == -- -- -- -- --  ---------------  --------------------
  25 00 da 00 40 00 00 3e 3d 17 90 40 00     00:02:12.407  READ DMA EXT
  25 00 da 00 18 00 00 3e 3d 17 70 40 00     00:02:12.386  READ DMA EXT
  25 00 da 00 08 00 00 3e 3d 17 60 40 00     00:02:12.370  READ DMA EXT
  25 00 da 00 40 00 00 33 c3 74 a0 40 00     00:02:12.369  READ DMA EXT
  25 00 da 00 08 00 00 33 c3 74 90 40 00     00:02:12.369  READ DMA EXT

Error 1 [0] occurred at disk power-on lifetime: 2730 hours (113 days + 18 hours)
  When the command that caused the error occurred, the device was active or idle.

  After command completion occurred, registers were:
  ER -- ST COUNT  LBA_48  LH LM LL DV DC
  -- -- -- == -- == == == -- -- -- -- --
  40 -- 51 00 c6 00 00 3e 3b a4 8a 4e 00  Error: UNC 198 sectors at LBA = 0x3e3ba48a = 1044096138

  Commands leading to the command that caused the error were:
  CR FEATR COUNT  LBA_48  LH LM LL DV DC  Powered_Up_Time  Command/Feature_Name
  -- == -- == -- == == == -- -- -- -- --  ---------------  --------------------
  25 00 da 00 f0 00 00 3e 3b a4 60 40 00     00:02:07.815  READ DMA EXT
  25 00 da 00 20 00 00 33 c3 14 28 40 00     00:02:07.762  READ DMA EXT
  25 00 da 00 08 00 00 33 c3 14 18 40 00     00:02:07.762  READ DMA EXT
  25 00 da 00 b0 00 00 33 c3 13 60 40 00     00:02:07.760  READ DMA EXT
  25 00 da 00 40 00 00 33 c3 13 18 40 00     00:02:07.759  READ DMA EXT

SMART Extended Self-test Log Version: 1 (1 sectors)
No self-tests have been logged.  [To run self-tests, use: smartctl -t]

SMART Selective self-test log data structure revision number 1
 SPAN  MIN_LBA  MAX_LBA  CURRENT_TEST_STATUS
    1        0        0  Not_testing
    2        0        0  Not_testing
    3        0        0  Not_testing
    4        0        0  Not_testing
    5        0        0  Not_testing
Selective self-test flags (0x0):
  After scanning selected spans, do NOT read-scan remainder of disk.
If Selective self-test is pending on power-up, resume after 0 minute delay.

SCT Status Version:                  3
SCT Version (vendor specific):       1 (0x0001)
SCT Support Level:                   1
Device State:                        Active (0)
Current Temperature:                    29 Celsius
Power Cycle Min/Max Temperature:     27/29 Celsius
Lifetime    Min/Max Temperature:     18/44 Celsius
Under/Over Temperature Limit Count:   0/0

SCT Temperature History Version:     2
Temperature Sampling Period:         1 minute
Temperature Logging Interval:        1 minute
Min/Max recommended Temperature:      0/60 Celsius
Min/Max Temperature Limit:            0/60 Celsius
Temperature History Size (Index):    478 (338)

Index    Estimated Time   Temperature Celsius
 339    2020-03-01 16:31    28  *********
 ...    ..( 79 skipped).    ..  *********
 419    2020-03-01 17:51    28  *********
 420    2020-03-01 17:52    29  **********
 421    2020-03-01 17:53    29  **********
 422    2020-03-01 17:54    30  ***********
 ...    ..(  9 skipped).    ..  ***********
 432    2020-03-01 18:04    30  ***********
 433    2020-03-01 18:05    31  ************
 434    2020-03-01 18:06    31  ************
 435    2020-03-01 18:07    32  *************
 436    2020-03-01 18:08    32  *************
 437    2020-03-01 18:09    33  **************
 438    2020-03-01 18:10    33  **************
 439    2020-03-01 18:11    33  **************
 440    2020-03-01 18:12    34  ***************
 441    2020-03-01 18:13    34  ***************
 442    2020-03-01 18:14    34  ***************
 443    2020-03-01 18:15    35  ****************
 ...    ..(  8 skipped).    ..  ****************
 452    2020-03-01 18:24    35  ****************
 453    2020-03-01 18:25    36  *****************
 ...    ..(  7 skipped).    ..  *****************
 461    2020-03-01 18:33    36  *****************
 462    2020-03-01 18:34    37  ******************
 ...    ..( 23 skipped).    ..  ******************
   8    2020-03-01 18:58    37  ******************
   9    2020-03-01 18:59    38  *******************
 ...    ..( 52 skipped).    ..  *******************
  62    2020-03-01 19:52    38  *******************
  63    2020-03-01 19:53    39  ********************
 ...    ..( 23 skipped).    ..  ********************
  87    2020-03-01 20:17    39  ********************
  88    2020-03-01 20:18    40  *********************
  89    2020-03-01 20:19    39  ********************
  90    2020-03-01 20:20    40  *********************
  91    2020-03-01 20:21    39  ********************
 ...    ..( 33 skipped).    ..  ********************
 125    2020-03-01 20:55    39  ********************
 126    2020-03-01 20:56    38  *******************
 ...    ..(  2 skipped).    ..  *******************
 129    2020-03-01 20:59    38  *******************
 130    2020-03-01 21:00    37  ******************
 131    2020-03-01 21:01    37  ******************
 132    2020-03-01 21:02    36  *****************
 133    2020-03-01 21:03    36  *****************
 134    2020-03-01 21:04    36  *****************
 135    2020-03-01 21:05    35  ****************
 ...    ..(  4 skipped).    ..  ****************
 140    2020-03-01 21:10    35  ****************
 141    2020-03-01 21:11    34  ***************
 ...    ..(  2 skipped).    ..  ***************
 144    2020-03-01 21:14    34  ***************
 145    2020-03-01 21:15    33  **************
 ...    ..(  6 skipped).    ..  **************
 152    2020-03-01 21:22    33  **************
 153    2020-03-01 21:23    32  *************
 ...    ..(  8 skipped).    ..  *************
 162    2020-03-01 21:32    32  *************
 163    2020-03-01 21:33    31  ************
 ...    ..(171 skipped).    ..  ************
 335    2020-03-02 00:25    31  ************
 336    2020-03-02 00:26     ?  -
 337    2020-03-02 00:27    28  *********
 338    2020-03-02 00:28    28  *********

SCT Error Recovery Control:
           Read: Disabled
          Write: Disabled

Device Statistics (GP Log 0x04)
Page  Offset Size        Value Flags Description
0x01  =====  =               =  ===  == General Statistics (rev 2) ==
0x01  0x008  4              50  ---  Lifetime Power-On Resets
0x01  0x010  4            2896  ---  Power-on Hours
0x01  0x018  6      5086346419  ---  Logical Sectors Written
0x01  0x020  6        18248743  ---  Number of Write Commands
0x01  0x028  6       617551319  ---  Logical Sectors Read
0x01  0x030  6         8610265  ---  Number of Read Commands
0x02  =====  =               =  ===  == Free-Fall Statistics (rev 1) ==
0x02  0x010  4               4  ---  Overlimit Shock Events
0x03  =====  =               =  ===  == Rotating Media Statistics (rev 1) ==
0x03  0x008  4            1206  ---  Spindle Motor Power-on Hours
0x03  0x010  4              39  ---  Head Flying Hours
0x03  0x018  4            1486  ---  Head Load Events
0x03  0x020  4            1320  ---  Number of Reallocated Logical Sectors
0x03  0x028  4             100  ---  Read Recovery Attempts
0x03  0x030  4               0  ---  Number of Mechanical Start Failures
0x04  =====  =               =  ===  == General Errors Statistics (rev 1) ==
0x04  0x008  4               2  ---  Number of Reported Uncorrectable Errors
0x04  0x010  4               6  ---  Resets Between Cmd Acceptance and Completion
0x05  =====  =               =  ===  == Temperature Statistics (rev 1) ==
0x05  0x008  1              29  ---  Current Temperature
0x05  0x010  1              29  N--  Average Short Term Temperature
0x05  0x018  1              35  N--  Average Long Term Temperature
0x05  0x020  1              44  ---  Highest Temperature
0x05  0x028  1              18  ---  Lowest Temperature
0x05  0x030  1              39  N--  Highest Average Short Term Temperature
0x05  0x038  1              19  N--  Lowest Average Short Term Temperature
0x05  0x040  1              35  N--  Highest Average Long Term Temperature
0x05  0x048  1              23  N--  Lowest Average Long Term Temperature
0x05  0x050  4               0  ---  Time in Over-Temperature
0x05  0x058  1              60  ---  Specified Maximum Operating Temperature
0x05  0x060  4               0  ---  Time in Under-Temperature
0x05  0x068  1               0  ---  Specified Minimum Operating Temperature
0x06  =====  =               =  ===  == Transport Statistics (rev 1) ==
0x06  0x008  4              12  ---  Number of Hardware Resets
0x06  0x018  4               0  ---  Number of Interface CRC Errors
0x07  =====  =               =  ===  == Solid State Device Statistics (rev 1) ==
                                |||_ C monitored condition met
                                ||__ D supports DSN
                                |___ N normalized value

SATA Phy Event Counters (GP Log 0x11)
ID      Size     Value  Description
0x0001  4            0  Command failed due to ICRC error
0x0002  4            0  R_ERR response for data FIS
0x0003  4            0  R_ERR response for device-to-host data FIS
0x0004  4            0  R_ERR response for host-to-device data FIS
0x0005  4            0  R_ERR response for non-data FIS
0x0006  4            0  R_ERR response for device-to-host non-data FIS
0x0007  4            0  R_ERR response for host-to-device non-data FIS
0x0008  4            0  Device-to-host non-data FIS retries
0x0009  4            0  Transition from drive PhyRdy to drive PhyNRdy
0x000a  4            0  Device-to-host register FISes sent due to a COMRESET
0x000b  4            0  CRC errors within host-to-device FIS
0x000d  4            0  Non-CRC errors within host-to-device FIS
0x000f  4            0  R_ERR response for host-to-device data FIS, CRC
0x0010  4            0  R_ERR response for host-to-device data FIS, non-CRC
0x0012  4            0  R_ERR response for host-to-device non-data FIS, CRC
0x0013  4            0  R_ERR response for host-to-device non-data FIS, non-CRC

