smartctl 6.6 2016-05-31 r4324 [x86_64-linux-5.3.0-40-generic] (local build)
Copyright (C) 2002-16, Bruce Allen, Christian Franke, www.smartmontools.org

=== START OF INFORMATION SECTION ===
Device Model:     TOSHIBA MQ03ABB200
Serial Number:    371IC5YCT
LU WWN Device Id: 5 000039 7a3b80322
Firmware Version: JP050U
User Capacity:    2.000.398.934.016 bytes [2,00 TB]
Sector Sizes:     512 bytes logical, 4096 bytes physical
Rotation Rate:    5400 rpm
Form Factor:      2.5 inches
Device is:        Not in smartctl database [for details use: -P showall]
ATA Version is:   ATA8-ACS (minor revision not indicated)
SATA Version is:  SATA 3.0, 6.0 Gb/s (current: 3.0 Gb/s)
Local Time is:    Mon Mar  2 00:28:10 2020 CET
SMART support is: Available - device has SMART capability.
SMART support is: Enabled

=== START OF READ SMART DATA SECTION ===
SMART overall-health self-assessment test result: PASSED

General SMART Values:
Offline data collection status:  (0x00)	Offline data collection activity
					was never started.
					Auto Offline Data Collection: Disabled.
Self-test execution status:      (   0)	The previous self-test routine completed
					without error or no self-test has ever 
					been run.
Total time to complete Offline 
data collection: 		(  120) seconds.
Offline data collection
capabilities: 			 (0x5b) SMART execute Offline immediate.
					Auto Offline data collection on/off support.
					Suspend Offline collection upon new
					command.
					Offline surface scan supported.
					Self-test supported.
					No Conveyance Self-test supported.
					Selective Self-test supported.
SMART capabilities:            (0x0003)	Saves SMART data before entering
					power-saving mode.
					Supports SMART auto save timer.
Error logging capability:        (0x01)	Error logging supported.
					General Purpose Logging supported.
Short self-test routine 
recommended polling time: 	 (   2) minutes.
Extended self-test routine
recommended polling time: 	 ( 372) minutes.
SCT capabilities: 	       (0x003d)	SCT Status supported.
					SCT Error Recovery Control supported.
					SCT Feature Control supported.
					SCT Data Table supported.

SMART Attributes Data Structure revision number: 16
Vendor Specific SMART Attributes with Thresholds:
ID# ATTRIBUTE_NAME          FLAG     VALUE WORST THRESH TYPE      UPDATED  WHEN_FAILED RAW_VALUE
  1 Raw_Read_Error_Rate     0x000b   100   099   050    Pre-fail  Always       -       0
  2 Throughput_Performance  0x0005   100   100   050    Pre-fail  Offline      -       0
  3 Spin_Up_Time            0x0027   100   100   001    Pre-fail  Always       -       4103
  4 Start_Stop_Count        0x0032   100   100   000    Old_age   Always       -       139
  5 Reallocated_Sector_Ct   0x0033   100   100   050    Pre-fail  Always       -       1320
  7 Seek_Error_Rate         0x000b   100   100   050    Pre-fail  Always       -       0
  8 Seek_Time_Performance   0x0005   100   100   050    Pre-fail  Offline      -       0
  9 Power_On_Hours          0x0032   093   093   000    Old_age   Always       -       2896
 10 Spin_Retry_Count        0x0033   102   100   030    Pre-fail  Always       -       0
 12 Power_Cycle_Count       0x0032   100   100   000    Old_age   Always       -       50
191 G-Sense_Error_Rate      0x0032   100   100   000    Old_age   Always       -       4
192 Power-Off_Retract_Count 0x0032   100   100   000    Old_age   Always       -       13
193 Load_Cycle_Count        0x0032   100   100   000    Old_age   Always       -       1485
194 Temperature_Celsius     0x0022   100   100   000    Old_age   Always       -       28 (Min/Max 18/44)
196 Reallocated_Event_Count 0x0032   100   100   000    Old_age   Always       -       126
197 Current_Pending_Sector  0x0032   100   100   000    Old_age   Always       -       112
198 Offline_Uncorrectable   0x0030   100   100   000    Old_age   Offline      -       0
199 UDMA_CRC_Error_Count    0x0032   200   200   000    Old_age   Always       -       0
220 Disk_Shift              0x0002   100   100   000    Old_age   Always       -       0
222 Loaded_Hours            0x0032   100   100   000    Old_age   Always       -       39
223 Load_Retry_Count        0x0032   100   100   000    Old_age   Always       -       0
224 Load_Friction           0x0022   100   100   000    Old_age   Always       -       0
226 Load-in_Time            0x0026   100   100   000    Old_age   Always       -       265
240 Head_Flying_Hours       0x0001   100   100   001    Pre-fail  Offline      -       0

SMART Error Log Version: 1
ATA Error Count: 2
	CR = Command Register [HEX]
	FR = Features Register [HEX]
	SC = Sector Count Register [HEX]
	SN = Sector Number Register [HEX]
	CL = Cylinder Low Register [HEX]
	CH = Cylinder High Register [HEX]
	DH = Device/Head Register [HEX]
	DC = Device Command Register [HEX]
	ER = Error register [HEX]
	ST = Status register [HEX]
Powered_Up_Time is measured from power on, and printed as
DDd+hh:mm:SS.sss where DD=days, hh=hours, mm=minutes,
SS=sec, and sss=millisec. It "wraps" after 49.710 days.

Error 2 occurred at disk power-on lifetime: 2730 hours (113 days + 18 hours)
  When the command that caused the error occurred, the device was active or idle.

  After command completion occurred, registers were:
  ER ST SC SN CL CH DH
  -- -- -- -- -- -- --
  40 51 35 9b 17 3d 4e  Error: UNC 53 sectors at LBA = 0x0e3d179b = 238884763

  Commands leading to the command that caused the error were:
  CR FR SC SN CL CH DH DC   Powered_Up_Time  Command/Feature_Name
  -- -- -- -- -- -- -- --  ----------------  --------------------
  25 da 40 90 17 3d 40 00      00:02:12.407  READ DMA EXT
  25 da 18 70 17 3d 40 00      00:02:12.386  READ DMA EXT
  25 da 08 60 17 3d 40 00      00:02:12.370  READ DMA EXT
  25 da 40 a0 74 c3 40 00      00:02:12.369  READ DMA EXT
  25 da 08 90 74 c3 40 00      00:02:12.369  READ DMA EXT

Error 1 occurred at disk power-on lifetime: 2730 hours (113 days + 18 hours)
  When the command that caused the error occurred, the device was active or idle.

  After command completion occurred, registers were:
  ER ST SC SN CL CH DH
  -- -- -- -- -- -- --
  40 51 c6 8a a4 3b 4e  Error: UNC 198 sectors at LBA = 0x0e3ba48a = 238789770

  Commands leading to the command that caused the error were:
  CR FR SC SN CL CH DH DC   Powered_Up_Time  Command/Feature_Name
  -- -- -- -- -- -- -- --  ----------------  --------------------
  25 da f0 60 a4 3b 40 00      00:02:07.815  READ DMA EXT
  25 da 20 28 14 c3 40 00      00:02:07.762  READ DMA EXT
  25 da 08 18 14 c3 40 00      00:02:07.762  READ DMA EXT
  25 da b0 60 13 c3 40 00      00:02:07.760  READ DMA EXT
  25 da 40 18 13 c3 40 00      00:02:07.759  READ DMA EXT

SMART Self-test log structure revision number 1
No self-tests have been logged.  [To run self-tests, use: smartctl -t]

SMART Selective self-test log data structure revision number 1
 SPAN  MIN_LBA  MAX_LBA  CURRENT_TEST_STATUS
    1        0        0  Not_testing
    2        0        0  Not_testing
    3        0        0  Not_testing
    4        0        0  Not_testing
    5        0        0  Not_testing
Selective self-test flags (0x0):
  After scanning selected spans, do NOT read-scan remainder of disk.
If Selective self-test is pending on power-up, resume after 0 minute delay.

