
/dev/sdc:

ATA device, with non-removable media
	Model Number:       ST340014AS                              
	Serial Number:      5MQ233GB
	Firmware Revision:  8.12    
Standards:
	Used: ATA/ATAPI-6 T13 1410D revision 2 
	Supported: 6 5 4 
Configuration:
	Logical		max	current
	cylinders	16383	16383
	heads		16	16
	sectors/track	63	63
	--
	CHS current addressable sectors:    16514064
	LBA    user addressable sectors:    78125000
	LBA48  user addressable sectors:    78125000
	Logical/Physical Sector size:           512 bytes
	device size with M = 1024*1024:       38146 MBytes
	device size with M = 1000*1000:       40000 MBytes (40 GB)
	cache/buffer size  = 2048 KBytes
Capabilities:
	LBA, IORDY(can be disabled)
	Queue depth: 32
	Standby timer values: spec'd by Standard, no device specific minimum
	R/W multiple sector transfer: Max = 16	Current = ?
	Recommended acoustic management value: 128, current value: 0
	DMA: mdma0 mdma1 mdma2 udma0 udma1 udma2 udma3 udma4 udma5 *udma6 
	     Cycle time: min=120ns recommended=120ns
	PIO: pio0 pio1 pio2 pio3 pio4 
	     Cycle time: no flow control=240ns  IORDY flow control=120ns
Commands/features:
	Enabled	Supported:
	   *	SMART feature set
	    	Security Mode feature set
	   *	Power Management feature set
	   *	Write cache
	   *	Look-ahead
	   *	Host Protected Area feature set
	   *	WRITE_BUFFER command
	   *	READ_BUFFER command
	   *	DOWNLOAD_MICROCODE
	    	SET_MAX security extension
	    	Automatic Acoustic Management feature set
	   *	48-bit Address feature set
	   *	Device Configuration Overlay feature set
	   *	Mandatory FLUSH_CACHE
	   *	FLUSH_CACHE_EXT
	   *	SMART error logging
	   *	SMART self-test
	   *	Gen1 signaling speed (1.5Gb/s)
	   *	Native Command Queueing (NCQ)
	   *	Software settings preservation
Security: 
	Master password revision code = 65534
		supported
	not	enabled
	not	locked
	not	frozen
	not	expired: security count
	not	supported: enhanced erase

Checksum: correct
