
/dev/sdb:

ATA device, with non-removable media
	Model Number:       WDC WD800JD-55MUA1                      
	Serial Number:      WD-WMAMD6021658
	Firmware Revision:  10.01E01
Standards:
	Supported: 7 6 5 4 
	Likely used: 8
Configuration:
	Logical		max	current
	cylinders	16383	16383
	heads		16	16
	sectors/track	63	63
	--
	CHS current addressable sectors:    16514064
	LBA    user addressable sectors:   156301488
	LBA48  user addressable sectors:   156301488
	Logical/Physical Sector size:           512 bytes
	device size with M = 1024*1024:       76319 MBytes
	device size with M = 1000*1000:       80026 MBytes (80 GB)
	cache/buffer size  = 8192 KBytes
Capabilities:
	LBA, IORDY(can be disabled)
	Queue depth: 32
	Standby timer values: spec'd by Standard, with device specific minimum
	R/W multiple sector transfer: Max = 16	Current = 0
	Recommended acoustic management value: 128, current value: 128
	DMA: mdma0 mdma1 mdma2 udma0 udma1 udma2 udma3 udma4 udma5 *udma6 
	     Cycle time: min=120ns recommended=120ns
	PIO: pio0 pio1 pio2 pio3 pio4 
	     Cycle time: no flow control=120ns  IORDY flow control=120ns
Commands/features:
	Enabled	Supported:
	   *	SMART feature set
	    	Security Mode feature set
	   *	Power Management feature set
	   *	Write cache
	   *	Look-ahead
	   *	Host Protected Area feature set
	   *	WRITE_BUFFER command
	   *	READ_BUFFER command
	   *	NOP cmd
	   *	DOWNLOAD_MICROCODE
	    	SET_MAX security extension
	   *	Automatic Acoustic Management feature set
	   *	48-bit Address feature set
	   *	Device Configuration Overlay feature set
	   *	Mandatory FLUSH_CACHE
	   *	FLUSH_CACHE_EXT
	   *	SMART error logging
	   *	SMART self-test
	   *	General Purpose Logging feature set
	   *	Gen1 signaling speed (1.5Gb/s)
	   *	Gen2 signaling speed (3.0Gb/s)
	   *	Native Command Queueing (NCQ)
	   *	Host-initiated interface power management
	   *	Phy event counters
	    	DMA Setup Auto-Activate optimization
	   *	Software settings preservation
	   *	SMART Command Transport (SCT) feature set
	   *	SCT Read/Write Long (AC1), obsolete
	   *	SCT Write Same (AC2)
	   *	SCT Error Recovery Control (AC3)
	   *	SCT Features Control (AC4)
	   *	SCT Data Tables (AC5)
	    	unknown 206[12] (vendor specific)
Security: 
	Master password revision code = 65534
		supported
	not	enabled
	not	locked
	not	frozen
	not	expired: security count
	not	supported: enhanced erase

Checksum: correct
