smartctl 6.6 2016-05-31 r4324 [x86_64-linux-5.3.0-40-generic] (local build)
Copyright (C) 2002-16, Bruce Allen, Christian Franke, www.smartmontools.org

=== START OF INFORMATION SECTION ===
Model Family:     Seagate Pipeline HD 5900.2
Device Model:     ST3500312CS
Serial Number:    6VVE41C1
LU WWN Device Id: 5 000c50 0465ab901
Firmware Version: SS16
User Capacity:    500.107.862.016 bytes [500 GB]
Sector Size:      512 bytes logical/physical
Rotation Rate:    5900 rpm
Device is:        In smartctl database [for details use: -P show]
ATA Version is:   ATA8-ACS T13/1699-D revision 4
SATA Version is:  SATA 2.6, 3.0 Gb/s (current: 3.0 Gb/s)
Local Time is:    Sat Feb 29 19:17:48 2020 CET
SMART support is: Available - device has SMART capability.
SMART support is: Enabled
AAM feature is:   Unavailable
APM level is:     192 (intermediate level without standby)
Rd look-ahead is: Enabled
Write cache is:   Enabled
ATA Security is:  Disabled, NOT FROZEN [SEC1]
Wt Cache Reorder: Unknown

=== START OF READ SMART DATA SECTION ===
SMART overall-health self-assessment test result: PASSED
See vendor-specific Attribute list for marginal Attributes.

General SMART Values:
Offline data collection status:  (0x00)	Offline data collection activity
					was never started.
					Auto Offline Data Collection: Disabled.
Self-test execution status:      (   0)	The previous self-test routine completed
					without error or no self-test has ever 
					been run.
Total time to complete Offline 
data collection: 		(  623) seconds.
Offline data collection
capabilities: 			 (0x73) SMART execute Offline immediate.
					Auto Offline data collection on/off support.
					Suspend Offline collection upon new
					command.
					No Offline surface scan supported.
					Self-test supported.
					Conveyance Self-test supported.
					Selective Self-test supported.
SMART capabilities:            (0x0003)	Saves SMART data before entering
					power-saving mode.
					Supports SMART auto save timer.
Error logging capability:        (0x01)	Error logging supported.
					General Purpose Logging supported.
Short self-test routine 
recommended polling time: 	 (   1) minutes.
Extended self-test routine
recommended polling time: 	 ( 105) minutes.
Conveyance self-test routine
recommended polling time: 	 (   2) minutes.
SCT capabilities: 	       (0x103b)	SCT Status supported.
					SCT Error Recovery Control supported.
					SCT Feature Control supported.
					SCT Data Table supported.

SMART Attributes Data Structure revision number: 10
Vendor Specific SMART Attributes with Thresholds:
ID# ATTRIBUTE_NAME          FLAGS    VALUE WORST THRESH FAIL RAW_VALUE
  1 Raw_Read_Error_Rate     POSR--   106   099   006    -    11905773
  3 Spin_Up_Time            PO----   097   097   000    -    0
  4 Start_Stop_Count        -O--CK   037   037   020    -    65535
  5 Reallocated_Sector_Ct   PO--CK   100   100   036    -    0
  7 Seek_Error_Rate         POSR--   072   060   030    -    20413581
  9 Power_On_Hours          -O--CK   056   056   000    -    38821
 10 Spin_Retry_Count        PO--C-   100   100   097    -    0
 12 Power_Cycle_Count       -O--CK   100   100   020    -    73
184 End-to-End_Error        -O--CK   100   100   099    -    0
187 Reported_Uncorrect      -O--CK   100   100   000    -    0
188 Command_Timeout         -O--CK   100   095   000    -    5
189 High_Fly_Writes         -O-RCK   100   100   000    -    0
190 Airflow_Temperature_Cel -O---K   074   045   045    Past 26 (Min/Max 25/26)
194 Temperature_Celsius     -O---K   026   055   000    -    26 (0 17 0 0 0)
195 Hardware_ECC_Recovered  -O-RC-   052   045   000    -    11905773
197 Current_Pending_Sector  -O--C-   100   100   000    -    0
198 Offline_Uncorrectable   ----C-   100   100   000    -    0
199 UDMA_CRC_Error_Count    -OSRCK   200   200   000    -    0
                            ||||||_ K auto-keep
                            |||||__ C event count
                            ||||___ R error rate
                            |||____ S speed/performance
                            ||_____ O updated online
                            |______ P prefailure warning

General Purpose Log Directory Version 1
SMART           Log Directory Version 1 [multi-sector log support]
Address    Access  R/W   Size  Description
0x00       GPL,SL  R/O      1  Log Directory
0x01       GPL,SL  R/O      1  Summary SMART error log
0x02       GPL,SL  R/O      5  Comprehensive SMART error log
0x03       GPL,SL  R/O      5  Ext. Comprehensive SMART error log
0x06       GPL,SL  R/O      1  SMART self-test log
0x07       GPL,SL  R/O      1  Extended self-test log
0x09       GPL,SL  R/W      1  Selective self-test log
0x10       GPL,SL  R/O      1  SATA NCQ Queued Error log
0x11       GPL,SL  R/O      1  SATA Phy Event Counters log
0x21       GPL,SL  R/O      1  Write stream error log
0x22       GPL,SL  R/O      1  Read stream error log
0x80-0x9f  GPL,SL  R/W     16  Host vendor specific log
0xa1       GPL,SL  VS      20  Device vendor specific log
0xa2       GPL     VS    2248  Device vendor specific log
0xa8       GPL,SL  VS     129  Device vendor specific log
0xa9       GPL,SL  VS       1  Device vendor specific log
0xb0       GPL     VS    2928  Device vendor specific log
0xbd       GPL,SL  VS     252  Device vendor specific log
0xbe-0xbf  GPL     VS   65535  Device vendor specific log
0xe0       GPL,SL  R/W      1  SCT Command/Status
0xe1       GPL,SL  R/W      1  SCT Data Transfer

SMART Extended Comprehensive Error Log Version: 1 (5 sectors)
No Errors Logged

SMART Extended Self-test Log Version: 1 (1 sectors)
No self-tests have been logged.  [To run self-tests, use: smartctl -t]

SMART Selective self-test log data structure revision number 1
 SPAN  MIN_LBA  MAX_LBA  CURRENT_TEST_STATUS
    1        0        0  Not_testing
    2        0        0  Not_testing
    3        0        0  Not_testing
    4        0        0  Not_testing
    5        0        0  Not_testing
Selective self-test flags (0x0):
  After scanning selected spans, do NOT read-scan remainder of disk.
If Selective self-test is pending on power-up, resume after 0 minute delay.

SCT Status Version:                  3
SCT Version (vendor specific):       522 (0x020a)
SCT Support Level:                   1
Device State:                        Active (0)
Current Temperature:                    25 Celsius
Power Cycle Min/Max Temperature:     25/25 Celsius
Lifetime    Min/Max Temperature:     17/55 Celsius
Under/Over Temperature Limit Count:   0/0

SCT Temperature History Version:     2
Temperature Sampling Period:         2 minutes
Temperature Logging Interval:        94 minutes
Min/Max recommended Temperature:      1/61 Celsius
Min/Max Temperature Limit:            2/60 Celsius
Temperature History Size (Index):    128 (88)

Index    Estimated Time   Temperature Celsius
  89    2020-02-21 11:04    39  ********************
  90    2020-02-21 12:38     ?  -
  91    2020-02-21 14:12    22  ***
  92    2020-02-21 15:46    22  ***
  93    2020-02-21 17:20    33  **************
  94    2020-02-21 18:54    35  ****************
  95    2020-02-21 20:28    36  *****************
  96    2020-02-21 22:02    37  ******************
  97    2020-02-21 23:36    36  *****************
  98    2020-02-22 01:10    36  *****************
  99    2020-02-22 02:44    36  *****************
 100    2020-02-22 04:18    35  ****************
 101    2020-02-22 05:52    36  *****************
 102    2020-02-22 07:26    33  **************
 103    2020-02-22 09:00    34  ***************
 104    2020-02-22 10:34    35  ****************
 ...    ..(  2 skipped).    ..  ****************
 107    2020-02-22 15:16    35  ****************
 108    2020-02-22 16:50    36  *****************
 109    2020-02-22 18:24    36  *****************
 110    2020-02-22 19:58     ?  -
 111    2020-02-22 21:32    35  ****************
 112    2020-02-22 23:06    35  ****************
 113    2020-02-23 00:40    34  ***************
 ...    ..(  3 skipped).    ..  ***************
 117    2020-02-23 06:56    34  ***************
 118    2020-02-23 08:30     ?  -
 119    2020-02-23 10:04    34  ***************
 120    2020-02-23 11:38    34  ***************
 121    2020-02-23 13:12    34  ***************
 122    2020-02-23 14:46    35  ****************
 123    2020-02-23 16:20    35  ****************
 124    2020-02-23 17:54    36  *****************
 ...    ..(  2 skipped).    ..  *****************
 127    2020-02-23 22:36    36  *****************
   0    2020-02-24 00:10     ?  -
   1    2020-02-24 01:44    21  **
   2    2020-02-24 03:18     ?  -
   3    2020-02-24 04:52    22  ***
   4    2020-02-24 06:26    22  ***
   5    2020-02-24 08:00     ?  -
   6    2020-02-24 09:34    21  **
   7    2020-02-24 11:08     ?  -
   8    2020-02-24 12:42    26  *******
   9    2020-02-24 14:16     ?  -
  10    2020-02-24 15:50    35  ****************
  11    2020-02-24 17:24     ?  -
  12    2020-02-24 18:58    24  *****
  13    2020-02-24 20:32     ?  -
  14    2020-02-24 22:06    25  ******
  15    2020-02-24 23:40     ?  -
  16    2020-02-25 01:14    24  *****
  17    2020-02-25 02:48    24  *****
  18    2020-02-25 04:22    33  **************
  19    2020-02-25 05:56     ?  -
  20    2020-02-25 07:30    25  ******
  21    2020-02-25 09:04     ?  -
  22    2020-02-25 10:38    24  *****
  23    2020-02-25 12:12     ?  -
  24    2020-02-25 13:46    23  ****
  25    2020-02-25 15:20    23  ****
  26    2020-02-25 16:54    30  ***********
  27    2020-02-25 18:28     ?  -
  28    2020-02-25 20:02    27  ********
  29    2020-02-25 21:36     ?  -
  30    2020-02-25 23:10    27  ********
  31    2020-02-26 00:44     ?  -
  32    2020-02-26 02:18    22  ***
  33    2020-02-26 03:52    22  ***
  34    2020-02-26 05:26     ?  -
  35    2020-02-26 07:00    23  ****
  36    2020-02-26 08:34     ?  -
  37    2020-02-26 10:08    24  *****
  38    2020-02-26 11:42     ?  -
  39    2020-02-26 13:16    21  **
  40    2020-02-26 14:50     ?  -
  41    2020-02-26 16:24    22  ***
  42    2020-02-26 17:58    22  ***
  43    2020-02-26 19:32    29  **********
  44    2020-02-26 21:06     ?  -
  45    2020-02-26 22:40    24  *****
  46    2020-02-27 00:14     ?  -
  47    2020-02-27 01:48    22  ***
  48    2020-02-27 03:22     ?  -
  49    2020-02-27 04:56    25  ******
  50    2020-02-27 06:30     ?  -
  51    2020-02-27 08:04    24  *****
  52    2020-02-27 09:38     ?  -
  53    2020-02-27 11:12    24  *****
  54    2020-02-27 12:46     ?  -
  55    2020-02-27 14:20    21  **
  56    2020-02-27 15:54     ?  -
  57    2020-02-27 17:28    23  ****
  58    2020-02-27 19:02     ?  -
  59    2020-02-27 20:36    21  **
  60    2020-02-27 22:10     ?  -
  61    2020-02-27 23:44    23  ****
  62    2020-02-28 01:18    23  ****
  63    2020-02-28 02:52    39  ********************
  64    2020-02-28 04:26    34  ***************
  65    2020-02-28 06:00    34  ***************
  66    2020-02-28 07:34    33  **************
  67    2020-02-28 09:08    32  *************
  68    2020-02-28 10:42    31  ************
  69    2020-02-28 12:16    31  ************
  70    2020-02-28 13:50    30  ***********
 ...    ..(  2 skipped).    ..  ***********
  73    2020-02-28 18:32    30  ***********
  74    2020-02-28 20:06    32  *************
  75    2020-02-28 21:40    34  ***************
  76    2020-02-28 23:14     ?  -
  77    2020-02-29 00:48    21  **
  78    2020-02-29 02:22    21  **
  79    2020-02-29 03:56    34  ***************
  80    2020-02-29 05:30    33  **************
  81    2020-02-29 07:04    32  *************
  82    2020-02-29 08:38    32  *************
  83    2020-02-29 10:12    32  *************
  84    2020-02-29 11:46     ?  -
  85    2020-02-29 13:20    23  ****
  86    2020-02-29 14:54     ?  -
  87    2020-02-29 16:28    25  ******
  88    2020-02-29 18:02    25  ******

SCT Error Recovery Control:
           Read: Disabled
          Write: Disabled

Device Statistics (GP/SMART Log 0x04) not supported

SATA Phy Event Counters (GP Log 0x11)
ID      Size     Value  Description
0x000a  2            1  Device-to-host register FISes sent due to a COMRESET
0x0001  2            0  Command failed due to ICRC error
0x0003  2            0  R_ERR response for device-to-host data FIS
0x0004  2            0  R_ERR response for host-to-device data FIS
0x0006  2            0  R_ERR response for device-to-host non-data FIS
0x0007  2            0  R_ERR response for host-to-device non-data FIS

