smartctl 6.6 2016-05-31 r4324 [x86_64-linux-5.3.0-40-generic] (local build)
Copyright (C) 2002-16, Bruce Allen, Christian Franke, www.smartmontools.org

=== START OF INFORMATION SECTION ===
Model Family:     Western Digital Caviar Blue Serial ATA
Device Model:     WDC WD1600AAJS-00L7A0
Serial Number:    WD-WMAV3E499032
LU WWN Device Id: 5 0014ee 0acf29e00
Firmware Version: 01.03E01
User Capacity:    160.041.885.696 bytes [160 GB]
Sector Size:      512 bytes logical/physical
Device is:        In smartctl database [for details use: -P show]
ATA Version is:   ATA8-ACS (minor revision not indicated)
SATA Version is:  SATA 2.5, 3.0 Gb/s
Local Time is:    Tue Mar  3 01:31:17 2020 CET
SMART support is: Available - device has SMART capability.
SMART support is: Enabled
AAM level is:     254 (maximum performance), recommended: 128
APM feature is:   Unavailable
Rd look-ahead is: Enabled
Write cache is:   Enabled
ATA Security is:  Disabled, NOT FROZEN [SEC1]
Wt Cache Reorder: Enabled

=== START OF READ SMART DATA SECTION ===
SMART overall-health self-assessment test result: PASSED

General SMART Values:
Offline data collection status:  (0x84)	Offline data collection activity
					was suspended by an interrupting command from host.
					Auto Offline Data Collection: Enabled.
Self-test execution status:      (   0)	The previous self-test routine completed
					without error or no self-test has ever 
					been run.
Total time to complete Offline 
data collection: 		( 3300) seconds.
Offline data collection
capabilities: 			 (0x7b) SMART execute Offline immediate.
					Auto Offline data collection on/off support.
					Suspend Offline collection upon new
					command.
					Offline surface scan supported.
					Self-test supported.
					Conveyance Self-test supported.
					Selective Self-test supported.
SMART capabilities:            (0x0003)	Saves SMART data before entering
					power-saving mode.
					Supports SMART auto save timer.
Error logging capability:        (0x01)	Error logging supported.
					General Purpose Logging supported.
Short self-test routine 
recommended polling time: 	 (   2) minutes.
Extended self-test routine
recommended polling time: 	 (  42) minutes.
Conveyance self-test routine
recommended polling time: 	 (   5) minutes.
SCT capabilities: 	       (0x3037)	SCT Status supported.
					SCT Feature Control supported.
					SCT Data Table supported.

SMART Attributes Data Structure revision number: 16
Vendor Specific SMART Attributes with Thresholds:
ID# ATTRIBUTE_NAME          FLAGS    VALUE WORST THRESH FAIL RAW_VALUE
  1 Raw_Read_Error_Rate     POSR-K   200   200   051    -    0
  3 Spin_Up_Time            POS--K   138   137   021    -    4083
  4 Start_Stop_Count        -O--CK   099   099   000    -    1081
  5 Reallocated_Sector_Ct   PO--CK   200   200   140    -    0
  7 Seek_Error_Rate         -OSR-K   200   200   000    -    0
  9 Power_On_Hours          -O--CK   085   085   000    -    11464
 10 Spin_Retry_Count        -O--CK   100   100   000    -    0
 11 Calibration_Retry_Count -O--CK   100   100   000    -    0
 12 Power_Cycle_Count       -O--CK   099   099   000    -    1074
192 Power-Off_Retract_Count -O--CK   200   200   000    -    126
193 Load_Cycle_Count        -O--CK   200   200   000    -    1081
194 Temperature_Celsius     -O---K   114   094   000    -    29
196 Reallocated_Event_Count -O--CK   200   200   000    -    0
197 Current_Pending_Sector  -O--CK   200   200   000    -    0
198 Offline_Uncorrectable   ----CK   200   200   000    -    0
199 UDMA_CRC_Error_Count    -O--CK   200   200   000    -    0
200 Multi_Zone_Error_Rate   ---R--   200   200   000    -    0
                            ||||||_ K auto-keep
                            |||||__ C event count
                            ||||___ R error rate
                            |||____ S speed/performance
                            ||_____ O updated online
                            |______ P prefailure warning

General Purpose Log Directory Version 1
SMART           Log Directory Version 1 [multi-sector log support]
Address    Access  R/W   Size  Description
0x00       GPL,SL  R/O      1  Log Directory
0x01           SL  R/O      1  Summary SMART error log
0x02           SL  R/O      5  Comprehensive SMART error log
0x03       GPL     R/O      6  Ext. Comprehensive SMART error log
0x06           SL  R/O      1  SMART self-test log
0x07       GPL     R/O      1  Extended self-test log
0x09           SL  R/W      1  Selective self-test log
0x10       GPL     R/O      1  SATA NCQ Queued Error log
0x11       GPL     R/O      1  SATA Phy Event Counters log
0x80-0x9f  GPL,SL  R/W     16  Host vendor specific log
0xa0-0xa7  GPL,SL  VS      16  Device vendor specific log
0xa8-0xb7  GPL,SL  VS       1  Device vendor specific log
0xbd       GPL,SL  VS       1  Device vendor specific log
0xc0       GPL,SL  VS       1  Device vendor specific log
0xc1       GPL     VS      24  Device vendor specific log
0xe0       GPL,SL  R/W      1  SCT Command/Status
0xe1       GPL,SL  R/W      1  SCT Data Transfer

SMART Extended Comprehensive Error Log Version: 1 (6 sectors)
No Errors Logged

SMART Extended Self-test Log Version: 1 (1 sectors)
No self-tests have been logged.  [To run self-tests, use: smartctl -t]

SMART Selective self-test log data structure revision number 1
 SPAN  MIN_LBA  MAX_LBA  CURRENT_TEST_STATUS
    1        0        0  Not_testing
    2        0        0  Not_testing
    3        0        0  Not_testing
    4        0        0  Not_testing
    5        0        0  Not_testing
Selective self-test flags (0x0):
  After scanning selected spans, do NOT read-scan remainder of disk.
If Selective self-test is pending on power-up, resume after 0 minute delay.

SCT Status Version:                  2
SCT Version (vendor specific):       258 (0x0102)
SCT Support Level:                   1
Device State:                        SMART Off-line Data Collection executing in background (4)
Current Temperature:                    29 Celsius
Power Cycle Min/Max Temperature:     29/29 Celsius
Lifetime    Min/Max Temperature:     25/49 Celsius
Under/Over Temperature Limit Count:   0/0

SCT Temperature History Version:     2
Temperature Sampling Period:         1 minute
Temperature Logging Interval:        1 minute
Min/Max recommended Temperature:      0/60 Celsius
Min/Max Temperature Limit:           -41/85 Celsius
Temperature History Size (Index):    478 (281)

Index    Estimated Time   Temperature Celsius
 282    2020-03-02 17:34    35  ****************
 283    2020-03-02 17:35    35  ****************
 284    2020-03-02 17:36    35  ****************
 285    2020-03-02 17:37    36  *****************
 286    2020-03-02 17:38    36  *****************
 287    2020-03-02 17:39    35  ****************
 ...    ..(  4 skipped).    ..  ****************
 292    2020-03-02 17:44    35  ****************
 293    2020-03-02 17:45     ?  -
 294    2020-03-02 17:46    24  *****
 295    2020-03-02 17:47    25  ******
 296    2020-03-02 17:48     ?  -
 297    2020-03-02 17:49    26  *******
 298    2020-03-02 17:50    26  *******
 299    2020-03-02 17:51    27  ********
 300    2020-03-02 17:52    28  *********
 301    2020-03-02 17:53    29  **********
 302    2020-03-02 17:54    30  ***********
 303    2020-03-02 17:55     ?  -
 304    2020-03-02 17:56    29  **********
 305    2020-03-02 17:57    39  ********************
 ...    ..(  4 skipped).    ..  ********************
 310    2020-03-02 18:02    39  ********************
 311    2020-03-02 18:03    40  *********************
 312    2020-03-02 18:04    39  ********************
 ...    ..( 93 skipped).    ..  ********************
 406    2020-03-02 19:38    39  ********************
 407    2020-03-02 19:39    38  *******************
 408    2020-03-02 19:40    39  ********************
 409    2020-03-02 19:41    39  ********************
 410    2020-03-02 19:42    38  *******************
 ...    ..(  3 skipped).    ..  *******************
 414    2020-03-02 19:46    38  *******************
 415    2020-03-02 19:47    39  ********************
 ...    ..(  6 skipped).    ..  ********************
 422    2020-03-02 19:54    39  ********************
 423    2020-03-02 19:55    38  *******************
 ...    ..(  4 skipped).    ..  *******************
 428    2020-03-02 20:00    38  *******************
 429    2020-03-02 20:01    39  ********************
 ...    ..(  9 skipped).    ..  ********************
 439    2020-03-02 20:11    39  ********************
 440    2020-03-02 20:12    38  *******************
 ...    ..(  9 skipped).    ..  *******************
 450    2020-03-02 20:22    38  *******************
 451    2020-03-02 20:23    39  ********************
 ...    ..(  3 skipped).    ..  ********************
 455    2020-03-02 20:27    39  ********************
 456    2020-03-02 20:28    38  *******************
 ...    ..( 20 skipped).    ..  *******************
 477    2020-03-02 20:49    38  *******************
   0    2020-03-02 20:50    37  ******************
 ...    ..( 15 skipped).    ..  ******************
  16    2020-03-02 21:06    37  ******************
  17    2020-03-02 21:07    36  *****************
 ...    ..(  2 skipped).    ..  *****************
  20    2020-03-02 21:10    36  *****************
  21    2020-03-02 21:11    37  ******************
 ...    ..(  2 skipped).    ..  ******************
  24    2020-03-02 21:14    37  ******************
  25    2020-03-02 21:15    36  *****************
  26    2020-03-02 21:16    36  *****************
  27    2020-03-02 21:17    37  ******************
 ...    ..( 11 skipped).    ..  ******************
  39    2020-03-02 21:29    37  ******************
  40    2020-03-02 21:30    36  *****************
  41    2020-03-02 21:31    36  *****************
  42    2020-03-02 21:32    37  ******************
 ...    ..( 22 skipped).    ..  ******************
  65    2020-03-02 21:55    37  ******************
  66    2020-03-02 21:56    36  *****************
  67    2020-03-02 21:57    36  *****************
  68    2020-03-02 21:58    37  ******************
  69    2020-03-02 21:59    36  *****************
 ...    ..( 58 skipped).    ..  *****************
 128    2020-03-02 22:58    36  *****************
 129    2020-03-02 22:59    35  ****************
 ...    ..(  6 skipped).    ..  ****************
 136    2020-03-02 23:06    35  ****************
 137    2020-03-02 23:07    36  *****************
 ...    ..(  2 skipped).    ..  *****************
 140    2020-03-02 23:10    36  *****************
 141    2020-03-02 23:11    35  ****************
 142    2020-03-02 23:12    36  *****************
 ...    ..( 18 skipped).    ..  *****************
 161    2020-03-02 23:31    36  *****************
 162    2020-03-02 23:32    35  ****************
 163    2020-03-02 23:33    35  ****************
 164    2020-03-02 23:34    35  ****************
 165    2020-03-02 23:35    36  *****************
 166    2020-03-02 23:36    36  *****************
 167    2020-03-02 23:37    36  *****************
 168    2020-03-02 23:38    35  ****************
 ...    ..(  7 skipped).    ..  ****************
 176    2020-03-02 23:46    35  ****************
 177    2020-03-02 23:47    36  *****************
 ...    ..(  7 skipped).    ..  *****************
 185    2020-03-02 23:55    36  *****************
 186    2020-03-02 23:56    35  ****************
 187    2020-03-02 23:57    35  ****************
 188    2020-03-02 23:58    36  *****************
 ...    ..( 11 skipped).    ..  *****************
 200    2020-03-03 00:10    36  *****************
 201    2020-03-03 00:11    35  ****************
 202    2020-03-03 00:12    35  ****************
 203    2020-03-03 00:13    35  ****************
 204    2020-03-03 00:14    36  *****************
 ...    ..(  6 skipped).    ..  *****************
 211    2020-03-03 00:21    36  *****************
 212    2020-03-03 00:22    35  ****************
 ...    ..(  2 skipped).    ..  ****************
 215    2020-03-03 00:25    35  ****************
 216    2020-03-03 00:26    36  *****************
 217    2020-03-03 00:27    35  ****************
 ...    ..(  2 skipped).    ..  ****************
 220    2020-03-03 00:30    35  ****************
 221    2020-03-03 00:31    36  *****************
 ...    ..( 11 skipped).    ..  *****************
 233    2020-03-03 00:43    36  *****************
 234    2020-03-03 00:44    35  ****************
 ...    ..(  6 skipped).    ..  ****************
 241    2020-03-03 00:51    35  ****************
 242    2020-03-03 00:52    36  *****************
 ...    ..(  5 skipped).    ..  *****************
 248    2020-03-03 00:58    36  *****************
 249    2020-03-03 00:59    35  ****************
 ...    ..( 18 skipped).    ..  ****************
 268    2020-03-03 01:18    35  ****************
 269    2020-03-03 01:19    36  *****************
 ...    ..(  3 skipped).    ..  *****************
 273    2020-03-03 01:23    36  *****************
 274    2020-03-03 01:24    35  ****************
 ...    ..(  4 skipped).    ..  ****************
 279    2020-03-03 01:29    35  ****************
 280    2020-03-03 01:30    36  *****************
 281    2020-03-03 01:31    36  *****************

SCT Error Recovery Control command not supported

Device Statistics (GP/SMART Log 0x04) not supported

SATA Phy Event Counters (GP Log 0x11)
ID      Size     Value  Description
0x0001  2            0  Command failed due to ICRC error
0x0002  2            0  R_ERR response for data FIS
0x0003  2            0  R_ERR response for device-to-host data FIS
0x0004  2            0  R_ERR response for host-to-device data FIS
0x0005  2            0  R_ERR response for non-data FIS
0x0006  2            0  R_ERR response for device-to-host non-data FIS
0x0007  2            0  R_ERR response for host-to-device non-data FIS
0x000a  2            1  Device-to-host register FISes sent due to a COMRESET
0x8000  4           58  Vendor specific

